web-scraper-order,web-scraper-start-url,article_links,article_links-href,title,subtitle,author,date,content
"1574567380-10933","https://www.foxnews.com/search-results/search?q=elizabeth%20warren&ss=fn&section.path=fnc/politics&type=story&start=24","Elizabeth Warren calls for higher taxes, NRA investigation as part of gun control plan","https://www.foxnews.com/politics/elizabeth-warren-taxes-nra-investigation-gun-control","Elizabeth Warren calls for higher taxes, NRA investigation as part of gun control plan","Elizabeth Warren calls for higher taxes, NRA investigation as part of gun control plan","","August 10","“The NRA is accused of exploiting loopholes in federal laws governing non-profit spending to divert member dues into lavish payments for its board members and senior leadership,” she says. “I’ll appoint an attorney general committed to investigating these types of corrupt business practices, and the banks and third-party vendors — like Wells Fargo — that enabled the NRA to skirt the rules for so long.”"
"1574567546-11189","https://www.foxnews.com/search-results/search?q=elizabeth%20warren&ss=fn&section.path=fnc/politics&type=story&start=6","Elizabeth Warren calls Trump a white supremacist","https://www.foxnews.com/politics/elizabeth-warren-calls-trump-a-white-supremacist","Elizabeth Warren calls Trump a white supremacist","Elizabeth Warren calls Trump a white supremacist","","August 8","Trump told reporters on Wednesday that “any group of hate” concerns him."
"1574567461-11036","https://www.foxnews.com/search-results/search?q=elizabeth%20warren&ss=fn&section.path=fnc/politics&type=story&start=15","Elizabeth Warren calls to ban privately run federal prisons","https://www.foxnews.com/politics/warren-vows-to-scrap-privately-run-federal-prisons-as-she-rolls-out-a-new-plan","Elizabeth Warren calls to ban privately run federal prisons","Elizabeth Warren calls to ban privately run federal prisons","Paul Steinhauser","June 21",""
"1574567143-10578","https://www.foxnews.com/search-results/search?q=elizabeth%20warren&ss=fn&section.path=fnc/politics&type=story&start=49","Warren vows $1T for communities hit hard by industrial pollution","https://www.foxnews.com/politics/warren-vows-1t-for-communities-hit-hard-by-industrial-pollution","Warren vows $1T for communities hit hard by industrial pollution","Warren vows $1T for communities hit hard by industrial pollution","","October 9","Warren’s environmental justice policy comes ahead of a campaign swing through South Carolina, California, and Nevada later in the week."
"1574567554-11199","https://www.foxnews.com/search-results/search?q=elizabeth%20warren&ss=fn&section.path=fnc/politics&type=story&start=5","Mayor of Pocahontas backs Joe Biden, not Elizabeth Warren","https://www.foxnews.com/politics/mayor-pocahontas-iowa-backs-joe-biden-elizabeth-warren","Mayor of Pocahontas backs Joe Biden, not Elizabeth Warren","Mayor of Pocahontas backs Joe Biden, not Elizabeth Warren","","November 9","""Like anyone who has been honest with themselves, I know I have made mistakes,"" Warren said. ""I am sorry for the harm I have caused."""
"1574567097-10499","https://www.foxnews.com/search-results/search?q=elizabeth%20warren&ss=fn&section.path=fnc/politics&type=story&start=54","Elizabeth Warren says doctors, nurses don't treat black women same way as other women","https://www.foxnews.com/politics/elizabeth-warren-doctors-nurses-black-women","Elizabeth Warren says doctors, nurses don't treat black women same way as other women","Elizabeth Warren says doctors, nurses don't treat black women same way as other women","","April 26","The Massachusetts senator announced on stage a plan to decrease the childbirth mortality rate among black women while identifying a systematic problem with how they are treated."
"1574567115-10525","https://www.foxnews.com/search-results/search?q=elizabeth%20warren&ss=fn&section.path=fnc/politics&type=story&start=52","Prof challenges Facebook for removing Warren controversy page","https://www.foxnews.com/politics/facebook-elizabeth-warrens-controversies","Prof challenges Facebook for removing Warren controversy page","Prof challenges Facebook for removing Warren controversy page","","October 1","“All I know is the last couple of days there was a Twitter war between Bernie and Warren supporters, and Bernie’s supporters were linking to the wiki website,” he said. “It might be pure coincidence or it might be that someone decided to complain to Facebook about the page.”"
