web-scraper-order,web-scraper-start-url,article_links,article_links-href,title,subtitle,author,date,content
"1574567134-10566","https://www.foxnews.com/search-results/search?q=elizabeth%20warren&ss=fn&section.path=fnc/politics&type=story&start=50","Elizabeth Warren is latest 2020 Dem to snag Time magazine cover spot","https://www.foxnews.com/politics/elizabeth-warren-is-latest-2020-dem-to-snag-time-magazine-cover-spot","Elizabeth Warren is latest 2020 Dem to snag Time magazine cover spot","Elizabeth Warren is latest 2020 Dem to snag Time magazine cover spot","","May 9","One of Time's more controversial covers of the president happened as the administration struggled to deal with criticism over family separations at the southern border. The cover, introduced as a reflection on ""Trump's border separation policy,"" included a much-circulated photo of a crying migrant girl who had, in fact, not been separated from her parents."
"1574567331-10864","https://www.foxnews.com/search-results/search?q=elizabeth%20warren&ss=fn&section.path=fnc/politics&type=story&start=29","Elizabeth Warren says she wants to eliminate the Electoral College","https://www.foxnews.com/politics/elizabeth-warren-says-she-supports-eliminating-the-electoral-college-during-presidential-town-hall","Elizabeth Warren says she wants to eliminate the Electoral College","Elizabeth Warren says she wants to eliminate the Electoral College","","March 19","GET THE FOX NEWS APP"
"1574566950-10270","https://www.foxnews.com/search-results/search?q=elizabeth%20warren&ss=fn&section.path=fnc/politics&type=story&start=70","Elizabeth Warren pitches policies totaling $100 trillion at town hall: estimates","https://www.foxnews.com/politics/elizabeth-warren-policies-100-trillion-town-hall","Elizabeth Warren pitches policies totaling $100 trillion at town hall: estimates","Elizabeth Warren pitches policies totaling $100 trillion at town hall: estimates","","March 19","“We get a 2 percent tax on the 75,000 richest families in this country, we would have enough money to provide universal childcare, universal pre-k, universal pre-pre-k for every child in America and still have $2 trillion left over. Let’s make it happen.”"
"1574567023-10404","https://www.foxnews.com/search-results/search?q=elizabeth%20warren&ss=fn&section.path=fnc/politics&type=story&start=62","Warren told pro-school-choice activist she sent her kids to public school, campaign says otherwise","https://www.foxnews.com/politics/warren-told-pro-school-choice-activist-she-sent-her-children-to-public-school-her-campaign-confirms-otherwise","Warren told pro-school-choice activist she sent her kids to public school, campaign says otherwise","Warren told pro-school-choice activist she sent her kids to public school, campaign says otherwise","","1 day ago","“All right, so let’s talk a little,” Warren said, attempting to engage with the dissenters."
"1574567444-11001","https://www.foxnews.com/search-results/search?q=elizabeth%20warren&ss=fn&section.path=fnc/politics&type=story&start=17","Elizabeth Warren surges on flattering profiles, pundit praise","https://www.foxnews.com/politics/elizabeth-warren-surges-on-flattering-profiles-pundit-praise","Elizabeth Warren surges on flattering profiles, pundit praise","Elizabeth Warren surges on flattering profiles, pundit praise","","June 18","Two, many political journalists and commentators are more enamored of Warren's liberal politics. Biden is simply too moderate for them, too incremental in his approach."
"1574567217-10711","https://www.foxnews.com/search-results/search?q=elizabeth%20warren&ss=fn&section.path=fnc/politics&type=story&start=41","Warren campaign reports break-in at New Hampshire headquarters","https://www.foxnews.com/politics/warren-campaign-reports-a-break-in-at-the-new-hampshire-headquarters","Warren campaign reports break-in at New Hampshire headquarters","Warren campaign reports break-in at New Hampshire headquarters","","October 24","Warren campaign New Hampshire communications director Andrew Taverrite said in a statement that on Wednesday night, “the Manchester office for NH for Warren was broken into along with other offices in the same building. Upon discovering the break-in this morning, campaign staff took immediate action and filed a report with the police.”"
"1574567217-10709","https://www.foxnews.com/search-results/search?q=elizabeth%20warren&ss=fn&section.path=fnc/politics&type=story&start=41","Warren campaign reports break-in at New Hampshire headquarters","https://www.foxnews.com/politics/warren-campaign-reports-a-break-in-at-the-new-hampshire-headquarters","Warren campaign reports break-in at New Hampshire headquarters","Warren campaign reports break-in at New Hampshire headquarters","Paul Steinhauser","October 24",""
"1574567350-10900","https://www.foxnews.com/search-results/search?q=elizabeth%20warren&ss=fn&section.path=fnc/politics&type=story&start=27","Elizabeth Warren on Wells Fargo CEO’s resignation: ‘About damn time’","https://www.foxnews.com/politics/elizabeth-warren-on-wells-fargo-ceos-resignation-about-dam-time","Elizabeth Warren on Wells Fargo CEO’s resignation: ‘About damn time’","Elizabeth Warren on Wells Fargo CEO’s resignation: ‘About damn time’","","March 29","“Tim Sloan needed to go, and he should not take a huge payout with him. But Wells Fargo’s mismanagement is about more than one CEO – this bank needs a complete culture shift,” Sen. Sherrod Brown of Ohio tweeted Thursday."
"1574567444-11004","https://www.foxnews.com/search-results/search?q=elizabeth%20warren&ss=fn&section.path=fnc/politics&type=story&start=17","Elizabeth Warren surges on flattering profiles, pundit praise","https://www.foxnews.com/politics/elizabeth-warren-surges-on-flattering-profiles-pundit-praise","Elizabeth Warren surges on flattering profiles, pundit praise","Elizabeth Warren surges on flattering profiles, pundit praise","","June 18","Having been embarrassed by Biden's dominance, they'd love the vindication of seeing him fade — and the wokeness of the Democrats not nominating a white male."
"1574567489-11099","https://www.foxnews.com/search-results/search?q=elizabeth%20warren&ss=fn&section.path=fnc/politics&type=story&start=12","Elizabeth Warren grabs spotlight, MSNBC barely challenges Dem candidates","https://www.foxnews.com/politics/elizabeth-warren-grabs-spotlight-msnbc-barely-challenges-dem-candidates","Elizabeth Warren grabs spotlight, MSNBC barely challenges Dem candidates","Elizabeth Warren grabs spotlight, MSNBC barely challenges Dem candidates","","June 26","In fact, Gabbard’s sister tweeted on her account: “It's clear who MSNBC wants to be president: Elizabeth Warren. They're giving her more time than all the other candidates combined.” (This was literally untrue.)"
"1574567407-10948","https://www.foxnews.com/search-results/search?q=elizabeth%20warren&ss=fn&section.path=fnc/politics&type=story&start=21","Elizabeth Warren calls for Trump impeachment, dismisses McConnell's 'case closed'","https://www.foxnews.com/politics/elizabeth-warren-trump-impeachment-mcconnell","Elizabeth Warren calls for Trump impeachment, dismisses McConnell's 'case closed'","Elizabeth Warren calls for Trump impeachment, dismisses McConnell's 'case closed'","","May 7","Democratic presidential candidate Elizabeth Warren, D-Mass., took to the Senate floor to counter Majority Leader Mitch McConnell's declaration of “case closed” on Tuesday in regards to the Russia probe."
"1574567171-10618","https://www.foxnews.com/search-results/search?q=elizabeth%20warren&ss=fn&section.path=fnc/politics&type=story&start=46","GOP pollster says Pete Buttigieg's policies are in line with Bernie Sanders and Elizabeth Warren","https://www.foxnews.com/politics/gop-pollster-pete-buttigieg-policies-in-line-with-bernie-sanders-elizabeth-warren","GOP pollster says Pete Buttigieg's policies are in line with Bernie Sanders and Elizabeth Warren","GOP pollster says Pete Buttigieg's policies are in line with Bernie Sanders and Elizabeth Warren","Anna Hopkins","May 20",""
"1574567153-10593","https://www.foxnews.com/search-results/search?q=elizabeth%20warren&ss=fn&section.path=fnc/politics&type=story&start=48","Elizabeth Warren drinks beer, gives 2020 thoughts in Instagram livestream","https://www.foxnews.com/politics/warren-drinks-beer-gives-2020-thoughts-in-instagram-livestream","Elizabeth Warren drinks beer, gives 2020 thoughts in Instagram livestream","Elizabeth Warren drinks beer, gives 2020 thoughts in Instagram livestream","","December 31","""Here it is -- getting ready for New Year's Eve. It's easy for Bruce and I to make plans, because we pretty much do the same things every year,"" Warren said. ""Um, for New Year's Eve we watch Casablanca, we get some good food ... and, um, we sit there upstairs and we watch Casablanca."" She added that the movie ""fills me with hope."""
"1574567426-10977","https://www.foxnews.com/search-results/search?q=elizabeth%20warren&ss=fn&section.path=fnc/politics&type=story&start=19","Elizabeth Warren accuses Trump of 'enriching' himself by suggesting Pence stay at his Ireland hotel","https://www.foxnews.com/politics/elizabeth-warren-trump-pence-ireland-hotel","Elizabeth Warren accuses Trump of 'enriching' himself by suggesting Pence stay at his Ireland hotel","Elizabeth Warren accuses Trump of 'enriching' himself by suggesting Pence stay at his Ireland hotel","","September 5","CLICK HERE FOR THE FOX NEWS APP"
"1574567106-10508","https://www.foxnews.com/search-results/search?q=elizabeth%20warren&ss=fn&section.path=fnc/politics&type=story&start=53","Warren under fire for biography, again","https://www.foxnews.com/politics/warren-under-fire-for-biography-again","Warren under fire for biography, again","Warren under fire for biography, again","Chris Stirewalt","October 8",""
"1574566950-10254","https://www.foxnews.com/search-results/search?q=elizabeth%20warren&ss=fn&section.path=fnc/politics&type=story&start=70","Elizabeth Warren pitches policies totaling $100 trillion at town hall: estimates","https://www.foxnews.com/politics/elizabeth-warren-policies-100-trillion-town-hall","Elizabeth Warren pitches policies totaling $100 trillion at town hall: estimates","Elizabeth Warren pitches policies totaling $100 trillion at town hall: estimates","","March 19","ELIZABETH WARREN INSISTS HER CAREER WASN'T ADVANCED BECAUSE OF NATIVE AMERICAN HERITAGE CLAIM"
"1574567198-10696","https://www.foxnews.com/search-results/search?q=elizabeth%20warren&ss=fn&section.path=fnc/politics&type=story&start=43","2020 Dem Elizabeth Warren proposes law saying a president can be indicted","https://www.foxnews.com/politics/warren-unveils-plan-to-make-sure-future-presidents-can-be-indicted","2020 Dem Elizabeth Warren proposes law saying a president can be indicted","2020 Dem Elizabeth Warren proposes law saying a president can be indicted","","May 31","So far, only around 40 representatives in the 435-member House have called for the start of an impeachment inquiry. Warren is one of around ten Democratic presidential candidates – in a 24 person field – to urge the House to begin impeachment proceedings."
"1574567331-10861","https://www.foxnews.com/search-results/search?q=elizabeth%20warren&ss=fn&section.path=fnc/politics&type=story&start=29","Elizabeth Warren says she wants to eliminate the Electoral College","https://www.foxnews.com/politics/elizabeth-warren-says-she-supports-eliminating-the-electoral-college-during-presidential-town-hall","Elizabeth Warren says she wants to eliminate the Electoral College","Elizabeth Warren says she wants to eliminate the Electoral College","","March 19","Warren’s statement on CNN came after an audience member asked the Massachusetts senator about voting rights and so-called voter suppression laws."
"1574567032-10409","https://www.foxnews.com/search-results/search?q=elizabeth%20warren&ss=fn&section.path=fnc/politics&type=story&start=61","Ayanna Pressley, in break from the 'Squad,' backs Warren for president","https://www.foxnews.com/politics/ayanna-pressley-backs-warren-for-2020","Ayanna Pressley, in break from the 'Squad,' backs Warren for president","Ayanna Pressley, in break from the 'Squad,' backs Warren for president","","November 6","“This election is a fight for the very soul of our nation. Elizabeth knows how to fight and knows how to win,” she said in a video statement. “I’m proud to call her my senator. I can’t wait to call her our president.”"
"1574566950-10268","https://www.foxnews.com/search-results/search?q=elizabeth%20warren&ss=fn&section.path=fnc/politics&type=story&start=70","Elizabeth Warren pitches policies totaling $100 trillion at town hall: estimates","https://www.foxnews.com/politics/elizabeth-warren-policies-100-trillion-town-hall","Elizabeth Warren pitches policies totaling $100 trillion at town hall: estimates","Elizabeth Warren pitches policies totaling $100 trillion at town hall: estimates","","March 19","CLICK HERE TO GET THE FOX NEWS APP"
"1574567453-11023","https://www.foxnews.com/search-results/search?q=elizabeth%20warren&ss=fn&section.path=fnc/politics&type=story&start=16","Trump backers torment Elizabeth Warren in Nevada: 'Don't impeach!' 'Go home!'","https://www.foxnews.com/politics/elizabeth-warren-dogged-by-trump-supporters-in-nevada","Trump backers torment Elizabeth Warren in Nevada: 'Don't impeach!' 'Go home!'","Trump backers torment Elizabeth Warren in Nevada: 'Don't impeach!' 'Go home!'","Brie Stimson","October 3",""
"1574567538-11183","https://www.foxnews.com/search-results/search?q=elizabeth%20warren&ss=fn&section.path=fnc/politics&type=story&start=7","Elizabeth Warren calls to decriminalize border crossings","https://www.foxnews.com/politics/elizabeth-warren-calls-to-decriminalize-border-crossings","Elizabeth Warren calls to decriminalize border crossings","Elizabeth Warren calls to decriminalize border crossings","","June 25","CLICK HERE TO GET THE FOX NEWS APP"
"1574567061-10463","https://www.foxnews.com/search-results/search?q=elizabeth%20warren&ss=fn&section.path=fnc/politics&type=story&start=58","Elizabeth Warren doubles down on Trump impeachment push, says it's ‘bigger than politics’","https://www.foxnews.com/politics/elizabeth-warren-trump-impeachment","Elizabeth Warren doubles down on Trump impeachment push, says it's ‘bigger than politics’","Elizabeth Warren doubles down on Trump impeachment push, says it's ‘bigger than politics’","","April 20","Fox News’ Elina Shirazi, Judson Berger and Paulina Dedaj contributed to this report."
"1574567518-11160","https://www.foxnews.com/search-results/search?q=elizabeth%20warren&ss=fn&section.path=fnc/politics&type=story&start=9","Elizabeth Warren rally with Ayanna Pressley brought to brief halt by pro school-choice protesters","https://www.foxnews.com/politics/elizabeth-warren-rally-with-ayanna-pressley-in-atlanta-halted-by-protesters","Elizabeth Warren rally with Ayanna Pressley brought to brief halt by pro school-choice protesters","Elizabeth Warren rally with Ayanna Pressley brought to brief halt by pro school-choice protesters","","1 day ago","She said, “We are grateful for your activism and your voice and you are welcome here and we would love to convene after this about the issue that you are here to stoke our consciousness about.”"
"1574567572-11236","https://www.foxnews.com/search-results/search?q=elizabeth%20warren&ss=fn&section.path=fnc/politics&type=story&start=3","Bernie Sanders slams Elizabeth Warren as ‘capitalist’","https://www.foxnews.com/politics/dividing-lines-bernie-sanders-slams-elizabeth-warren-as-capitalist","Bernie Sanders slams Elizabeth Warren as ‘capitalist’","Bernie Sanders slams Elizabeth Warren as ‘capitalist’","","October 14","The plan unveiled by Sanders seeks a 1 percent levy on households worth more than $32 million and proposes tax rates that would increase for wealthier people, up to 8 percent for fortunes in excess of $10 billion."
"1574567323-10843","https://www.foxnews.com/search-results/search?q=elizabeth%20warren&ss=fn&section.path=fnc/politics&type=story&start=30","Boston Globe Editorial Board: Elizabeth Warren should think carefully about run against Trump","https://www.foxnews.com/politics/boston-globe-editorial-board-elizabeth-warren-should-think-carefully-about-run-against-trump-in-2020","Boston Globe Editorial Board: Elizabeth Warren should think carefully about run against Trump","Boston Globe Editorial Board: Elizabeth Warren should think carefully about run against Trump","","December 6","It's a far cry from 2015, when the board wrote: “Democrats would be making a big mistake if they let Hillary Clinton coast to the presidential nomination without real opposition, and, as a national leader, Massachusetts Senator Elizabeth Warren can make sure that doesn’t happen. While Warren has repeatedly vowed that she won’t run for president herself, she ought to reconsider.”"
"1574567023-10397","https://www.foxnews.com/search-results/search?q=elizabeth%20warren&ss=fn&section.path=fnc/politics&type=story&start=62","Warren told pro-school-choice activist she sent her kids to public school, campaign says otherwise","https://www.foxnews.com/politics/warren-told-pro-school-choice-activist-she-sent-her-children-to-public-school-her-campaign-confirms-otherwise","Warren told pro-school-choice activist she sent her kids to public school, campaign says otherwise","Warren told pro-school-choice activist she sent her kids to public school, campaign says otherwise","","1 day ago","""Elizabeth's daughter went to public school. Her son went to public school until 5th grade,"" a Warren aide told Fox News. ""Elizabeth wants every kid to get a great education regardless of where they live, which is why her plan makes a historic investment in our public schools. Every public school should be a great school. Her plan does not affect funding for existing non-profit charter schools, but she believes we should not put public dollars behind a further expansion of charters until they are subject to the same accountability requirements as public schools."""
"1574567245-10742","https://www.foxnews.com/search-results/search?q=elizabeth%20warren&ss=fn&section.path=fnc/politics&type=story&start=38","Elizabeth Warren cannot get past 'original sin' of Native American ancestry claims, says Howie Carr","https://www.foxnews.com/politics/elizabeth-warren-native-american-ancestry-howie-carr","Elizabeth Warren cannot get past 'original sin' of Native American ancestry claims, says Howie Carr","Elizabeth Warren cannot get past 'original sin' of Native American ancestry claims, says Howie Carr","","June 4","2020 DEMOCRATS TAKE AIM AT BIDEN AT CALIFORNIA CONVENTION"
"1574567302-10824","https://www.foxnews.com/search-results/search?q=elizabeth%20warren&ss=fn&section.path=fnc/politics&type=story&start=32","Elizabeth Warren swears off 'big money' fundraisers with wealthy donors","https://www.foxnews.com/politics/elizabeth-warren-to-rely-only-on-small-dollar-donations-for-2020-campaign-vows-not-to-host-big-money-fundraisers-receptions","Elizabeth Warren swears off 'big money' fundraisers with wealthy donors","Elizabeth Warren swears off 'big money' fundraisers with wealthy donors","","February 25","Fox News' Tara Prindiville contributed to this report."
"1574567350-10891","https://www.foxnews.com/search-results/search?q=elizabeth%20warren&ss=fn&section.path=fnc/politics&type=story&start=27","Elizabeth Warren on Wells Fargo CEO’s resignation: ‘About damn time’","https://www.foxnews.com/politics/elizabeth-warren-on-wells-fargo-ceos-resignation-about-dam-time","Elizabeth Warren on Wells Fargo CEO’s resignation: ‘About damn time’","Elizabeth Warren on Wells Fargo CEO’s resignation: ‘About damn time’","","March 29","Sloan had faced calls for his resignation since taking the helm of the fourth-largest bank in the U.S. in 2016, with the mandate of cleaning it after his predecessor was forced out. Critics, including Warren and other Democrats, didn't feel Sloan was up to the task after a series of high-profile scandals that included employees illegally opening fictitious accounts in customers' names to meet aggressive sales goals and overcharging customers for mortgages and auto loans."
"1574567181-10640","https://www.foxnews.com/search-results/search?q=elizabeth%20warren&ss=fn&section.path=fnc/politics&type=story&start=45","Top Warren campaign official fired for 'inappropriate behavior'","https://www.foxnews.com/politics/rich-mcdaniel-fired-elizabeth-warren-campaign","Top Warren campaign official fired for 'inappropriate behavior'","Top Warren campaign official fired for 'inappropriate behavior'","","October 4","Details of the ""inappropriate behavior"" were not immediately available, but a source told Politico there were no reports of sexual assault."
"1574567369-10920","https://www.foxnews.com/search-results/search?q=elizabeth%20warren&ss=fn&section.path=fnc/politics&type=story&start=25","Elizabeth Warren described as ‘diehard conservative’ in school","https://www.foxnews.com/politics/elizabeth-warren-described-as-diehard-conservative-in-school","Elizabeth Warren described as ‘diehard conservative’ in school","Elizabeth Warren described as ‘diehard conservative’ in school","","April 12","“She really did have a ‘Road to Damascus’ conversion when she saw the bankrupt consumers really were suffering -- forced into bankruptcy by illness, firing or divorce—and not predators,” Johnson said."
"1574567499-11117","https://www.foxnews.com/search-results/search?q=elizabeth%20warren&ss=fn&section.path=fnc/politics&type=story&start=11","Watch: Elizabeth Warren dodges question on how she would fund 'Medicare-for-all'","https://www.foxnews.com/politics/watch-elizabeth-warren-dodges-question-on-how-she-would-fund-medicare-for-all","Watch: Elizabeth Warren dodges question on how she would fund 'Medicare-for-all'","Watch: Elizabeth Warren dodges question on how she would fund 'Medicare-for-all'","","October 21","Suggesting that Warren would never be able to pass her 'Medicare-for-all’ plan through Congress, Klobuchar said: “The difference between a plan and a pipe dream is something that you can actually get done.”"
"1574567153-10581","https://www.foxnews.com/search-results/search?q=elizabeth%20warren&ss=fn&section.path=fnc/politics&type=story&start=48","Elizabeth Warren drinks beer, gives 2020 thoughts in Instagram livestream","https://www.foxnews.com/politics/warren-drinks-beer-gives-2020-thoughts-in-instagram-livestream","Elizabeth Warren drinks beer, gives 2020 thoughts in Instagram livestream","Elizabeth Warren drinks beer, gives 2020 thoughts in Instagram livestream","","December 31","Warren announced at a news conference outside her home hours earlier Monday that she was filing paperwork to launch an exploratory committee for president, becoming the first candidate to take the major step toward a 2020 run -- and she reminded her audience that the day had been a break from her normal routine."
"1574567005-10366","https://www.foxnews.com/search-results/search?q=elizabeth%20warren&ss=fn&section.path=fnc/politics&type=story&start=64","Warren, at Iowa town hall, likes 'frame' of question on 'US-supported murder'","https://www.foxnews.com/politics/tough-question-for-warren-will-she-stop-us-supported-murder-as-president","Warren, at Iowa town hall, likes 'frame' of question on 'US-supported murder'","Warren, at Iowa town hall, likes 'frame' of question on 'US-supported murder'","","November 4","“You know,"" she continued, ""here’s how I see this. [If] we want to be a great nation, lead the world, then we need to live our values every single day. And that means we don’t support, for example, what’s going on in Yemen. The worst man-made humanitarian crisis in generations.”"
