web-scraper-order,web-scraper-start-url,article_links,article_links-href,title,subtitle,author,date,content,
"1575049467-64206","https://www.foxnews.com/search-results/search?q=joe%20biden&ss=fn&section.path=fnc/politics&type=story&start=31","Trump unloads on Biden: ‘Joe is not playing with a full deck’","https://www.foxnews.com/politics/trump-says-hed-be-thrilled-if-biden-is-the-nominee-joe-is-not-playing-with-a-full-deck","Trump unloads on Biden: ‘Joe is not playing with a full deck’","Trump unloads on Biden: ‘Joe is not playing with a full deck’","","August 9","Fox News’ Brooke Singman and Edmund DeMarche contributed to this report.","null"
"1575049645-64488","https://www.foxnews.com/search-results/search?q=joe%20biden&ss=fn&section.path=fnc/politics&type=story&start=11","Graham says he loves Joe Biden 'as a person,' but Hunter Biden's Burisma work 'doesn’t pass the smell test'","https://www.foxnews.com/politics/graham-says-he-loves-joe-biden-as-a-person-but-hunter-bidens-burisma-work-doesnt-pass-the-smell-test","Graham says he loves Joe Biden 'as a person,' but Hunter Biden's Burisma work 'doesn’t pass the smell test'","Graham says he loves Joe Biden 'as a person,' but Hunter Biden's Burisma work 'doesn’t pass the smell test'","","4 days ago","Specifically, Graham asked for documents and transcripts of conversations from 2016 between then-Vice President Biden and Poroshenko in relation to an investigation into Ukrainian natural gas company Burisma Holdings, where Hunter Biden had served as a board member. It is Trump's request for Ukraine to investigate the Bidens that has led to the ongoing impeachment inquiry against the president.","null"
"1575049701-64542","https://www.foxnews.com/search-results/search?q=joe%20biden&ss=fn&section.path=fnc/politics&type=story&start=7","Jared Kushner slams Joe Biden, claims he's been cleaning up 'messes' ex-VP left behind","https://www.foxnews.com/politics/jared-kushner-joe-biden-mess-white-house-israel-impeachment","Jared Kushner slams Joe Biden, claims he's been cleaning up 'messes' ex-VP left behind","Jared Kushner slams Joe Biden, claims he's been cleaning up 'messes' ex-VP left behind","","October 30","“Benny was a great general in the IDF [Israeli Defense Forces] and he did a great job there and served Israel tremendously, and he seems to have a good intention to try and bring good to Israel, and hopefully he will be able to work with Prime Minister Netanyahu and find a way to move forward,"" Kushner told News Israel 13.","null"
"1575049712-64594","https://www.foxnews.com/search-results/search?q=joe%20biden&ss=fn&section.path=fnc/politics&type=story&start=6","Joe Biden officially launches 2020 presidential bid","https://www.foxnews.com/politics/biden-officially-launches-2020-presidential-bid","Joe Biden officially launches 2020 presidential bid","Joe Biden officially launches 2020 presidential bid","","April 25","Fox News' Bradford Betz contributed to this report.","null"
"1575049692-64527","https://www.foxnews.com/search-results/search?q=joe%20biden&ss=fn&section.path=fnc/politics&type=story&start=8","Joe Biden defends son Hunter's Ukraine work: 'My son did nothing wrong. I did nothing wrong'","https://www.foxnews.com/politics/biden-answers-question-on-hunter-biden-my-son-did-nothing-wrong-i-did-nothing-wrong","Joe Biden defends son Hunter's Ukraine work: 'My son did nothing wrong. I did nothing wrong'","Joe Biden defends son Hunter's Ukraine work: 'My son did nothing wrong. I did nothing wrong'","","October 15","CLICK HERE TO GET THE FOX NEWS APP","null"
"1575049701-64537","https://www.foxnews.com/search-results/search?q=joe%20biden&ss=fn&section.path=fnc/politics&type=story&start=7","Jared Kushner slams Joe Biden, claims he's been cleaning up 'messes' ex-VP left behind","https://www.foxnews.com/politics/jared-kushner-joe-biden-mess-white-house-israel-impeachment","Jared Kushner slams Joe Biden, claims he's been cleaning up 'messes' ex-VP left behind","Jared Kushner slams Joe Biden, claims he's been cleaning up 'messes' ex-VP left behind","","October 30","The impeachment probe stems from a whistleblower’s complaint that President Trump, during a July phone call, asked Ukrainian President Volodymyr Zelensky to investigate the Biden family’s business dealings in the country. Trump made the request while the U.S. was withholding military aid but maintains there was no quid quo pro.","null"
"1575049503-64245","https://www.foxnews.com/search-results/search?q=joe%20biden&ss=fn&section.path=fnc/politics&type=story&start=27","Why the media are convinced Joe Biden will implode","https://www.foxnews.com/politics/why-the-media-are-convinced-joe-biden-will-implode","Why the media are convinced Joe Biden will implode","Why the media are convinced Joe Biden will implode","","April 26","""Compromised"" suggests a history of scandal, yet what Slate means is political baggage, such as his backing of a Clinton-era crime bill unpopular with black voters today. Yet I think the rank and file isn't as concerned about a vote back in 1994, or even the Anita Hill hearings, as the chattering classes.","null"
"1575049575-64348","https://www.foxnews.com/search-results/search?q=joe%20biden&ss=fn&section.path=fnc/politics&type=story&start=19","Joe Biden slammed by editor of democratic socialist magazine: 'A Biden victory is not preordained'","https://www.foxnews.com/politics/editor-at-socialist-magazine-attack-biden-in-order-to-beat-trump-in-2020","Joe Biden slammed by editor of democratic socialist magazine: 'A Biden victory is not preordained'","Joe Biden slammed by editor of democratic socialist magazine: 'A Biden victory is not preordained'","","June 6","But just as Biden pushed his climate plan, he faced even more friendly fire over his stance on abortion. His fellow 2020 Democratic candidates vehemently denounced the Hyde Amendment -- a decades-old law that blocks federal funding from going towards most abortions -- after Biden's campaign said he supported the measure.","null"
"1575049349-64014","https://www.foxnews.com/search-results/search?q=joe%20biden&ss=fn&section.path=fnc/politics&type=story&start=43","Donna Brazile on Kamala Harris confronting Joe Biden: 'It's right to bring these issues up'","https://www.foxnews.com/politics/donna-brazile-joe-biden-debate-racial-justice","Donna Brazile on Kamala Harris confronting Joe Biden: 'It's right to bring these issues up'","Donna Brazile on Kamala Harris confronting Joe Biden: 'It's right to bring these issues up'","","June 28","""It is right to bring these issues up because we need to have a conversation, not just as Democrats but as Americans,"" Brazile said during an appearance on ""Fox and Friends"" on Friday morning.","null"
"1575049358-64023","https://www.foxnews.com/search-results/search?q=joe%20biden&ss=fn&section.path=fnc/politics&type=story&start=42","Hunter Biden didn't invite father, Joe, to his recent wedding: report","https://www.foxnews.com/politics/hunter-joe-biden-wedding-no-invite","Hunter Biden didn't invite father, Joe, to his recent wedding: report","Hunter Biden didn't invite father, Joe, to his recent wedding: report","Joseph A. Wulfsohn","July 1","","null"
"1575049503-64239","https://www.foxnews.com/search-results/search?q=joe%20biden&ss=fn&section.path=fnc/politics&type=story&start=27","Why the media are convinced Joe Biden will implode","https://www.foxnews.com/politics/why-the-media-are-convinced-joe-biden-will-implode","Why the media are convinced Joe Biden will implode","Why the media are convinced Joe Biden will implode","","April 26","Biden denounced the president's term as an ""aberrant moment"" in his launch video, saying four more years would damage the country's character and ""I cannot stand by and watch that happen.""","null"
"1575049388-64072","https://www.foxnews.com/search-results/search?q=joe%20biden&ss=fn&section.path=fnc/politics&type=story&start=39","Karl Rove: Kamala Harris' hit on Joe Biden over busing wasn't as clean as we thought","https://www.foxnews.com/politics/karl-rove-kamala-harris-hit-joe-biden-over-busing","Karl Rove: Kamala Harris' hit on Joe Biden over busing wasn't as clean as we thought","Karl Rove: Kamala Harris' hit on Joe Biden over busing wasn't as clean as we thought","","July 10","""They're in favor of local busing. They're not in favor of the federal government dictating to local school districts whether they've got to bus or not.""","null"
"1575049617-64437","https://www.foxnews.com/search-results/search?q=joe%20biden&ss=fn&section.path=fnc/politics&type=story&start=14","Joe Lieberman praises Trump's China strategy, says Biden flip-flops","https://www.foxnews.com/politics/lieberman-praises-trumps-china-biden","Joe Lieberman praises Trump's China strategy, says Biden flip-flops","Joe Lieberman praises Trump's China strategy, says Biden flip-flops","","June 12","""But the president is raising another kind of issue and it really is an important one to raise, which is the kind of structural differences between our two countries,"" Lieberman continued. ""It's time for China -- it's a great economy now. Stop, if they are still stealing our trade secrets -- stop forcing American companies when they do business in China to share their technology with Chinese companies and reassure us that if we buy Chinese products you're not going to use them in some day of conflict between our two countries to compromise America.""","null"
"1575049349-64011","https://www.foxnews.com/search-results/search?q=joe%20biden&ss=fn&section.path=fnc/politics&type=story&start=43","Donna Brazile on Kamala Harris confronting Joe Biden: 'It's right to bring these issues up'","https://www.foxnews.com/politics/donna-brazile-joe-biden-debate-racial-justice","Donna Brazile on Kamala Harris confronting Joe Biden: 'It's right to bring these issues up'","Donna Brazile on Kamala Harris confronting Joe Biden: 'It's right to bring these issues up'","Anna Hopkins","June 28","","null"
"1575049645-64491","https://www.foxnews.com/search-results/search?q=joe%20biden&ss=fn&section.path=fnc/politics&type=story&start=11","Graham says he loves Joe Biden 'as a person,' but Hunter Biden's Burisma work 'doesn’t pass the smell test'","https://www.foxnews.com/politics/graham-says-he-loves-joe-biden-as-a-person-but-hunter-bidens-burisma-work-doesnt-pass-the-smell-test","Graham says he loves Joe Biden 'as a person,' but Hunter Biden's Burisma work 'doesn’t pass the smell test'","Graham says he loves Joe Biden 'as a person,' but Hunter Biden's Burisma work 'doesn’t pass the smell test'","","4 days ago","Speaking on Fox News’ “Hannity” on Wednesday night, Graham said the phone calls between Biden and Poroshenko coincided with the time frame in which Ukrainian prosecutor Viktor Shokin was fired. Shokin was investigating Burisma Holdings at a time when Hunter Biden sat on its board and while the vice president was leading the Obama administration's diplomatic dealings with Kiev. Though the timing raised concerns among anti-corruption advocates, many Western nations had supported Shokin’s firing.","null"
"1575049738-64636","https://www.foxnews.com/search-results/search?q=joe%20biden&ss=fn&section.path=fnc/politics&type=story&start=3","Mayor of Pocahontas backs Joe Biden, not Elizabeth Warren","https://www.foxnews.com/politics/mayor-pocahontas-iowa-backs-joe-biden-elizabeth-warren","Mayor of Pocahontas backs Joe Biden, not Elizabeth Warren","Mayor of Pocahontas backs Joe Biden, not Elizabeth Warren","","November 9","JOE BIDEN PREDICTS REPUBLICANS WILL HAVE AN 'EPIPHANY' ONCE TRUMP LEAVES OFFICE","null"
"1575049529-64292","https://www.foxnews.com/search-results/search?q=joe%20biden&ss=fn&section.path=fnc/politics&type=story&start=24","Bernie Sanders slams Joe Biden campaign for accepting super PAC donations in effort to 'buy the election'","https://www.foxnews.com/politics/bernie-sanders-joe-biden-super-pac-big-donors-buy-election-2020","Bernie Sanders slams Joe Biden campaign for accepting super PAC donations in effort to 'buy the election'","Bernie Sanders slams Joe Biden campaign for accepting super PAC donations in effort to 'buy the election'","","October 25","CLICK HERE FOR THE ALL-NEW FOXBUSINESS.COM","null"
"1575049503-64234","https://www.foxnews.com/search-results/search?q=joe%20biden&ss=fn&section.path=fnc/politics&type=story&start=27","Why the media are convinced Joe Biden will implode","https://www.foxnews.com/politics/why-the-media-are-convinced-joe-biden-will-implode","Why the media are convinced Joe Biden will implode","Why the media are convinced Joe Biden will implode","","April 26","For many in the media, Biden isn't liberal enough, at least not for the post-Obama era. He doesn't promise free college and free health care and has a history of working with Republicans, such as John McCain (whose daughter Meghan loves him and will host him on ""The View"" Friday.)","null"
"1575049701-64536","https://www.foxnews.com/search-results/search?q=joe%20biden&ss=fn&section.path=fnc/politics&type=story&start=7","Jared Kushner slams Joe Biden, claims he's been cleaning up 'messes' ex-VP left behind","https://www.foxnews.com/politics/jared-kushner-joe-biden-mess-white-house-israel-impeachment","Jared Kushner slams Joe Biden, claims he's been cleaning up 'messes' ex-VP left behind","Jared Kushner slams Joe Biden, claims he's been cleaning up 'messes' ex-VP left behind","","October 30","Kushner also addressed the House Democrats' ongoing Trump impeachment inquiry, which has shed light on Biden’s son, Hunter Biden, who reportedly used his father’s name to gain a seven-figure job at one of Ukraine’s largest natural gas companies despite having no prior related worked experience. Hunter Biden worked for the company, Burisma Holdings, at the same time his father, while vice president, was seeking the ouster of a Ukrainian prosecutor who was investigating a top Burisma official.","null"
"1575049410-64096","https://www.foxnews.com/search-results/search?q=joe%20biden&ss=fn&section.path=fnc/politics&type=story&start=37","Joe Biden takes indirect shot at Kamala Harris over her support for Medicare for All","https://www.foxnews.com/politics/joe-biden-shot-kamala-harris-medicare-for-all","Joe Biden takes indirect shot at Kamala Harris over her support for Medicare for All","Joe Biden takes indirect shot at Kamala Harris over her support for Medicare for All","Paul Steinhauser","July 13","","null"
"1575049494-64223","https://www.foxnews.com/search-results/search?q=joe%20biden&ss=fn&section.path=fnc/politics&type=story&start=28","Biden buoyed amid Trump attacks","https://www.foxnews.com/politics/biden-buoyed-amid-trump-attacks","Biden buoyed amid Trump attacks","Biden buoyed amid Trump attacks","Chris Stirewalt","October 11","","null"
"1575049410-64105","https://www.foxnews.com/search-results/search?q=joe%20biden&ss=fn&section.path=fnc/politics&type=story&start=37","Joe Biden takes indirect shot at Kamala Harris over her support for Medicare for All","https://www.foxnews.com/politics/joe-biden-shot-kamala-harris-medicare-for-all","Joe Biden takes indirect shot at Kamala Harris over her support for Medicare for All","Joe Biden takes indirect shot at Kamala Harris over her support for Medicare for All","","July 13","Asked specifically by reporters if Harris has been honest about whether her version of Medicare for All would end private insurance, Biden answered, ""I'll let you guys make that judgment.""","null"
"1575049419-64144","https://www.foxnews.com/search-results/search?q=joe%20biden&ss=fn&section.path=fnc/politics&type=story&start=36","Joe Biden hits Booker over Newark record, says he won't be 'polite' at next debate showdown","https://www.foxnews.com/politics/joe-biden-booker-newark-debate","Joe Biden hits Booker over Newark record, says he won't be 'polite' at next debate showdown","Joe Biden hits Booker over Newark record, says he won't be 'polite' at next debate showdown","","July 25","Mo Elleithee, the founding executive director of Georgetown University's Institute of Politics and Public Service and a Fox News contributor, noted that there’s a lot on the line for Biden next week.","null"
"1575049529-64293","https://www.foxnews.com/search-results/search?q=joe%20biden&ss=fn&section.path=fnc/politics&type=story&start=24","Bernie Sanders slams Joe Biden campaign for accepting super PAC donations in effort to 'buy the election'","https://www.foxnews.com/politics/bernie-sanders-joe-biden-super-pac-big-donors-buy-election-2020","Bernie Sanders slams Joe Biden campaign for accepting super PAC donations in effort to 'buy the election'","Bernie Sanders slams Joe Biden campaign for accepting super PAC donations in effort to 'buy the election'","","October 25","“As president, Joe Biden will push to remove private money from our federal elections. He will advocate for a constitutional amendment to overturn Citizens United [a 2010 Supreme Cout decision on campaign financing] and end the era of unbridled spending by Super PACs,” Kate Bedingfield, Biden’s deputy campaign manager, told Fox News.","null"
"1575049410-64117","https://www.foxnews.com/search-results/search?q=joe%20biden&ss=fn&section.path=fnc/politics&type=story&start=37","Joe Biden takes indirect shot at Kamala Harris over her support for Medicare for All","https://www.foxnews.com/politics/joe-biden-shot-kamala-harris-medicare-for-all","Joe Biden takes indirect shot at Kamala Harris over her support for Medicare for All","Joe Biden takes indirect shot at Kamala Harris over her support for Medicare for All","","July 13","Congressional Republicans for years tried unsuccessfully to repeal the government health care program. But Obamacare’s been severely weakened since GOP President Donald Trump succeeded Obama in the White House.","null"
"1575049467-64197","https://www.foxnews.com/search-results/search?q=joe%20biden&ss=fn&section.path=fnc/politics&type=story&start=31","Trump unloads on Biden: ‘Joe is not playing with a full deck’","https://www.foxnews.com/politics/trump-says-hed-be-thrilled-if-biden-is-the-nominee-joe-is-not-playing-with-a-full-deck","Trump unloads on Biden: ‘Joe is not playing with a full deck’","Trump unloads on Biden: ‘Joe is not playing with a full deck’","","August 9","“This is not somebody you can have as your president, but if he got the nomination I’d be thrilled,” he said.","null"
"1575049378-64061","https://www.foxnews.com/search-results/search?q=joe%20biden&ss=fn&section.path=fnc/politics&type=story&start=40","Charlie Hurt: Joe Biden has been 'part of the problem in DC for 50 years'","https://www.foxnews.com/politics/charlie-hurt-joe-biden-problem-dc-50-years","Charlie Hurt: Joe Biden has been 'part of the problem in DC for 50 years'","Charlie Hurt: Joe Biden has been 'part of the problem in DC for 50 years'","","July 9","""More than that,"" Biden responded. ""We can do it more than that.""","null"
"1575049358-64027","https://www.foxnews.com/search-results/search?q=joe%20biden&ss=fn&section.path=fnc/politics&type=story&start=42","Hunter Biden didn't invite father, Joe, to his recent wedding: report","https://www.foxnews.com/politics/hunter-joe-biden-wedding-no-invite","Hunter Biden didn't invite father, Joe, to his recent wedding: report","Hunter Biden didn't invite father, Joe, to his recent wedding: report","","July 1","""I called my dad and said that we just got married,"" he said, according to the magazine.","null"
"1575049485-64220","https://www.foxnews.com/search-results/search?q=joe%20biden&ss=fn&section.path=fnc/politics&type=story&start=29","Joe Biden confuses Burlington, Iowa, with Burlington, Vt., in latest gaffe","https://www.foxnews.com/politics/joe-biden-confuses-burlington-iowa-for-burlington-vt-in-latest-gaffe","Joe Biden confuses Burlington, Iowa, with Burlington, Vt., in latest gaffe","Joe Biden confuses Burlington, Iowa, with Burlington, Vt., in latest gaffe","","August 17","The candidate himself, however, appears to take his verbal slip-ups in stride.","null"
"1575049349-64019","https://www.foxnews.com/search-results/search?q=joe%20biden&ss=fn&section.path=fnc/politics&type=story&start=43","Donna Brazile on Kamala Harris confronting Joe Biden: 'It's right to bring these issues up'","https://www.foxnews.com/politics/donna-brazile-joe-biden-debate-racial-justice","Donna Brazile on Kamala Harris confronting Joe Biden: 'It's right to bring these issues up'","Donna Brazile on Kamala Harris confronting Joe Biden: 'It's right to bring these issues up'","","June 28","When asked about ""winners or losers"" of the first round of debates, Brazile said there's still too much that can happen before that can be determined.","null"
"1575049584-64358","https://www.foxnews.com/search-results/search?q=joe%20biden&ss=fn&section.path=fnc/politics&type=story&start=18","Joe Biden builds massive lead among black voters","https://www.foxnews.com/politics/joe-biden-massive-black-voters","Joe Biden builds massive lead among black voters","Joe Biden builds massive lead among black voters","","May 21","Biden, in equating new restrictions on voting eligibility with the heinous racial segregation laws of generations past, was at the same time courting black voters who predominate in the Democratic primary in South Carolina, the first southern state to vote in the race for the White House. The former veep's bond with that critical voting bloc has only strengthened in the weeks since.","null"
"1575049419-64118","https://www.foxnews.com/search-results/search?q=joe%20biden&ss=fn&section.path=fnc/politics&type=story&start=36","Joe Biden hits Booker over Newark record, says he won't be 'polite' at next debate showdown","https://www.foxnews.com/politics/joe-biden-booker-newark-debate","Joe Biden hits Booker over Newark record, says he won't be 'polite' at next debate showdown","Joe Biden hits Booker over Newark record, says he won't be 'polite' at next debate showdown","Paul Steinhauser","July 25","","null"
"1575049388-64067","https://www.foxnews.com/search-results/search?q=joe%20biden&ss=fn&section.path=fnc/politics&type=story&start=39","Karl Rove: Kamala Harris' hit on Joe Biden over busing wasn't as clean as we thought","https://www.foxnews.com/politics/karl-rove-kamala-harris-hit-joe-biden-over-busing","Karl Rove: Kamala Harris' hit on Joe Biden over busing wasn't as clean as we thought","Karl Rove: Kamala Harris' hit on Joe Biden over busing wasn't as clean as we thought","","July 10","Rove said on ""America's Newsroom"" that Biden appears to have put the issue behind him and is still in a strong position in the polls after a forceful challenge from Sen. Kamala Harris at last month's Democratic debate.","null"
"1575049664-64503","https://www.foxnews.com/search-results/search?q=joe%20biden&ss=fn&section.path=fnc/politics&type=story&start=10","Elizabeth Warren hauls in $24.6M, topping Joe Biden in latest fundraising quarter","https://www.foxnews.com/politics/warrens-24-6-million-biden-fundraising","Elizabeth Warren hauls in $24.6M, topping Joe Biden in latest fundraising quarter","Elizabeth Warren hauls in $24.6M, topping Joe Biden in latest fundraising quarter","","October 4","THE LATEST FROM FOX NEWS ON THE 2020 PRESIDENTIAL CAMPAIGN","null"
"1575049712-64575","https://www.foxnews.com/search-results/search?q=joe%20biden&ss=fn&section.path=fnc/politics&type=story&start=6","Joe Biden officially launches 2020 presidential bid","https://www.foxnews.com/politics/biden-officially-launches-2020-presidential-bid","Joe Biden officially launches 2020 presidential bid","Joe Biden officially launches 2020 presidential bid","","April 25","But seven months later, Obama selected Biden as his running mate. The pair won the November 2008 election, and were re-elected in 2012.","null"
"1575049730-64617","https://www.foxnews.com/search-results/search?q=joe%20biden&ss=fn&section.path=fnc/politics&type=story&start=4","Joe Biden slips in latest New Hampshire poll","https://www.foxnews.com/politics/biden-new-nh-poll","Joe Biden slips in latest New Hampshire poll","Joe Biden slips in latest New Hampshire poll","","October 29","Biden – who returns to New Hampshire at the end of next week to formally file to place his name on the primary ballot – still leads when it comes to electability. Thirty-six percent of those questioned say he has the best chance of any Democratic White House hopeful of beating President Trump in next year’s general election. But that’s down from 45 percent in July. And in the new survey, the former vice president grabs just 20 percent support among his core groups — voters 50 and older, and self-described moderates and conservatives.","null"
"1575049419-64142","https://www.foxnews.com/search-results/search?q=joe%20biden&ss=fn&section.path=fnc/politics&type=story&start=36","Joe Biden hits Booker over Newark record, says he won't be 'polite' at next debate showdown","https://www.foxnews.com/politics/joe-biden-booker-newark-debate","Joe Biden hits Booker over Newark record, says he won't be 'polite' at next debate showdown","Joe Biden hits Booker over Newark record, says he won't be 'polite' at next debate showdown","","July 25","""I think we should have an honest debate. Look, you can't go out and you can't run for president and beat Donald Trump without leveling with the American people about what you're going to do and how you're going to pay for it. I'm anxious for that debate,” he added.","null"
