web-scraper-order,web-scraper-start-url,article_links,article_links-href,title,subtitle,author,date,content,
"1575049951-64702","https://www.foxnews.com/search-results/search?q=mitch%20mcconnell&ss=fn&section.path=fnc/politics&type=story&start=45","McConnell condemns 'modern-day McCarthyism,' 'feckless' Obama policies, after pundits call him 'Russian asset'","https://www.foxnews.com/politics/mcconnell-modern-day-mccarthyisim-feckless-obama-policies-washington-post-russian-asset","McConnell condemns 'modern-day McCarthyism,' 'feckless' Obama policies, after pundits call him 'Russian asset'","McConnell condemns 'modern-day McCarthyism,' 'feckless' Obama policies, after pundits call him 'Russian asset'","","July 29","In unusually forceful, angry, and personal terms, Senate Majority Leader Mitch McConnell on Monday countered what he called ""baseless smears"" from left-wing media and vowed not to be ""intimidated,"" in the wake of a Washington Post op-ed that declared McConnell a ""Russian asset.""","null"
"1575050300-65380","https://www.foxnews.com/search-results/search?q=mitch%20mcconnell&ss=fn&section.path=fnc/politics&type=story&start=3","Hillary Clinton praises Twitter ad ban while Mitch McConnell defends free speech","https://www.foxnews.com/politics/hillary-clinton-twitter-political-ad-ban-mitch-mcconnell-free-speech","Hillary Clinton praises Twitter ad ban while Mitch McConnell defends free speech","Hillary Clinton praises Twitter ad ban while Mitch McConnell defends free speech","","November 7","“If you were to say to your expert engineers, out algorithms really favor the explosive, the inflammatory, the blatantly false and we love to hook people into them and they seek more of it and then they get absolutely barraged by all of this information, we need to tweak the algorithms,” she said.","null"
"1575049959-64736","https://www.foxnews.com/search-results/search?q=mitch%20mcconnell&ss=fn&section.path=fnc/politics&type=story&start=44","McConnell says he'll bring up 'freestanding' bill to address humanitarian crisis at border: 'What's the objection?'","https://www.foxnews.com/politics/mitch-mcconnell-border-crisis-bill-fox-friends","McConnell says he'll bring up 'freestanding' bill to address humanitarian crisis at border: 'What's the objection?'","McConnell says he'll bring up 'freestanding' bill to address humanitarian crisis at border: 'What's the objection?'","David Montanaro","June 17","","null"
"1575050267-65307","https://www.foxnews.com/search-results/search?q=mitch%20mcconnell&ss=fn&section.path=fnc/politics&type=story&start=7","Mitch McConnell fractures shoulder after fall in Kentucky home, spokesman says","https://www.foxnews.com/politics/mitch-mcconnell-fractures-shoulder-after-fall-in-kentucky-home","Mitch McConnell fractures shoulder after fall in Kentucky home, spokesman says","Mitch McConnell fractures shoulder after fall in Kentucky home, spokesman says","","August 4","Several Democrats including Senate Minority Leader Chuck Schumer, D-N.Y., called on McConnell to call the Senate back Capitol Hill for an emergency session to debate and vote on universal background checks legislation.","null"
"1575050043-64869","https://www.foxnews.com/search-results/search?q=mitch%20mcconnell&ss=fn&section.path=fnc/politics&type=story&start=34","Sen. McConnell’s reelection campaign is selling ‘Cocaine Mitch’ t-shirts","https://www.foxnews.com/politics/mitch-mcconnells-campaign-selling-cocaine-mitch-t-shirts","Sen. McConnell’s reelection campaign is selling ‘Cocaine Mitch’ t-shirts","Sen. McConnell’s reelection campaign is selling ‘Cocaine Mitch’ t-shirts","","May 8","Last year, Don Blankenship gave McConnell the nickname “Cocaine Mitch” during his ill-fated bid for a West Virginia Senate seat. Blankenship gave him the nickname in relation to a reported drug bust tied to his father-in-law’s company.","null"
"1575050275-65311","https://www.foxnews.com/search-results/search?q=mitch%20mcconnell&ss=fn&section.path=fnc/politics&type=story&start=6","Mitch McConnell campaign criticized for photos of tombstones with Dem names","https://www.foxnews.com/politics/mitch-mcconnell-campaign-criticized-for-photos-of-tombstones-with-democratic-opponetts-name","Mitch McConnell campaign criticized for photos of tombstones with Dem names","Mitch McConnell campaign criticized for photos of tombstones with Dem names","","August 5","MITCH MCCONNELL FRACTURES SHOULDER AFTER FALL IN KENTUCKY HOME, SPOKESMAN SAYS","null"
"1575050196-65146","https://www.foxnews.com/search-results/search?q=mitch%20mcconnell&ss=fn&section.path=fnc/politics&type=story&start=15","Mitch McConnell tells Nike he'll buy first order of 'Betsy Ross' sneakers if they released after Kaepernick controversy","https://www.foxnews.com/politics/mitch-mcconnell-nike-colin-kaepernick-sneakers","Mitch McConnell tells Nike he'll buy first order of 'Betsy Ross' sneakers if they released after Kaepernick controversy","Mitch McConnell tells Nike he'll buy first order of 'Betsy Ross' sneakers if they released after Kaepernick controversy","","July 2","JESSE WATERS: FLAG PROTESTERS  LIKE KAEPERNICK WANT TO 'DIVIDE THE COUNTRY'","null"
"1575049999-64810","https://www.foxnews.com/search-results/search?q=mitch%20mcconnell&ss=fn&section.path=fnc/politics&type=story&start=39","McConnell campaign accuses AOC of ‘trying to dox some underage kids’ after cardboard cutout photo","https://www.foxnews.com/politics/mcconnell-campaign-alerts-law-enforcement-after-aoc-calls-out-underage-supporters-on-twitter","McConnell campaign accuses AOC of ‘trying to dox some underage kids’ after cardboard cutout photo","McConnell campaign accuses AOC of ‘trying to dox some underage kids’ after cardboard cutout photo","","August 6","Fox News has reached out to Ocasio-Cortez's office for comment.","null"
"1575050222-65201","https://www.foxnews.com/search-results/search?q=mitch%20mcconnell&ss=fn&section.path=fnc/politics&type=story&start=12","From ‘Cocaine Mitch’ to ‘Grim Reaper,’ McConnell nicknames become political weapons","https://www.foxnews.com/politics/from-cocaine-mitch-to-grim-reaper-mcconnell-nicknames-become-political-weapons","From ‘Cocaine Mitch’ to ‘Grim Reaper,’ McConnell nicknames become political weapons","From ‘Cocaine Mitch’ to ‘Grim Reaper,’ McConnell nicknames become political weapons","","May 17","Congressional Democrats can’t seem to make up their minds about Senate Majority Leader Mitch McConnell, R-Ky.","null"
"1575050145-65074","https://www.foxnews.com/search-results/search?q=mitch%20mcconnell&ss=fn&section.path=fnc/politics&type=story&start=21","Mitch McConnell confronted by 'Abolish ICE' protesters, video shows","https://www.foxnews.com/politics/mitch-mcconnell-confronted-by-abolish-ice-protesters-video-shows","Mitch McConnell confronted by 'Abolish ICE' protesters, video shows","Mitch McConnell confronted by 'Abolish ICE' protesters, video shows","","July 8, 2018","Last month McConnell and his wife -- Transportation Secretary Elaine Chao -- were confronted by protesters as they were leaving an event at Georgetown University.","null"
"1575050205-65159","https://www.foxnews.com/search-results/search?q=mitch%20mcconnell&ss=fn&section.path=fnc/politics&type=story&start=14","McConnell chides Trump for calling impeachment inquiry a 'lynching'","https://www.foxnews.com/politics/mcconnell-chides-trump-for-calling-impeachment-inquiry-a-lynching","McConnell chides Trump for calling impeachment inquiry a 'lynching'","McConnell chides Trump for calling impeachment inquiry a 'lynching'","","October 22","But, some Republicans pointed to video showing prominent Democrats, including Reps. Gregory Meeks and Danny Davis, calling Bill Clinton's impeachment proceedings a de facto ""lynching"" in 1998.","null"
"1575050249-65272","https://www.foxnews.com/search-results/search?q=mitch%20mcconnell&ss=fn&section.path=fnc/politics&type=story&start=9","Marine combat aviator Amy McGrath announces Senate campaign against Mitch McConnell","https://www.foxnews.com/politics/marine-combat-aviator-amy-mcgrath-announces-senate-campaign-against-mitch-mcconnell-after-narrow-house-defeat","Marine combat aviator Amy McGrath announces Senate campaign against Mitch McConnell","Marine combat aviator Amy McGrath announces Senate campaign against Mitch McConnell","","July 9","""Everything that’s wrong with Washington had to start somewhere—it started with him,"" McGrath said in a Tuesday morning tweet. McConnell has been in office since 1985.","null"
"1575050240-65249","https://www.foxnews.com/search-results/search?q=mitch%20mcconnell&ss=fn&section.path=fnc/politics&type=story&start=10","Mitch McConnell slammed by author Ta-Nehisi Coates over slavery reparations","https://www.foxnews.com/politics/mitch-mcconnell-slammed-by-ta-nehisi-coates-repreations","Mitch McConnell slammed by author Ta-Nehisi Coates over slavery reparations","Mitch McConnell slammed by author Ta-Nehisi Coates over slavery reparations","Nick Givas","June 19","","null"
"1575050240-65265","https://www.foxnews.com/search-results/search?q=mitch%20mcconnell&ss=fn&section.path=fnc/politics&type=story&start=10","Mitch McConnell slammed by author Ta-Nehisi Coates over slavery reparations","https://www.foxnews.com/politics/mitch-mcconnell-slammed-by-ta-nehisi-coates-repreations","Mitch McConnell slammed by author Ta-Nehisi Coates over slavery reparations","Mitch McConnell slammed by author Ta-Nehisi Coates over slavery reparations","","June 19","""The matter of reparations is one of making amends and direct redress but it is also a question of citizenship. In HR-40 this body has a chance to both make good on its 2009 apology for enslavement and reject fair weather patriotism -- to so say that nation is both its credits and its debits. That if Thomas Jefferson matters, so does Sally Hemmings. If D-Day matters so does black Wall Street. That if Valley Forge matters so does Fort Pillow. Because the question really is not whether we will be tied to the somethings of our past, but whether we are courageous enough to be tied to the whole of them.""","null"
"1575050352-65401","https://www.foxnews.com/search-results/search?q=mitch%20mcconnell&ss=fn&section.path=fnc/politics&type=story&start=0","Tight Kentucky gubernatorial race could be bellwether for Mitch McConnell","https://www.foxnews.com/politics/kentucky-governors-race-mitch-mcconnells-litmus-test","Tight Kentucky gubernatorial race could be bellwether for Mitch McConnell","Tight Kentucky gubernatorial race could be bellwether for Mitch McConnell","","November 4","TRUMP IS NOT ON THE BALLOT, BUT HE'S FRONT-AND-CENTER IN THIS MONTH’S KEY GUBERNATORIAL ELECTIONS","null"
"1575050110-64996","https://www.foxnews.com/search-results/search?q=mitch%20mcconnell&ss=fn&section.path=fnc/politics&type=story&start=26","McConnell says he'd have 'no choice' but to take up impeachment articles if House approves them","https://www.foxnews.com/politics/mcconnell-says-he-has-no-choice-but-to-take-up-impeachment-articles-if-house-approves-them","McConnell says he'd have 'no choice' but to take up impeachment articles if House approves them","McConnell says he'd have 'no choice' but to take up impeachment articles if House approves them","","September 30","McConnell has now cleared the air on the heels of Pelosi's launch of an impeachment inquiry.","null"
"1575049936-64692","https://www.foxnews.com/search-results/search?q=mitch%20mcconnell&ss=fn&section.path=fnc/politics&type=story&start=47","Elaine Chao tells protesters to 'leave alone' husband Mitch McConnell when confronted on immigration","https://www.foxnews.com/politics/elaine-chao-tells-protesters-to-leave-alone-husband-mitch-mcconnell-when-confronted-on-immigration","Elaine Chao tells protesters to 'leave alone' husband Mitch McConnell when confronted on immigration","Elaine Chao tells protesters to 'leave alone' husband Mitch McConnell when confronted on immigration","","June 26, 2018","McConnell’s office did not comment to Fox News.","null"
"1575050291-65364","https://www.foxnews.com/search-results/search?q=mitch%20mcconnell&ss=fn&section.path=fnc/politics&type=story&start=4","Reporter's Notebook: What Mitch McConnell said and did not say about guns","https://www.foxnews.com/politics/mcconnell-guns-what-he-didnt-say-reporters-notebook","Reporter's Notebook: What Mitch McConnell said and did not say about guns","Reporter's Notebook: What Mitch McConnell said and did not say about guns","","August 13","Among the amendments which withered on the 60-vote vine: a plan by Sen. Dianne Feinstein, D-Calif., to resuscitate the assault-weapons ban which expired in 2004. Naturally, defenders of the Second Amendment abhorred that proposal. Feinstein’s amendment failed 60-40 – not even coming close to 51 ""yea"" votes.","null"
"1575049968-64755","https://www.foxnews.com/search-results/search?q=mitch%20mcconnell&ss=fn&section.path=fnc/politics&type=story&start=43","Ocasio-Cortez demands McConnell stop 'giving bogus excuses' and pass gun background check bill","https://www.foxnews.com/politics/ocasio-cortez-demands-mcconnell-stop-giving-bogus-excuses-and-pass-gun-background-check-bill","Ocasio-Cortez demands McConnell stop 'giving bogus excuses' and pass gun background check bill","Ocasio-Cortez demands McConnell stop 'giving bogus excuses' and pass gun background check bill","","August 4","The measure, HR 8, was passed back in February with overwhelming support from the newly elected Democratic majority and some Republican support.","null"
"1575050282-65328","https://www.foxnews.com/search-results/search?q=mitch%20mcconnell&ss=fn&section.path=fnc/politics&type=story&start=5","AOC slams McConnell after photo of young men in 'Team Mitch' T-shirts 'groping' cutout surfaces","https://www.foxnews.com/politics/ocasio-cortez-mcconnell-photo-team-mitch-shirts-groping-cutout","AOC slams McConnell after photo of young men in 'Team Mitch' T-shirts 'groping' cutout surfaces","AOC slams McConnell after photo of young men in 'Team Mitch' T-shirts 'groping' cutout surfaces","","August 6","The photograph was first surfaced by a Twitter user named @emrazz and the initial caption read, “Break me off a piece of that.”","null"
"1575050222-65216","https://www.foxnews.com/search-results/search?q=mitch%20mcconnell&ss=fn&section.path=fnc/politics&type=story&start=12","From ‘Cocaine Mitch’ to ‘Grim Reaper,’ McConnell nicknames become political weapons","https://www.foxnews.com/politics/from-cocaine-mitch-to-grim-reaper-mcconnell-nicknames-become-political-weapons","From ‘Cocaine Mitch’ to ‘Grim Reaper,’ McConnell nicknames become political weapons","From ‘Cocaine Mitch’ to ‘Grim Reaper,’ McConnell nicknames become political weapons","","May 17","Democrats are flummoxed about the problem.","null"
"1575050084-64957","https://www.foxnews.com/search-results/search?q=mitch%20mcconnell&ss=fn&section.path=fnc/politics&type=story&start=29","McConnell ad telegraphs plan to protect Trump against Pelosi in impeachment fight","https://www.foxnews.com/politics/mcconnell-ad-telegraphs-plan-to-protect-trump-against-pelosi-in-impeachment-fight","McConnell ad telegraphs plan to protect Trump against Pelosi in impeachment fight","McConnell ad telegraphs plan to protect Trump against Pelosi in impeachment fight","","October 7","Fox News'  Leland Vittert and Melissa Leon contributed to this report.","null"
"1575050258-65289","https://www.foxnews.com/search-results/search?q=mitch%20mcconnell&ss=fn&section.path=fnc/politics&type=story&start=8","Ocasio-Cortez turns attention to Mitch McConnell amid ongoing feud with Trump over controversial comments","https://www.foxnews.com/politics/ocasio-cortez-mcconnell-trump-tweets","Ocasio-Cortez turns attention to Mitch McConnell amid ongoing feud with Trump over controversial comments","Ocasio-Cortez turns attention to Mitch McConnell amid ongoing feud with Trump over controversial comments","","July 16","PELOSI'S COMMENTS ON TRUMP'S 'RACIST' TWEETS RULED OUT OF ORDER, AFTER FLOOR FIGHT ERUPTS","null"
"1575050138-65052","https://www.foxnews.com/search-results/search?q=mitch%20mcconnell&ss=fn&section.path=fnc/politics&type=story&start=22","Kentucky sports radio host who may challenge McConnell taken off air after state GOP complaint","https://www.foxnews.com/politics/mcconnell-kentucky-gop-radio-sports","Kentucky sports radio host who may challenge McConnell taken off air after state GOP complaint","Kentucky sports radio host who may challenge McConnell taken off air after state GOP complaint","","November 7","""Matt Jones must be held accountable immediately for misusing multiple platforms paid for by his corporate sponsors to unlawfully promote his US Senate candidacy,"" the complaint reads. ""RPK's complaint is an important first step in stopping Jones' flagrant failure to comply with federal regulations, and we urge the FEC to deliver a swift a strong penalty.""","null"
"1575050291-65357","https://www.foxnews.com/search-results/search?q=mitch%20mcconnell&ss=fn&section.path=fnc/politics&type=story&start=4","Reporter's Notebook: What Mitch McConnell said and did not say about guns","https://www.foxnews.com/politics/mcconnell-guns-what-he-didnt-say-reporters-notebook","Reporter's Notebook: What Mitch McConnell said and did not say about guns","Reporter's Notebook: What Mitch McConnell said and did not say about guns","","August 13","The Senate didn’t get around to addressing firearms after the December 2012 attack at Sandy Hook Elementary School in Newtown, Conn., until April 2013, and when the Senate did vote, senators cast their ballots with the understanding that nothing would pass.","null"
"1575050138-65053","https://www.foxnews.com/search-results/search?q=mitch%20mcconnell&ss=fn&section.path=fnc/politics&type=story&start=22","Kentucky sports radio host who may challenge McConnell taken off air after state GOP complaint","https://www.foxnews.com/politics/mcconnell-kentucky-gop-radio-sports","Kentucky sports radio host who may challenge McConnell taken off air after state GOP complaint","Kentucky sports radio host who may challenge McConnell taken off air after state GOP complaint","","November 7","The complaint also alleges iHeartMedia, the distributor of Jones' show, made ""in-kind"" contributions by letting Jones give his opinions over the airwaves.","null"
"1575050051-64895","https://www.foxnews.com/search-results/search?q=mitch%20mcconnell&ss=fn&section.path=fnc/politics&type=story&start=33","GOP leaders decry Kavanaugh attacks as McConnell says 'this is not normal political behavior'","https://www.foxnews.com/politics/brett-kavanaugh-mitch-mcconnell-lindsey-graham-impeachment-calls","GOP leaders decry Kavanaugh attacks as McConnell says 'this is not normal political behavior'","GOP leaders decry Kavanaugh attacks as McConnell says 'this is not normal political behavior'","","September 16","Massachusetts Sen. Elizabeth Warren wrote: “Last year the Kavanaugh nomination was rammed through the Senate without a thorough examination of the allegations against him. Confirmation is not exoneration, and these newest revelations are disturbing. Like the man who appointed him, Kavanaugh should be impeached.”","null"
"1575050231-65242","https://www.foxnews.com/search-results/search?q=mitch%20mcconnell&ss=fn&section.path=fnc/politics&type=story&start=11","Mitch McConnell: 'For the first time in my memory, I agree with Nancy Pelosi'","https://www.foxnews.com/politics/mitch-mcconnell-for-the-first-time-in-my-memory-i-agree-with-nancy-pelosi","Mitch McConnell: 'For the first time in my memory, I agree with Nancy Pelosi'","Mitch McConnell: 'For the first time in my memory, I agree with Nancy Pelosi'","","June 13","Pelosi commented: ""Leader McConnell seems to take great pride in calling himself the ‘Grim Reaper,’ it’s part of his political campaign.""","null"
"1575050138-65055","https://www.foxnews.com/search-results/search?q=mitch%20mcconnell&ss=fn&section.path=fnc/politics&type=story&start=22","Kentucky sports radio host who may challenge McConnell taken off air after state GOP complaint","https://www.foxnews.com/politics/mcconnell-kentucky-gop-radio-sports","Kentucky sports radio host who may challenge McConnell taken off air after state GOP complaint","Kentucky sports radio host who may challenge McConnell taken off air after state GOP complaint","","November 7","MCCONNELL: IF TRUMP IMPEACHMENT TRIAL WERE HELD TODAY, 'IT WOULD NOT LEAD TO A REMOVAL'","null"
"1575050077-64933","https://www.foxnews.com/search-results/search?q=mitch%20mcconnell&ss=fn&section.path=fnc/politics&type=story&start=30","McConnell challenger Amy McGrath mocked for interview flub","https://www.foxnews.com/politics/mcconnell-challenger-mocked-for-interview-flub","McConnell challenger Amy McGrath mocked for interview flub","McConnell challenger Amy McGrath mocked for interview flub","","July 10","“You know many of us were spurred into action by what happened in 2016, the labeling of each other as they’re all communists, or they’re all this, or they’re all that, and the fake news. The divisiveness of our country was something I had never seen before,” McGrath said.","null"
"1575050138-65060","https://www.foxnews.com/search-results/search?q=mitch%20mcconnell&ss=fn&section.path=fnc/politics&type=story&start=22","Kentucky sports radio host who may challenge McConnell taken off air after state GOP complaint","https://www.foxnews.com/politics/mcconnell-kentucky-gop-radio-sports","Kentucky sports radio host who may challenge McConnell taken off air after state GOP complaint","Kentucky sports radio host who may challenge McConnell taken off air after state GOP complaint","","November 7","Jones said over Twitter he does not blame iHeart Radio for being taken off the air. He said he hopes to work with the company and KSR in the future should he decide not to run.","null"
"1575049951-64721","https://www.foxnews.com/search-results/search?q=mitch%20mcconnell&ss=fn&section.path=fnc/politics&type=story&start=45","McConnell condemns 'modern-day McCarthyism,' 'feckless' Obama policies, after pundits call him 'Russian asset'","https://www.foxnews.com/politics/mcconnell-modern-day-mccarthyisim-feckless-obama-policies-washington-post-russian-asset","McConnell condemns 'modern-day McCarthyism,' 'feckless' Obama policies, after pundits call him 'Russian asset'","McConnell condemns 'modern-day McCarthyism,' 'feckless' Obama policies, after pundits call him 'Russian asset'","","July 29","But, McConnell, who entered the Senate in 1985, said he has distinguished himself as staunchly loyal to the United States and deeply skeptical of the Soviet Union and, later, Russia.","null"
"1575050119-65012","https://www.foxnews.com/search-results/search?q=mitch%20mcconnell&ss=fn&section.path=fnc/politics&type=story&start=25","Mitch McConnell makes history as longest serving Senate Republican leader","https://www.foxnews.com/politics/mitch-mcconnell-makes-history-as-longest-serving-senate-republican-leader","Mitch McConnell makes history as longest serving Senate Republican leader","Mitch McConnell makes history as longest serving Senate Republican leader","","June 12, 2018","Up until today, Former Sen. Bob Dole, R-Kan., was the longest serving Senate Republican leader.","null"
"1575050249-65279","https://www.foxnews.com/search-results/search?q=mitch%20mcconnell&ss=fn&section.path=fnc/politics&type=story&start=9","Marine combat aviator Amy McGrath announces Senate campaign against Mitch McConnell","https://www.foxnews.com/politics/marine-combat-aviator-amy-mcgrath-announces-senate-campaign-against-mitch-mcconnell-after-narrow-house-defeat","Marine combat aviator Amy McGrath announces Senate campaign against Mitch McConnell","Marine combat aviator Amy McGrath announces Senate campaign against Mitch McConnell","","July 9","MCCONNELL VOWS TO BE 'GRIM REAPER' OF SOCIALIST DEM PROPOSALS","null"
"1575050077-64935","https://www.foxnews.com/search-results/search?q=mitch%20mcconnell&ss=fn&section.path=fnc/politics&type=story&start=30","McConnell challenger Amy McGrath mocked for interview flub","https://www.foxnews.com/politics/mcconnell-challenger-mocked-for-interview-flub","McConnell challenger Amy McGrath mocked for interview flub","McConnell challenger Amy McGrath mocked for interview flub","","July 10","But then just as the interview was wrapping up, McGrath awkwardly signed off by telling Tapper, “Great to have you” -- a line typically used by news anchors, not their guests.","null"
"1575050016-64831","https://www.foxnews.com/search-results/search?q=mitch%20mcconnell&ss=fn&section.path=fnc/politics&type=story&start=37","GOP goes to war with Twitter over McConnell campaign account freeze","https://www.foxnews.com/politics/white-house-mulls-action-on-anti-conservative-bias-as-twitter-locks-out-mcconnell-campaign","GOP goes to war with Twitter over McConnell campaign account freeze","GOP goes to war with Twitter over McConnell campaign account freeze","","August 8","The episode prompted the McConnell campaign to slam Twitter for political bias, saying the social media platform had effectively blamed the victim. Meanwhile, Republicans noted, Democratic Rep. Joaquin Castro remains active on Twitter, even after he posted the names of San Antonio residents who donated to Trump.","null"
