web-scraper-order,web-scraper-start-url,article_links,article_links-href,title,subtitle,author,date,content,
"1575050249-65270","https://www.foxnews.com/search-results/search?q=mitch%20mcconnell&ss=fn&section.path=fnc/politics&type=story&start=9","Marine combat aviator Amy McGrath announces Senate campaign against Mitch McConnell","https://www.foxnews.com/politics/marine-combat-aviator-amy-mcgrath-announces-senate-campaign-against-mitch-mcconnell-after-narrow-house-defeat","Marine combat aviator Amy McGrath announces Senate campaign against Mitch McConnell","Marine combat aviator Amy McGrath announces Senate campaign against Mitch McConnell","","July 9","Amy McGrath, a Democrat who lost a close House race in 2018, sees McConnell’s close ties to President Trump as a possible weakness for the incumbent GOP leader and Kentucky senator.","null"
"1575050309-65396","https://www.foxnews.com/search-results/search?q=mitch%20mcconnell&ss=fn&section.path=fnc/politics&type=story&start=2","Mitch McConnell recovering from shoulder surgery in Louisville","https://www.foxnews.com/politics/mitch-mcconnell-recovering-from-shoulder-surgery-in-louisville","Mitch McConnell recovering from shoulder surgery in Louisville","Mitch McConnell recovering from shoulder surgery in Louisville","","August 17","The Associated Press contributed to this report.","null"
"1575050275-65314","https://www.foxnews.com/search-results/search?q=mitch%20mcconnell&ss=fn&section.path=fnc/politics&type=story&start=6","Mitch McConnell campaign criticized for photos of tombstones with Dem names","https://www.foxnews.com/politics/mitch-mcconnell-campaign-criticized-for-photos-of-tombstones-with-democratic-opponetts-name","Mitch McConnell campaign criticized for photos of tombstones with Dem names","Mitch McConnell campaign criticized for photos of tombstones with Dem names","","August 5","Others display the words ""Socialism"" and the ""Green New Deal,"" the ambitious climate change plan put forth by Rep. Alexandria Ocasio-Cortez of New York.","null"
"1575050163-65104","https://www.foxnews.com/search-results/search?q=mitch%20mcconnell&ss=fn&section.path=fnc/politics&type=story&start=19","McConnell: If Trump impeachment trial were held today, 'it would not lead to a removal'","https://www.foxnews.com/politics/mcconnell-if-trump-impeachment-trial-were-held-today-it-would-not-lead-to-a-removal","McConnell: If Trump impeachment trial were held today, 'it would not lead to a removal'","McConnell: If Trump impeachment trial were held today, 'it would not lead to a removal'","","November 5","The two diplomats were part of a pivotal May meeting with Trump at the White House that raised red flags. They also engaged in a text message chain about the administration's actions toward Ukraine.","null"
"1575050145-65071","https://www.foxnews.com/search-results/search?q=mitch%20mcconnell&ss=fn&section.path=fnc/politics&type=story&start=21","Mitch McConnell confronted by 'Abolish ICE' protesters, video shows","https://www.foxnews.com/politics/mitch-mcconnell-confronted-by-abolish-ice-protesters-video-shows","Mitch McConnell confronted by 'Abolish ICE' protesters, video shows","Mitch McConnell confronted by 'Abolish ICE' protesters, video shows","","July 8, 2018","Toward the end of the video footage one protester says, “We did good, fellow citizens.”","null"
"1575050352-65407","https://www.foxnews.com/search-results/search?q=mitch%20mcconnell&ss=fn&section.path=fnc/politics&type=story&start=0","Tight Kentucky gubernatorial race could be bellwether for Mitch McConnell","https://www.foxnews.com/politics/kentucky-governors-race-mitch-mcconnells-litmus-test","Tight Kentucky gubernatorial race could be bellwether for Mitch McConnell","Tight Kentucky gubernatorial race could be bellwether for Mitch McConnell","","November 4","But politics professor Dewey Clayton at the University of Louisville said that it’s ambitious for Democrats to equate Kentucky’s close gubernatorial race to the Senate race in 2020.","null"
"1575050300-65383","https://www.foxnews.com/search-results/search?q=mitch%20mcconnell&ss=fn&section.path=fnc/politics&type=story&start=3","Hillary Clinton praises Twitter ad ban while Mitch McConnell defends free speech","https://www.foxnews.com/politics/hillary-clinton-twitter-political-ad-ban-mitch-mcconnell-free-speech","Hillary Clinton praises Twitter ad ban while Mitch McConnell defends free speech","Hillary Clinton praises Twitter ad ban while Mitch McConnell defends free speech","","November 7","It does “not bolster our democracy. It would degrade democracy. It would amplify the advantage of media companies, celebrities and certain other established elites while denying an important tool to the Americans who disagree with them,” he continued, according to The Hill.","null"
"1575050043-64871","https://www.foxnews.com/search-results/search?q=mitch%20mcconnell&ss=fn&section.path=fnc/politics&type=story&start=34","Sen. McConnell’s reelection campaign is selling ‘Cocaine Mitch’ t-shirts","https://www.foxnews.com/politics/mitch-mcconnells-campaign-selling-cocaine-mitch-t-shirts","Sen. McConnell’s reelection campaign is selling ‘Cocaine Mitch’ t-shirts","Sen. McConnell’s reelection campaign is selling ‘Cocaine Mitch’ t-shirts","","May 8","McConnell’s team then photoshopped an image of the Kentucky senator on a poster for the Netflix series “Narcos” after Blankenship lost the race to incumbent Sen. Joe Manchin, D-W.Va.","null"
"1575050222-65219","https://www.foxnews.com/search-results/search?q=mitch%20mcconnell&ss=fn&section.path=fnc/politics&type=story&start=12","From ‘Cocaine Mitch’ to ‘Grim Reaper,’ McConnell nicknames become political weapons","https://www.foxnews.com/politics/from-cocaine-mitch-to-grim-reaper-mcconnell-nicknames-become-political-weapons","From ‘Cocaine Mitch’ to ‘Grim Reaper,’ McConnell nicknames become political weapons","From ‘Cocaine Mitch’ to ‘Grim Reaper,’ McConnell nicknames become political weapons","","May 17","Schumer ran with it.","null"
"1575050258-65297","https://www.foxnews.com/search-results/search?q=mitch%20mcconnell&ss=fn&section.path=fnc/politics&type=story&start=8","Ocasio-Cortez turns attention to Mitch McConnell amid ongoing feud with Trump over controversial comments","https://www.foxnews.com/politics/ocasio-cortez-mcconnell-trump-tweets","Ocasio-Cortez turns attention to Mitch McConnell amid ongoing feud with Trump over controversial comments","Ocasio-Cortez turns attention to Mitch McConnell amid ongoing feud with Trump over controversial comments","","July 16","“There is no excuse for the president’s spiteful comments –they were absolutely unacceptable and this needs to stop,” Murkowski tweeted.","null"
"1575050231-65241","https://www.foxnews.com/search-results/search?q=mitch%20mcconnell&ss=fn&section.path=fnc/politics&type=story&start=11","Mitch McConnell: 'For the first time in my memory, I agree with Nancy Pelosi'","https://www.foxnews.com/politics/mitch-mcconnell-for-the-first-time-in-my-memory-i-agree-with-nancy-pelosi","Mitch McConnell: 'For the first time in my memory, I agree with Nancy Pelosi'","Mitch McConnell: 'For the first time in my memory, I agree with Nancy Pelosi'","","June 13","""None of those things are going to pass the Senate. they won't even be voted on. So think of me as the Grim Reaper,"" McConnell had said.","null"
"1575050309-65392","https://www.foxnews.com/search-results/search?q=mitch%20mcconnell&ss=fn&section.path=fnc/politics&type=story&start=2","Mitch McConnell recovering from shoulder surgery in Louisville","https://www.foxnews.com/politics/mitch-mcconnell-recovering-from-shoulder-surgery-in-louisville","Mitch McConnell recovering from shoulder surgery in Louisville","Mitch McConnell recovering from shoulder surgery in Louisville","","August 17","A photo tweeted by McConnell on Aug. 5 appeared to show that it was his left shoulder that had been injured. In the tweet, McConnell holds a busted sneaker and compares the mishap to a sneaker incident that happened to basketball star Zion Williamson.","null"
"1575050138-65062","https://www.foxnews.com/search-results/search?q=mitch%20mcconnell&ss=fn&section.path=fnc/politics&type=story&start=22","Kentucky sports radio host who may challenge McConnell taken off air after state GOP complaint","https://www.foxnews.com/politics/mcconnell-kentucky-gop-radio-sports","Kentucky sports radio host who may challenge McConnell taken off air after state GOP complaint","Kentucky sports radio host who may challenge McConnell taken off air after state GOP complaint","","November 7","""For the time being however, I won’t be on the show,"" his statement said. ""I had hoped to do the show for a couple more weeks, make my decision and then take time off to finish my book and regroup after a long process. Thanks to Senator McConnell that time will apparently start now.""","null"
"1575050077-64939","https://www.foxnews.com/search-results/search?q=mitch%20mcconnell&ss=fn&section.path=fnc/politics&type=story&start=30","McConnell challenger Amy McGrath mocked for interview flub","https://www.foxnews.com/politics/mcconnell-challenger-mocked-for-interview-flub","McConnell challenger Amy McGrath mocked for interview flub","McConnell challenger Amy McGrath mocked for interview flub","","July 10","President Trump has already commented on McGrath's push to unseat the Senate majority leader, noting her 9/11 comparison. Trump questioned why voters in Kentucky would want their state to give up the majority leader position by electing ""a freshman Senator with little power in what will hopefully be the minority party.""","null"
"1575050240-65251","https://www.foxnews.com/search-results/search?q=mitch%20mcconnell&ss=fn&section.path=fnc/politics&type=story&start=10","Mitch McConnell slammed by author Ta-Nehisi Coates over slavery reparations","https://www.foxnews.com/politics/mitch-mcconnell-slammed-by-ta-nehisi-coates-repreations","Mitch McConnell slammed by author Ta-Nehisi Coates over slavery reparations","Mitch McConnell slammed by author Ta-Nehisi Coates over slavery reparations","","June 19","""Yesterday when I asked about reparations, Senate Majority Leader Mitch McConnell offered a familiar reply: America should not be held liable for something that happened 150 years ago since none of us currently alive are responsible,"" Coates said.","null"
"1575050035-64849","https://www.foxnews.com/search-results/search?q=mitch%20mcconnell&ss=fn&section.path=fnc/politics&type=story&start=35","McConnell vows to be 'grim reaper' of socialist Dem proposals","https://www.foxnews.com/politics/mcconnell-vows-to-be-grim-reaper-of-socialist-dem-proposals","McConnell vows to be 'grim reaper' of socialist Dem proposals","McConnell vows to be 'grim reaper' of socialist Dem proposals","Gregg Re","April 22","","null"
"1575050016-64837","https://www.foxnews.com/search-results/search?q=mitch%20mcconnell&ss=fn&section.path=fnc/politics&type=story&start=37","GOP goes to war with Twitter over McConnell campaign account freeze","https://www.foxnews.com/politics/white-house-mulls-action-on-anti-conservative-bias-as-twitter-locks-out-mcconnell-campaign","GOP goes to war with Twitter over McConnell campaign account freeze","GOP goes to war with Twitter over McConnell campaign account freeze","","August 8","In addition to a potential executive order, the White House is planning a summit with technology companies on Friday aimed at combatting extremism online. This comes after President Trump discussed the dangers on the internet during an address following last weekend’s shootings in El Paso and Dayton. The El Paso suspect had been linked to an online manifesto that expressed hatred toward Hispanic immigrants.","null"
"1575050172-65120","https://www.foxnews.com/search-results/search?q=mitch%20mcconnell&ss=fn&section.path=fnc/politics&type=story&start=18","Dems divided on Green New Deal after Mitch McConnell ramps up pressure","https://www.foxnews.com/politics/dems-remain-divided-on-green-new-deal-after-mitch-mcconnell-ramps-up-pressure","Dems divided on Green New Deal after Mitch McConnell ramps up pressure","Dems divided on Green New Deal after Mitch McConnell ramps up pressure","","February 14","Some of the other Democrats who have opposed, or remained noncommittal, on the plan, include: Sen. Dianne Feinstein, Sen. Doug Jones, Sen. Amy Klobuchar (who downplayed the deal as “aspirational” in a Fox News interview) and Sen. Tammy Baldwin.","null"
"1575050077-64937","https://www.foxnews.com/search-results/search?q=mitch%20mcconnell&ss=fn&section.path=fnc/politics&type=story&start=30","McConnell challenger Amy McGrath mocked for interview flub","https://www.foxnews.com/politics/mcconnell-challenger-mocked-for-interview-flub","McConnell challenger Amy McGrath mocked for interview flub","McConnell challenger Amy McGrath mocked for interview flub","","July 10","Trump campaign spokesman Matt Wolking drew attention to the ending, saying: ""Stick around for the very end.""","null"
"1575050352-65412","https://www.foxnews.com/search-results/search?q=mitch%20mcconnell&ss=fn&section.path=fnc/politics&type=story&start=0","Tight Kentucky gubernatorial race could be bellwether for Mitch McConnell","https://www.foxnews.com/politics/kentucky-governors-race-mitch-mcconnells-litmus-test","Tight Kentucky gubernatorial race could be bellwether for Mitch McConnell","Tight Kentucky gubernatorial race could be bellwether for Mitch McConnell","","November 4","His campaign manager Kevin Golden, however, told Roll Call: “Leader McConnell and our campaign have been focused on making sure that Governor Bevin, [state attorney general nominee] Daniel Cameron and the rest of the Republican ticket are successful on election night.”","null"
"1575049989-64773","https://www.foxnews.com/search-results/search?q=mitch%20mcconnell&ss=fn&section.path=fnc/politics&type=story&start=40","McConnell willing to consider ‘bipartisan’ gun violence solutions, opposes 'infringing' on rights","https://www.foxnews.com/politics/mcconnell-willing-to-consider-bipartisan-gun-violence-solutions-opposes-infringing-on-constitutional-rights","McConnell willing to consider ‘bipartisan’ gun violence solutions, opposes 'infringing' on rights","McConnell willing to consider ‘bipartisan’ gun violence solutions, opposes 'infringing' on rights","","August 5","2020 DEMS UNLEASH PROFANE ATTACKS ON TRUMP, REPUBLICANS OVER MASS SHOOTINGS","null"
"1575049999-64807","https://www.foxnews.com/search-results/search?q=mitch%20mcconnell&ss=fn&section.path=fnc/politics&type=story&start=39","McConnell campaign accuses AOC of ‘trying to dox some underage kids’ after cardboard cutout photo","https://www.foxnews.com/politics/mcconnell-campaign-alerts-law-enforcement-after-aoc-calls-out-underage-supporters-on-twitter","McConnell campaign accuses AOC of ‘trying to dox some underage kids’ after cardboard cutout photo","McConnell campaign accuses AOC of ‘trying to dox some underage kids’ after cardboard cutout photo","","August 6","McConnell's campaign also said they have been in touch with law enforcement in response to recent threats made against the senator. The campaign accused Ocasio-Cortez and other liberals on Twitter of “cheering on” these threats.","null"
"1575050163-65091","https://www.foxnews.com/search-results/search?q=mitch%20mcconnell&ss=fn&section.path=fnc/politics&type=story&start=19","McConnell: If Trump impeachment trial were held today, 'it would not lead to a removal'","https://www.foxnews.com/politics/mcconnell-if-trump-impeachment-trial-were-held-today-it-would-not-lead-to-a-removal","McConnell: If Trump impeachment trial were held today, 'it would not lead to a removal'","McConnell: If Trump impeachment trial were held today, 'it would not lead to a removal'","","November 5","Senate Majority Leader Mitch McConnell, R-Ky., said on Tuesday that it is unlikely that President Trump would be convicted and removed from office is he were to face a Senate impeachment trial today.","null"
"1575050352-65410","https://www.foxnews.com/search-results/search?q=mitch%20mcconnell&ss=fn&section.path=fnc/politics&type=story&start=0","Tight Kentucky gubernatorial race could be bellwether for Mitch McConnell","https://www.foxnews.com/politics/kentucky-governors-race-mitch-mcconnells-litmus-test","Tight Kentucky gubernatorial race could be bellwether for Mitch McConnell","Tight Kentucky gubernatorial race could be bellwether for Mitch McConnell","","November 4","And Republican voters agree.","null"
"1575049989-64782","https://www.foxnews.com/search-results/search?q=mitch%20mcconnell&ss=fn&section.path=fnc/politics&type=story&start=40","McConnell willing to consider ‘bipartisan’ gun violence solutions, opposes 'infringing' on rights","https://www.foxnews.com/politics/mcconnell-willing-to-consider-bipartisan-gun-violence-solutions-opposes-infringing-on-constitutional-rights","McConnell willing to consider ‘bipartisan’ gun violence solutions, opposes 'infringing' on rights","McConnell willing to consider ‘bipartisan’ gun violence solutions, opposes 'infringing' on rights","","August 5","GRAHAM, BLUMENTHAL ANNOUNCE BIPARTISAN BILL ON 'RED FLAG' LAWS IN WAKE OF EL PASO, DAYTON SHOOTINGS","null"
"1575050084-64951","https://www.foxnews.com/search-results/search?q=mitch%20mcconnell&ss=fn&section.path=fnc/politics&type=story&start=29","McConnell ad telegraphs plan to protect Trump against Pelosi in impeachment fight","https://www.foxnews.com/politics/mcconnell-ad-telegraphs-plan-to-protect-trump-against-pelosi-in-impeachment-fight","McConnell ad telegraphs plan to protect Trump against Pelosi in impeachment fight","McConnell ad telegraphs plan to protect Trump against Pelosi in impeachment fight","","October 7","The odds of McConnell being put in that position seemingly increased over the weekend, as a senior member of the House Democratic Caucus told Fox News they believe there are enough Democrats currently supporting impeachment to get the required House majority to pass articles of impeachment. The senior member based this belief on the 227 Democrats in the House who have expressed support for an impeachment inquiry.","null"
"1575050092-64969","https://www.foxnews.com/search-results/search?q=mitch%20mcconnell&ss=fn&section.path=fnc/politics&type=story&start=28","McConnell throws shade at Nike with 'Betsy Ross' flag tweet","https://www.foxnews.com/politics/mcconnell-throws-shade-at-nike-with-betsy-ross-flag-tweet","McConnell throws shade at Nike with 'Betsy Ross' flag tweet","McConnell throws shade at Nike with 'Betsy Ross' flag tweet","","July 4","The Anti-Defamation League does not include it in its database of hate symbols. Mark Pitcavage, a senior research fellow for the ADL's Center on Extremism, said extremist groups have occasionally used it, but the flag is most commonly used by people for patriotic purposes.","null"
"1575050163-65105","https://www.foxnews.com/search-results/search?q=mitch%20mcconnell&ss=fn&section.path=fnc/politics&type=story&start=19","McConnell: If Trump impeachment trial were held today, 'it would not lead to a removal'","https://www.foxnews.com/politics/mcconnell-if-trump-impeachment-trial-were-held-today-it-would-not-lead-to-a-removal","McConnell: If Trump impeachment trial were held today, 'it would not lead to a removal'","McConnell: If Trump impeachment trial were held today, 'it would not lead to a removal'","","November 5","Fox News Doug McKelway and The Associated Press contributed to this report.","null"
"1575049927-64681","https://www.foxnews.com/search-results/search?q=mitch%20mcconnell&ss=fn&section.path=fnc/politics&type=story&start=48","Sept. 11 first responders call sit-down with McConnell 'one of the best meetings we've had'","https://www.foxnews.com/politics/9-11-first-responders-say-sit-down-with-mcconnell-was-one-of-the-best-meetings-weve-had","Sept. 11 first responders call sit-down with McConnell 'one of the best meetings we've had'","Sept. 11 first responders call sit-down with McConnell 'one of the best meetings we've had'","","June 25","More than 2,000 firefighters, police officers, federal agents and other first responders have died from 9/11-related diseases and that number is expected to climb over time, according to the Centers for Disease Control and Prevention's World Trade Center Health Program.","null"
"1575049914-64670","https://www.foxnews.com/search-results/search?q=mitch%20mcconnell&ss=fn&section.path=fnc/politics&type=story&start=50","Trump delivers statement after meeting with Mitch McConnell -- live blog","https://www.foxnews.com/politics/trump-delivers-statement-after-meeting-with-mitch-mcconnell-live-blog","Trump delivers statement after meeting with Mitch McConnell -- live blog","Trump delivers statement after meeting with Mitch McConnell -- live blog","","October 16, 2017","Follow Fox News' live blog below. Mobile users click here.","null"
"1575050163-65098","https://www.foxnews.com/search-results/search?q=mitch%20mcconnell&ss=fn&section.path=fnc/politics&type=story&start=19","McConnell: If Trump impeachment trial were held today, 'it would not lead to a removal'","https://www.foxnews.com/politics/mcconnell-if-trump-impeachment-trial-were-held-today-it-would-not-lead-to-a-removal","McConnell: If Trump impeachment trial were held today, 'it would not lead to a removal'","McConnell: If Trump impeachment trial were held today, 'it would not lead to a removal'","","November 5","McConnell added: “It’s very difficult to ascertain how long this takes. I’d be surprised if it didn’t end the way the two previous ones did, with the president not being removed from office,”","null"
"1575049951-64720","https://www.foxnews.com/search-results/search?q=mitch%20mcconnell&ss=fn&section.path=fnc/politics&type=story&start=45","McConnell condemns 'modern-day McCarthyism,' 'feckless' Obama policies, after pundits call him 'Russian asset'","https://www.foxnews.com/politics/mcconnell-modern-day-mccarthyisim-feckless-obama-policies-washington-post-russian-asset","McConnell condemns 'modern-day McCarthyism,' 'feckless' Obama policies, after pundits call him 'Russian asset'","McConnell condemns 'modern-day McCarthyism,' 'feckless' Obama policies, after pundits call him 'Russian asset'","","July 29","Schumer said if administration officials give the president information he doesn’t want to hear, ""you’re either fired, or you’re frozen out and you quit.""","null"
"1575050214-65191","https://www.foxnews.com/search-results/search?q=mitch%20mcconnell&ss=fn&section.path=fnc/politics&type=story&start=13","Trump prods McConnell on sentencing bill: 'Go for it Mitch!'","https://www.foxnews.com/politics/trump-prods-mcconnell-on-sentencing-bill-go-for-it-mitch","Trump prods McConnell on sentencing bill: 'Go for it Mitch!'","Trump prods McConnell on sentencing bill: 'Go for it Mitch!'","","December 7","Cotton and others, including Sen. John Cornyn of Texas, No. 2 Senate Republican, insist there is not as much support for the bill as Grassley claims. Cotton says senators may tell the chairman they're in favor of it when actually they're not.","null"
"1575050300-65375","https://www.foxnews.com/search-results/search?q=mitch%20mcconnell&ss=fn&section.path=fnc/politics&type=story&start=3","Hillary Clinton praises Twitter ad ban while Mitch McConnell defends free speech","https://www.foxnews.com/politics/hillary-clinton-twitter-political-ad-ban-mitch-mcconnell-free-speech","Hillary Clinton praises Twitter ad ban while Mitch McConnell defends free speech","Hillary Clinton praises Twitter ad ban while Mitch McConnell defends free speech","","November 7","""Twitter made the right decision to say, 'Look, we don’t want to get into the judging game,'” Clinton said at The New York Times DealBook Conference in New York City. “I think that should be the decision that Facebook makes as well.”","null"
"1575049989-64774","https://www.foxnews.com/search-results/search?q=mitch%20mcconnell&ss=fn&section.path=fnc/politics&type=story&start=40","McConnell willing to consider ‘bipartisan’ gun violence solutions, opposes 'infringing' on rights","https://www.foxnews.com/politics/mcconnell-willing-to-consider-bipartisan-gun-violence-solutions-opposes-infringing-on-constitutional-rights","McConnell willing to consider ‘bipartisan’ gun violence solutions, opposes 'infringing' on rights","McConnell willing to consider ‘bipartisan’ gun violence solutions, opposes 'infringing' on rights","","August 5","He did not specifically detail the type of legislation he would support. But McConnell’s comments come amid a bipartisan effort from GOP Sen. Lindsey Graham of South Carolina and Democratic Sen. Richard Blumenthal of Connecticut for a bill that would create a federal grant program to assist states in adopting so-called “Red Flag” laws.","null"
"1575050035-64856","https://www.foxnews.com/search-results/search?q=mitch%20mcconnell&ss=fn&section.path=fnc/politics&type=story&start=35","McConnell vows to be 'grim reaper' of socialist Dem proposals","https://www.foxnews.com/politics/mcconnell-vows-to-be-grim-reaper-of-socialist-dem-proposals","McConnell vows to be 'grim reaper' of socialist Dem proposals","McConnell vows to be 'grim reaper' of socialist Dem proposals","","April 22","McConnell brought Ocasio-Cortez's Green New Deal resolution to a vote in the Senate in March, and it did not secure a single affirmative vote from Democrats, who charged that the the move was a stunt. McConnell later admitted in an interview with Fox News' ""Special Report with Bret Baier"" that the vote was indeed ""for show.""","null"
