web-scraper-order,web-scraper-start-url,article_links,article_links-href,title,subtitle,author,date,content,
"1575050300-65373","https://www.foxnews.com/search-results/search?q=mitch%20mcconnell&ss=fn&section.path=fnc/politics&type=story&start=3","Hillary Clinton praises Twitter ad ban while Mitch McConnell defends free speech","https://www.foxnews.com/politics/hillary-clinton-twitter-political-ad-ban-mitch-mcconnell-free-speech","Hillary Clinton praises Twitter ad ban while Mitch McConnell defends free speech","Hillary Clinton praises Twitter ad ban while Mitch McConnell defends free speech","","November 7","Clinton praised the Twitter move and urged Facebook to follow suit, saying such moves would prevent a repeat of the spread of false information that occurred during the last presidential election.","null"
"1575050282-65330","https://www.foxnews.com/search-results/search?q=mitch%20mcconnell&ss=fn&section.path=fnc/politics&type=story&start=5","AOC slams McConnell after photo of young men in 'Team Mitch' T-shirts 'groping' cutout surfaces","https://www.foxnews.com/politics/ocasio-cortez-mcconnell-photo-team-mitch-shirts-groping-cutout","AOC slams McConnell after photo of young men in 'Team Mitch' T-shirts 'groping' cutout surfaces","AOC slams McConnell after photo of young men in 'Team Mitch' T-shirts 'groping' cutout surfaces","","August 6","MCCONNELL WILLING TO CONSIDER ‘BIPARTISAN’ GUN VIOLENCE SOLUTIONS, OPPOSES 'INFRINGING' ON RIGHTS","null"
"1575050110-64998","https://www.foxnews.com/search-results/search?q=mitch%20mcconnell&ss=fn&section.path=fnc/politics&type=story&start=26","McConnell says he'd have 'no choice' but to take up impeachment articles if House approves them","https://www.foxnews.com/politics/mcconnell-says-he-has-no-choice-but-to-take-up-impeachment-articles-if-house-approves-them","McConnell says he'd have 'no choice' but to take up impeachment articles if House approves them","McConnell says he'd have 'no choice' but to take up impeachment articles if House approves them","","September 30","House Democrats, including Intelligence Committee Chairman Adam Schiff, D-Calif., have vowed to work expeditiously on the inquiry, with some reports indicating that Democrats could even be prepared to introduce formal articles of impeachment against Trump later this fall.","null"
"1575049927-64671","https://www.foxnews.com/search-results/search?q=mitch%20mcconnell&ss=fn&section.path=fnc/politics&type=story&start=48","Sept. 11 first responders call sit-down with McConnell 'one of the best meetings we've had'","https://www.foxnews.com/politics/9-11-first-responders-say-sit-down-with-mcconnell-was-one-of-the-best-meetings-weve-had","Sept. 11 first responders call sit-down with McConnell 'one of the best meetings we've had'","Sept. 11 first responders call sit-down with McConnell 'one of the best meetings we've had'","Vandana Rambaran","June 25","","null"
"1575050275-65322","https://www.foxnews.com/search-results/search?q=mitch%20mcconnell&ss=fn&section.path=fnc/politics&type=story&start=6","Mitch McConnell campaign criticized for photos of tombstones with Dem names","https://www.foxnews.com/politics/mitch-mcconnell-campaign-criticized-for-photos-of-tombstones-with-democratic-opponetts-name","Mitch McConnell campaign criticized for photos of tombstones with Dem names","Mitch McConnell campaign criticized for photos of tombstones with Dem names","","August 5","Last month, McGrath tweeted the newspaper cartoon to criticize McConnell's reaction to coal miner deaths and their exposure to deadly toxins.","null"
"1575049968-64754","https://www.foxnews.com/search-results/search?q=mitch%20mcconnell&ss=fn&section.path=fnc/politics&type=story&start=43","Ocasio-Cortez demands McConnell stop 'giving bogus excuses' and pass gun background check bill","https://www.foxnews.com/politics/ocasio-cortez-demands-mcconnell-stop-giving-bogus-excuses-and-pass-gun-background-check-bill","Ocasio-Cortez demands McConnell stop 'giving bogus excuses' and pass gun background check bill","Ocasio-Cortez demands McConnell stop 'giving bogus excuses' and pass gun background check bill","","August 4","""The House passed HR8, a Bipartisan Background Checks Act, *5 months ago* and the Senate has yet to vote on it,"" Ocasio-Cortez tweeted in response to McConnell’s own tweet. ""It was one of our 1st major priorities after ending the gov shutdown. You’ve been sitting on it since February giving bogus excuses. Care to explain the people why?""","null"
"1575050291-65369","https://www.foxnews.com/search-results/search?q=mitch%20mcconnell&ss=fn&section.path=fnc/politics&type=story&start=4","Reporter's Notebook: What Mitch McConnell said and did not say about guns","https://www.foxnews.com/politics/mcconnell-guns-what-he-didnt-say-reporters-notebook","Reporter's Notebook: What Mitch McConnell said and did not say about guns","Reporter's Notebook: What Mitch McConnell said and did not say about guns","","August 13","Still, we’re a long way from that scenario.","null"
"1575050110-65007","https://www.foxnews.com/search-results/search?q=mitch%20mcconnell&ss=fn&section.path=fnc/politics&type=story&start=26","McConnell says he'd have 'no choice' but to take up impeachment articles if House approves them","https://www.foxnews.com/politics/mcconnell-says-he-has-no-choice-but-to-take-up-impeachment-articles-if-house-approves-them","McConnell says he'd have 'no choice' but to take up impeachment articles if House approves them","McConnell says he'd have 'no choice' but to take up impeachment articles if House approves them","","September 30","Last week, acting Director of National Intelligence Joseph Maguire called the accusations in the complaint “hearsay.”","null"
"1575050196-65151","https://www.foxnews.com/search-results/search?q=mitch%20mcconnell&ss=fn&section.path=fnc/politics&type=story&start=15","Mitch McConnell tells Nike he'll buy first order of 'Betsy Ross' sneakers if they released after Kaepernick controversy","https://www.foxnews.com/politics/mitch-mcconnell-nike-colin-kaepernick-sneakers","Mitch McConnell tells Nike he'll buy first order of 'Betsy Ross' sneakers if they released after Kaepernick controversy","Mitch McConnell tells Nike he'll buy first order of 'Betsy Ross' sneakers if they released after Kaepernick controversy","","July 2","Nike has received plenty of backlash of pulling the shoe just days before the Fourth of July. Arizona Governor Doug Ducey announced earlier on Tuesday that it would withdraw its planned incentive for the company to build a plant in his state.","null"
"1575050275-65321","https://www.foxnews.com/search-results/search?q=mitch%20mcconnell&ss=fn&section.path=fnc/politics&type=story&start=6","Mitch McConnell campaign criticized for photos of tombstones with Dem names","https://www.foxnews.com/politics/mitch-mcconnell-campaign-criticized-for-photos-of-tombstones-with-democratic-opponetts-name","Mitch McConnell campaign criticized for photos of tombstones with Dem names","Mitch McConnell campaign criticized for photos of tombstones with Dem names","","August 5","""Our supporters built an homage to the Courier Journal cartoon at Fancy Farm and we posted their work,"" Golden said in an emailed statement. ""Amy McGrath has tweeted this very cartoon several times and it’s shameful that she’s pretending not to know exactly what it is referencing in order to politicize a tragedy.""","null"
"1575050119-65020","https://www.foxnews.com/search-results/search?q=mitch%20mcconnell&ss=fn&section.path=fnc/politics&type=story&start=25","Mitch McConnell makes history as longest serving Senate Republican leader","https://www.foxnews.com/politics/mitch-mcconnell-makes-history-as-longest-serving-senate-republican-leader","Mitch McConnell makes history as longest serving Senate Republican leader","Mitch McConnell makes history as longest serving Senate Republican leader","","June 12, 2018","“We think the most important principle in the middle of this presidential election, which is raging, is that the American people need to weigh and decide who is going to make this decision – not this lame duck president on the way out the door, but the next president next year,” McConnell said in 2016.","null"
"1575050145-65072","https://www.foxnews.com/search-results/search?q=mitch%20mcconnell&ss=fn&section.path=fnc/politics&type=story&start=21","Mitch McConnell confronted by 'Abolish ICE' protesters, video shows","https://www.foxnews.com/politics/mitch-mcconnell-confronted-by-abolish-ice-protesters-video-shows","Mitch McConnell confronted by 'Abolish ICE' protesters, video shows","Mitch McConnell confronted by 'Abolish ICE' protesters, video shows","","July 8, 2018","McConnell declined the Courier-Journal’s request for comment.","null"
"1575050026-64839","https://www.foxnews.com/search-results/search?q=mitch%20mcconnell&ss=fn&section.path=fnc/politics&type=story&start=36","McConnell blasts 'Medicare for All' as 'far-left social experiment'","https://www.foxnews.com/politics/mcconnell-blasts-medicare-for-all-as-far-left-social-experiment","McConnell blasts 'Medicare for All' as 'far-left social experiment'","McConnell blasts 'Medicare for All' as 'far-left social experiment'","","April 9","WASHINGTON – McConnell called the proposal, backed by the Democrats' progressive wing, a “radical, one-size-fits-all attempt to remake the health sector.”","null"
"1575050275-65312","https://www.foxnews.com/search-results/search?q=mitch%20mcconnell&ss=fn&section.path=fnc/politics&type=story&start=6","Mitch McConnell campaign criticized for photos of tombstones with Dem names","https://www.foxnews.com/politics/mitch-mcconnell-campaign-criticized-for-photos-of-tombstones-with-democratic-opponetts-name","Mitch McConnell campaign criticized for photos of tombstones with Dem names","Mitch McConnell campaign criticized for photos of tombstones with Dem names","","August 5","Among the five tombstones shown were one featuring the name of McConnell's Democratic opponent, Amy McGrath, that read ""R.I.P. Amy McGrath November 3, 2020.""","null"
"1575049999-64804","https://www.foxnews.com/search-results/search?q=mitch%20mcconnell&ss=fn&section.path=fnc/politics&type=story&start=39","McConnell campaign accuses AOC of ‘trying to dox some underage kids’ after cardboard cutout photo","https://www.foxnews.com/politics/mcconnell-campaign-alerts-law-enforcement-after-aoc-calls-out-underage-supporters-on-twitter","McConnell campaign accuses AOC of ‘trying to dox some underage kids’ after cardboard cutout photo","McConnell campaign accuses AOC of ‘trying to dox some underage kids’ after cardboard cutout photo","","August 6","""Team Mitch in no way condones any aggressive, suggestive, or demeaning act toward life-sized cardboard cut outs of any gender in a manner similar to what we saw from President Obama’s speechwriting staff several years ago,” Golden told The Washington Post.","null"
"1575050196-65142","https://www.foxnews.com/search-results/search?q=mitch%20mcconnell&ss=fn&section.path=fnc/politics&type=story&start=15","Mitch McConnell tells Nike he'll buy first order of 'Betsy Ross' sneakers if they released after Kaepernick controversy","https://www.foxnews.com/politics/mitch-mcconnell-nike-colin-kaepernick-sneakers","Mitch McConnell tells Nike he'll buy first order of 'Betsy Ross' sneakers if they released after Kaepernick controversy","Mitch McConnell tells Nike he'll buy first order of 'Betsy Ross' sneakers if they released after Kaepernick controversy","Joseph A. Wulfsohn","July 2","","null"
"1575050291-65348","https://www.foxnews.com/search-results/search?q=mitch%20mcconnell&ss=fn&section.path=fnc/politics&type=story&start=4","Reporter's Notebook: What Mitch McConnell said and did not say about guns","https://www.foxnews.com/politics/mcconnell-guns-what-he-didnt-say-reporters-notebook","Reporter's Notebook: What Mitch McConnell said and did not say about guns","Reporter's Notebook: What Mitch McConnell said and did not say about guns","","August 13","“It has to pass the House,” McConnell told WHAS, adding it “has to be signed by President Trump.”","null"
"1575050145-65065","https://www.foxnews.com/search-results/search?q=mitch%20mcconnell&ss=fn&section.path=fnc/politics&type=story&start=21","Mitch McConnell confronted by 'Abolish ICE' protesters, video shows","https://www.foxnews.com/politics/mitch-mcconnell-confronted-by-abolish-ice-protesters-video-shows","Mitch McConnell confronted by 'Abolish ICE' protesters, video shows","Mitch McConnell confronted by 'Abolish ICE' protesters, video shows","","July 8, 2018","Senate Majority Leader Mitch McConnell was verbally harassed by protesters calling for the abolition of U.S. Immigration and Customs Enforcement as he left a Louisville restaurant Saturday morning, an online video showed.","null"
"1575050163-65095","https://www.foxnews.com/search-results/search?q=mitch%20mcconnell&ss=fn&section.path=fnc/politics&type=story&start=19","McConnell: If Trump impeachment trial were held today, 'it would not lead to a removal'","https://www.foxnews.com/politics/mcconnell-if-trump-impeachment-trial-were-held-today-it-would-not-lead-to-a-removal","McConnell: If Trump impeachment trial were held today, 'it would not lead to a removal'","McConnell: If Trump impeachment trial were held today, 'it would not lead to a removal'","","November 5","It takes two-thirds of the Senate to convict a president and remove him from office. That means at least 20 Republicans would have to vote to convict Trump if he is impeached by the Democrat-controlled House.","null"
"1575050240-65261","https://www.foxnews.com/search-results/search?q=mitch%20mcconnell&ss=fn&section.path=fnc/politics&type=story&start=10","Mitch McConnell slammed by author Ta-Nehisi Coates over slavery reparations","https://www.foxnews.com/politics/mitch-mcconnell-slammed-by-ta-nehisi-coates-repreations","Mitch McConnell slammed by author Ta-Nehisi Coates over slavery reparations","Mitch McConnell slammed by author Ta-Nehisi Coates over slavery reparations","","June 19","Coates closed by saying Americans should be tied to the entirety of their history and remain at the mercy of the past.","null"
"1575050309-65387","https://www.foxnews.com/search-results/search?q=mitch%20mcconnell&ss=fn&section.path=fnc/politics&type=story&start=2","Mitch McConnell recovering from shoulder surgery in Louisville","https://www.foxnews.com/politics/mitch-mcconnell-recovering-from-shoulder-surgery-in-louisville","Mitch McConnell recovering from shoulder surgery in Louisville","Mitch McConnell recovering from shoulder surgery in Louisville","Brie Stimson","August 17","","null"
"1575050154-65080","https://www.foxnews.com/search-results/search?q=mitch%20mcconnell&ss=fn&section.path=fnc/politics&type=story&start=20","Twitter unlocks Mitch McConnell’s campaign account after GOP fury","https://www.foxnews.com/politics/twitter-unlocks-mitch-mcconnells-campaign-account-after-gop-fury","Twitter unlocks Mitch McConnell’s campaign account after GOP fury","Twitter unlocks Mitch McConnell’s campaign account after GOP fury","","August 9","GOP GOES TO WAR WITH TWITTER OVER MCCONNELL CAMPAIGN ACCOUNT FREEZE","null"
"1575050231-65237","https://www.foxnews.com/search-results/search?q=mitch%20mcconnell&ss=fn&section.path=fnc/politics&type=story&start=11","Mitch McConnell: 'For the first time in my memory, I agree with Nancy Pelosi'","https://www.foxnews.com/politics/mitch-mcconnell-for-the-first-time-in-my-memory-i-agree-with-nancy-pelosi","Mitch McConnell: 'For the first time in my memory, I agree with Nancy Pelosi'","Mitch McConnell: 'For the first time in my memory, I agree with Nancy Pelosi'","","June 13","""She's got it right,"" McConnell said, referring to Pelosi. ""She's got it absolutely right. For the first time in my memory, I agree with Nancy Pelosi.""","null"
"1575050163-65101","https://www.foxnews.com/search-results/search?q=mitch%20mcconnell&ss=fn&section.path=fnc/politics&type=story&start=19","McConnell: If Trump impeachment trial were held today, 'it would not lead to a removal'","https://www.foxnews.com/politics/mcconnell-if-trump-impeachment-trial-were-held-today-it-would-not-lead-to-a-removal","McConnell: If Trump impeachment trial were held today, 'it would not lead to a removal'","McConnell: If Trump impeachment trial were held today, 'it would not lead to a removal'","","November 5","CLICK HERE TO GET THE FOX NEWS APP","null"
"1575049989-64787","https://www.foxnews.com/search-results/search?q=mitch%20mcconnell&ss=fn&section.path=fnc/politics&type=story&start=40","McConnell willing to consider ‘bipartisan’ gun violence solutions, opposes 'infringing' on rights","https://www.foxnews.com/politics/mcconnell-willing-to-consider-bipartisan-gun-violence-solutions-opposes-infringing-on-constitutional-rights","McConnell willing to consider ‘bipartisan’ gun violence solutions, opposes 'infringing' on rights","McConnell willing to consider ‘bipartisan’ gun violence solutions, opposes 'infringing' on rights","","August 5","CLICK HERE TO GET THE FOX NEWS APP","null"
"1575050130-65035","https://www.foxnews.com/search-results/search?q=mitch%20mcconnell&ss=fn&section.path=fnc/politics&type=story&start=23","Alexandria Ocasio-Cortez rips Mitch McConnell for Green New Deal vote: 'He doesn't want to save our planet'","https://www.foxnews.com/politics/rep-alexandria-ocasio-cortez-mitch-green-new-deal","Alexandria Ocasio-Cortez rips Mitch McConnell for Green New Deal vote: 'He doesn't want to save our planet'","Alexandria Ocasio-Cortez rips Mitch McConnell for Green New Deal vote: 'He doesn't want to save our planet'","","March 26","Speaking to Vox reporter Ella Nilsen, Ocasio-Cortez accused McConnell of rushing a vote and not wanting to take action against climate change ""because he thinks we can drink oil in 30 years when all our water is poisoned.","null"
"1575050249-65269","https://www.foxnews.com/search-results/search?q=mitch%20mcconnell&ss=fn&section.path=fnc/politics&type=story&start=9","Marine combat aviator Amy McGrath announces Senate campaign against Mitch McConnell","https://www.foxnews.com/politics/marine-combat-aviator-amy-mcgrath-announces-senate-campaign-against-mitch-mcconnell-after-narrow-house-defeat","Marine combat aviator Amy McGrath announces Senate campaign against Mitch McConnell","Marine combat aviator Amy McGrath announces Senate campaign against Mitch McConnell","","July 9","Senate Majority Leader Mitch McConnell’s latest challenge is not from Democrats in the Senate or even House Speaker Nancy Pelosi, but a Marine combat aviator who announced Tuesday she is running against him in 2020.","null"
"1575050068-64917","https://www.foxnews.com/search-results/search?q=mitch%20mcconnell&ss=fn&section.path=fnc/politics&type=story&start=31","Diners confront Mitch McConnell at restaurant, get told to ‘leave him alone’ by others","https://www.foxnews.com/politics/diners-confront-mitch-mcconnell-at-restaurant-get-told-to-leave-him-alone-by-others","Diners confront Mitch McConnell at restaurant, get told to ‘leave him alone’ by others","Diners confront Mitch McConnell at restaurant, get told to ‘leave him alone’ by others","","October 20, 2018","As Chao argues with the protester, McConnell appears unperturbed and sips on a drink. But other diners begin yelling at the protester, telling him to “leave him alone” and making shoo-ing gestures.","null"
"1575050291-65356","https://www.foxnews.com/search-results/search?q=mitch%20mcconnell&ss=fn&section.path=fnc/politics&type=story&start=4","Reporter's Notebook: What Mitch McConnell said and did not say about guns","https://www.foxnews.com/politics/mcconnell-guns-what-he-didnt-say-reporters-notebook","Reporter's Notebook: What Mitch McConnell said and did not say about guns","Reporter's Notebook: What Mitch McConnell said and did not say about guns","","August 13","HARMEET DHILLON: MCCONNELL CAMPAIGN TWITTER BAN IS LATEST SHOT IN BEG TECH'S WAR ON CONSERVATIVES","null"
"1575050240-65259","https://www.foxnews.com/search-results/search?q=mitch%20mcconnell&ss=fn&section.path=fnc/politics&type=story&start=10","Mitch McConnell slammed by author Ta-Nehisi Coates over slavery reparations","https://www.foxnews.com/politics/mitch-mcconnell-slammed-by-ta-nehisi-coates-repreations","Mitch McConnell slammed by author Ta-Nehisi Coates over slavery reparations","Mitch McConnell slammed by author Ta-Nehisi Coates over slavery reparations","","June 19","""[McConnell] was alive to witness cleptocracy in his native Alabama and a regime premised on electoral theft. Majority Leader McConnell cited civil rights legislation yesterday, as well he should -- because he was alive to witness the harassment, jailing, and betrayal of those responsible for that legislation by a government sworn to protect them,"" Coates said.","null"
"1575050222-65215","https://www.foxnews.com/search-results/search?q=mitch%20mcconnell&ss=fn&section.path=fnc/politics&type=story&start=12","From ‘Cocaine Mitch’ to ‘Grim Reaper,’ McConnell nicknames become political weapons","https://www.foxnews.com/politics/from-cocaine-mitch-to-grim-reaper-mcconnell-nicknames-become-political-weapons","From ‘Cocaine Mitch’ to ‘Grim Reaper,’ McConnell nicknames become political weapons","From ‘Cocaine Mitch’ to ‘Grim Reaper,’ McConnell nicknames become political weapons","","May 17","“Most days, Senate Republicans are pretending that they aren't actually members of Congress. They pretend as if Donald Trump is Kryptonite, having robbed their powers to legislate,” said Murphy. “They can legislate. They can pass legislation. They could use their voices.”","null"
"1575050059-64901","https://www.foxnews.com/search-results/search?q=mitch%20mcconnell&ss=fn&section.path=fnc/politics&type=story&start=32","McConnell trolls Dem rep who challenged him to five debates -- by accepting","https://www.foxnews.com/politics/mcconnell-trolls-dem-rep-who-challenged-him-to-five-debates-by-accepting","McConnell trolls Dem rep who challenged him to five debates -- by accepting","McConnell trolls Dem rep who challenged him to five debates -- by accepting","Ronn Blitzer","September 3","","null"
"1575050130-65037","https://www.foxnews.com/search-results/search?q=mitch%20mcconnell&ss=fn&section.path=fnc/politics&type=story&start=23","Alexandria Ocasio-Cortez rips Mitch McConnell for Green New Deal vote: 'He doesn't want to save our planet'","https://www.foxnews.com/politics/rep-alexandria-ocasio-cortez-mitch-green-new-deal","Alexandria Ocasio-Cortez rips Mitch McConnell for Green New Deal vote: 'He doesn't want to save our planet'","Alexandria Ocasio-Cortez rips Mitch McConnell for Green New Deal vote: 'He doesn't want to save our planet'","","March 26","OCASIO-CORTEZ BLASTS GOP'S UPCOMING 'BLUFF-VOTE' ON GREEN NEW DEAL","null"
"1575050172-65114","https://www.foxnews.com/search-results/search?q=mitch%20mcconnell&ss=fn&section.path=fnc/politics&type=story&start=18","Dems divided on Green New Deal after Mitch McConnell ramps up pressure","https://www.foxnews.com/politics/dems-remain-divided-on-green-new-deal-after-mitch-mcconnell-ramps-up-pressure","Dems divided on Green New Deal after Mitch McConnell ramps up pressure","Dems divided on Green New Deal after Mitch McConnell ramps up pressure","","February 14","The West Virginia Democrat blasted the deal as a “dream” during a CNN interview Wednesday night.","null"
"1575050119-65014","https://www.foxnews.com/search-results/search?q=mitch%20mcconnell&ss=fn&section.path=fnc/politics&type=story&start=25","Mitch McConnell makes history as longest serving Senate Republican leader","https://www.foxnews.com/politics/mitch-mcconnell-makes-history-as-longest-serving-senate-republican-leader","Mitch McConnell makes history as longest serving Senate Republican leader","Mitch McConnell makes history as longest serving Senate Republican leader","","June 12, 2018","“I think it’s the toughest leadership job, political job, in this city,” Lott said in an interview. “When the president makes a decision the government moves, in the House when the Speaker makes a decision the rules committee takes care of it, in the Senate…you lead and govern by the strength of your personality and respect for the rules.”","null"
"1575050026-64847","https://www.foxnews.com/search-results/search?q=mitch%20mcconnell&ss=fn&section.path=fnc/politics&type=story&start=36","McConnell blasts 'Medicare for All' as 'far-left social experiment'","https://www.foxnews.com/politics/mcconnell-blasts-medicare-for-all-as-far-left-social-experiment","McConnell blasts 'Medicare for All' as 'far-left social experiment'","McConnell blasts 'Medicare for All' as 'far-left social experiment'","","April 9","“Democrats’ 'Medicare for None' would slap a $32 trillion tab on Americans, and that’s just a rough estimate for the first decade. And competing private insurance policies -- like the ones that 180 million Americans currently use -- would be banned outright,” the tweet read.","null"
"1575050051-64885","https://www.foxnews.com/search-results/search?q=mitch%20mcconnell&ss=fn&section.path=fnc/politics&type=story&start=33","GOP leaders decry Kavanaugh attacks as McConnell says 'this is not normal political behavior'","https://www.foxnews.com/politics/brett-kavanaugh-mitch-mcconnell-lindsey-graham-impeachment-calls","GOP leaders decry Kavanaugh attacks as McConnell says 'this is not normal political behavior'","GOP leaders decry Kavanaugh attacks as McConnell says 'this is not normal political behavior'","","September 16","Many of the Democrats seeking to unseat President Trump in 2020 over the weekend released statements calling for Congress to impeach Kavanaugh, citing The New York Times' reporting of a disputed allegation of sexual misconduct. But Graham insisted that wouldn't happen.","null"
