web-scraper-order,web-scraper-start-url,article_links,article_links-href,title,subtitle,author,date,content,
"1575050145-65066","https://www.foxnews.com/search-results/search?q=mitch%20mcconnell&ss=fn&section.path=fnc/politics&type=story&start=21","Mitch McConnell confronted by 'Abolish ICE' protesters, video shows","https://www.foxnews.com/politics/mitch-mcconnell-confronted-by-abolish-ice-protesters-video-shows","Mitch McConnell confronted by 'Abolish ICE' protesters, video shows","Mitch McConnell confronted by 'Abolish ICE' protesters, video shows","","July 8, 2018","McConnell, R-Ky., was with outgoing Kentucky House Majority Leader Jonathan Shell as the protesters shouted in unison, “Vote you out!” and “Abolish ICE!” video obtained by the Courier-Journal showed.","null"
"1575050051-64897","https://www.foxnews.com/search-results/search?q=mitch%20mcconnell&ss=fn&section.path=fnc/politics&type=story&start=33","GOP leaders decry Kavanaugh attacks as McConnell says 'this is not normal political behavior'","https://www.foxnews.com/politics/brett-kavanaugh-mitch-mcconnell-lindsey-graham-impeachment-calls","GOP leaders decry Kavanaugh attacks as McConnell says 'this is not normal political behavior'","GOP leaders decry Kavanaugh attacks as McConnell says 'this is not normal political behavior'","","September 16","While 2020 Democrats did not back down from their impeachment calls, despite the Times revision, top Democrats in Congress appeared less eager.","null"
"1575050275-65315","https://www.foxnews.com/search-results/search?q=mitch%20mcconnell&ss=fn&section.path=fnc/politics&type=story&start=6","Mitch McConnell campaign criticized for photos of tombstones with Dem names","https://www.foxnews.com/politics/mitch-mcconnell-campaign-criticized-for-photos-of-tombstones-with-democratic-opponetts-name","Mitch McConnell campaign criticized for photos of tombstones with Dem names","Mitch McConnell campaign criticized for photos of tombstones with Dem names","","August 5","McGrath, a former Marine combat aviator, found the photo troubling, considering it came hours after a gunman killed at least 22 people at a Walmart in El Paso, Texas.","null"
"1575050291-65346","https://www.foxnews.com/search-results/search?q=mitch%20mcconnell&ss=fn&section.path=fnc/politics&type=story&start=4","Reporter's Notebook: What Mitch McConnell said and did not say about guns","https://www.foxnews.com/politics/mcconnell-guns-what-he-didnt-say-reporters-notebook","Reporter's Notebook: What Mitch McConnell said and did not say about guns","Reporter's Notebook: What Mitch McConnell said and did not say about guns","","August 13","“I want to make a law,” McConnell said.","null"
"1575050026-64844","https://www.foxnews.com/search-results/search?q=mitch%20mcconnell&ss=fn&section.path=fnc/politics&type=story&start=36","McConnell blasts 'Medicare for All' as 'far-left social experiment'","https://www.foxnews.com/politics/mcconnell-blasts-medicare-for-all-as-far-left-social-experiment","McConnell blasts 'Medicare for All' as 'far-left social experiment'","McConnell blasts 'Medicare for All' as 'far-left social experiment'","","April 9","Since then, however, the numbers have declined. According to polling by the Kaiser Family Foundation, support for the policy has dropped as concerns arise that it could lead to higher taxes and longer waits for health care.","null"
"1575050182-65131","https://www.foxnews.com/search-results/search?q=mitch%20mcconnell&ss=fn&section.path=fnc/politics&type=story&start=17","Mitch McConnell cancels Senate's traditional August recess","https://www.foxnews.com/politics/mitch-mcconnell-cancels-senates-traditional-august-recess","Mitch McConnell cancels Senate's traditional August recess","Mitch McConnell cancels Senate's traditional August recess","","June 5, 2018","But the decision also keeps lawmakers in Washington during a critical period in the runup to November's midterm elections -- a controversial move.","null"
"1575050068-64925","https://www.foxnews.com/search-results/search?q=mitch%20mcconnell&ss=fn&section.path=fnc/politics&type=story&start=31","Diners confront Mitch McConnell at restaurant, get told to ‘leave him alone’ by others","https://www.foxnews.com/politics/diners-confront-mitch-mcconnell-at-restaurant-get-told-to-leave-him-alone-by-others","Diners confront Mitch McConnell at restaurant, get told to ‘leave him alone’ by others","Diners confront Mitch McConnell at restaurant, get told to ‘leave him alone’ by others","","October 20, 2018","In July, McConnell was confronted by more protesters as he left a restaurant in Louisville, Kentucky. Protesters reportedly yelled “abolish ICE” and “no justice, no peace.”","null"
"1575050222-65213","https://www.foxnews.com/search-results/search?q=mitch%20mcconnell&ss=fn&section.path=fnc/politics&type=story&start=12","From ‘Cocaine Mitch’ to ‘Grim Reaper,’ McConnell nicknames become political weapons","https://www.foxnews.com/politics/from-cocaine-mitch-to-grim-reaper-mcconnell-nicknames-become-political-weapons","From ‘Cocaine Mitch’ to ‘Grim Reaper,’ McConnell nicknames become political weapons","From ‘Cocaine Mitch’ to ‘Grim Reaper,’ McConnell nicknames become political weapons","","May 17","So Democrats will hammer McConnell over his nickname(s) in an effort to craft a narrative about the Senate. The Senate has mostly focused this year on confirming nominees. Senators have voted on just a few bills all year long.","null"
"1575050267-65305","https://www.foxnews.com/search-results/search?q=mitch%20mcconnell&ss=fn&section.path=fnc/politics&type=story&start=7","Mitch McConnell fractures shoulder after fall in Kentucky home, spokesman says","https://www.foxnews.com/politics/mitch-mcconnell-fractures-shoulder-after-fall-in-kentucky-home","Mitch McConnell fractures shoulder after fall in Kentucky home, spokesman says","Mitch McConnell fractures shoulder after fall in Kentucky home, spokesman says","","August 4","CLICK HERE TO GET THE FOX NEWS APP","null"
"1575050222-65218","https://www.foxnews.com/search-results/search?q=mitch%20mcconnell&ss=fn&section.path=fnc/politics&type=story&start=12","From ‘Cocaine Mitch’ to ‘Grim Reaper,’ McConnell nicknames become political weapons","https://www.foxnews.com/politics/from-cocaine-mitch-to-grim-reaper-mcconnell-nicknames-become-political-weapons","From ‘Cocaine Mitch’ to ‘Grim Reaper,’ McConnell nicknames become political weapons","From ‘Cocaine Mitch’ to ‘Grim Reaper,’ McConnell nicknames become political weapons","","May 17","Someone in the crowd hollered “the sun!”","null"
"1575049989-64790","https://www.foxnews.com/search-results/search?q=mitch%20mcconnell&ss=fn&section.path=fnc/politics&type=story&start=40","McConnell willing to consider ‘bipartisan’ gun violence solutions, opposes 'infringing' on rights","https://www.foxnews.com/politics/mcconnell-willing-to-consider-bipartisan-gun-violence-solutions-opposes-infringing-on-constitutional-rights","McConnell willing to consider ‘bipartisan’ gun violence solutions, opposes 'infringing' on rights","McConnell willing to consider ‘bipartisan’ gun violence solutions, opposes 'infringing' on rights","","August 5","They added: “It is incumbent upon the Senate to come back into session to pass this legislation immediately.”","null"
"1575049989-64775","https://www.foxnews.com/search-results/search?q=mitch%20mcconnell&ss=fn&section.path=fnc/politics&type=story&start=40","McConnell willing to consider ‘bipartisan’ gun violence solutions, opposes 'infringing' on rights","https://www.foxnews.com/politics/mcconnell-willing-to-consider-bipartisan-gun-violence-solutions-opposes-infringing-on-constitutional-rights","McConnell willing to consider ‘bipartisan’ gun violence solutions, opposes 'infringing' on rights","McConnell willing to consider ‘bipartisan’ gun violence solutions, opposes 'infringing' on rights","","August 5","In his statement, McConnell said he has spoken with Senate committee leaders and “asked them to reflect on the subjects the president raised within their jurisdictions and encouraged them to engage in bipartisan discussions of potential solutions to help protect our communities without infringing on Americans’ constitutional rights.”","null"
"1575050084-64953","https://www.foxnews.com/search-results/search?q=mitch%20mcconnell&ss=fn&section.path=fnc/politics&type=story&start=29","McConnell ad telegraphs plan to protect Trump against Pelosi in impeachment fight","https://www.foxnews.com/politics/mcconnell-ad-telegraphs-plan-to-protect-trump-against-pelosi-in-impeachment-fight","McConnell ad telegraphs plan to protect Trump against Pelosi in impeachment fight","McConnell ad telegraphs plan to protect Trump against Pelosi in impeachment fight","","October 7","On Sunday, attorneys for the whistleblower confirmed they also are representing a second whistleblower with information backing up the initial complaint.","null"
"1575050249-65280","https://www.foxnews.com/search-results/search?q=mitch%20mcconnell&ss=fn&section.path=fnc/politics&type=story&start=9","Marine combat aviator Amy McGrath announces Senate campaign against Mitch McConnell","https://www.foxnews.com/politics/marine-combat-aviator-amy-mcgrath-announces-senate-campaign-against-mitch-mcconnell-after-narrow-house-defeat","Marine combat aviator Amy McGrath announces Senate campaign against Mitch McConnell","Marine combat aviator Amy McGrath announces Senate campaign against Mitch McConnell","","July 9","On Tuesday morning, McConnell’s campaign responded to McGrath’s announcement with a tweet that included a video montage of her supporting liberal positions on issues including universal health care, abortion, and illegal immigration, as well as a clip of her comparing her reaction to Trump’s election to how she felt on 9/11.","null"
"1575050068-64927","https://www.foxnews.com/search-results/search?q=mitch%20mcconnell&ss=fn&section.path=fnc/politics&type=story&start=31","Diners confront Mitch McConnell at restaurant, get told to ‘leave him alone’ by others","https://www.foxnews.com/politics/diners-confront-mitch-mcconnell-at-restaurant-get-told-to-leave-him-alone-by-others","Diners confront Mitch McConnell at restaurant, get told to ‘leave him alone’ by others","Diners confront Mitch McConnell at restaurant, get told to ‘leave him alone’ by others","","October 20, 2018","Fox News’ Paulina Dedaj contributed to this report.","null"
"1575050163-65103","https://www.foxnews.com/search-results/search?q=mitch%20mcconnell&ss=fn&section.path=fnc/politics&type=story&start=19","McConnell: If Trump impeachment trial were held today, 'it would not lead to a removal'","https://www.foxnews.com/politics/mcconnell-if-trump-impeachment-trial-were-held-today-it-would-not-lead-to-a-removal","McConnell: If Trump impeachment trial were held today, 'it would not lead to a removal'","McConnell: If Trump impeachment trial were held today, 'it would not lead to a removal'","","November 5","Democrats claim that's an improper quid pro quo, while Trump and his GOP allies insist the president did nothing wrong.","null"
"1575050222-65222","https://www.foxnews.com/search-results/search?q=mitch%20mcconnell&ss=fn&section.path=fnc/politics&type=story&start=12","From ‘Cocaine Mitch’ to ‘Grim Reaper,’ McConnell nicknames become political weapons","https://www.foxnews.com/politics/from-cocaine-mitch-to-grim-reaper-mcconnell-nicknames-become-political-weapons","From ‘Cocaine Mitch’ to ‘Grim Reaper,’ McConnell nicknames become political weapons","From ‘Cocaine Mitch’ to ‘Grim Reaper,’ McConnell nicknames become political weapons","","May 17","In the DC Comics canon, Superman is blessed with an array of powers. Herculean strength. X-ray vision. Heat vision. Freezing cold breath (really?). Speed. The ability of fly. You know the mantra. “Faster than a speeding bullet! More powerful than a locomotive! Able to leap tall buildings in a single bound!”","null"
"1575050110-64994","https://www.foxnews.com/search-results/search?q=mitch%20mcconnell&ss=fn&section.path=fnc/politics&type=story&start=26","McConnell says he'd have 'no choice' but to take up impeachment articles if House approves them","https://www.foxnews.com/politics/mcconnell-says-he-has-no-choice-but-to-take-up-impeachment-articles-if-house-approves-them","McConnell says he'd have 'no choice' but to take up impeachment articles if House approves them","McConnell says he'd have 'no choice' but to take up impeachment articles if House approves them","","September 30","“I think all of that is premature,” he said.","null"
"1575050138-65058","https://www.foxnews.com/search-results/search?q=mitch%20mcconnell&ss=fn&section.path=fnc/politics&type=story&start=22","Kentucky sports radio host who may challenge McConnell taken off air after state GOP complaint","https://www.foxnews.com/politics/mcconnell-kentucky-gop-radio-sports","Kentucky sports radio host who may challenge McConnell taken off air after state GOP complaint","Kentucky sports radio host who may challenge McConnell taken off air after state GOP complaint","","November 7","Jones has formed an exploratory committee to run as a Democrat against McConnell, WLKY-TV reported.  Another Democrat, Amy McGrath, has already filed to run.","null"
"1575050352-65406","https://www.foxnews.com/search-results/search?q=mitch%20mcconnell&ss=fn&section.path=fnc/politics&type=story&start=0","Tight Kentucky gubernatorial race could be bellwether for Mitch McConnell","https://www.foxnews.com/politics/kentucky-governors-race-mitch-mcconnells-litmus-test","Tight Kentucky gubernatorial race could be bellwether for Mitch McConnell","Tight Kentucky gubernatorial race could be bellwether for Mitch McConnell","","November 4","McConnell’s history, however, hasn’t stopped Democratic opponents from emerging, including retired Marine pilot Amy McGrath. She raised $10 million in just 24 hours of announcing she would run against the Senate majority leader.","null"
"1575050008-64823","https://www.foxnews.com/search-results/search?q=mitch%20mcconnell&ss=fn&section.path=fnc/politics&type=story&start=38","‘Moscow Mitch’ merchandise sales top $200,000 in 48 hours, Kentucky Dems say","https://www.foxnews.com/politics/moscow-mitch-merchandise-sales-top-200000-in-48-hours-kentucky-dems-say","‘Moscow Mitch’ merchandise sales top $200,000 in 48 hours, Kentucky Dems say","‘Moscow Mitch’ merchandise sales top $200,000 in 48 hours, Kentucky Dems say","","August 2","Fox News' Gregg Re and The Associated Press contributed to this report.","null"
"1575049999-64795","https://www.foxnews.com/search-results/search?q=mitch%20mcconnell&ss=fn&section.path=fnc/politics&type=story&start=39","McConnell campaign accuses AOC of ‘trying to dox some underage kids’ after cardboard cutout photo","https://www.foxnews.com/politics/mcconnell-campaign-alerts-law-enforcement-after-aoc-calls-out-underage-supporters-on-twitter","McConnell campaign accuses AOC of ‘trying to dox some underage kids’ after cardboard cutout photo","McConnell campaign accuses AOC of ‘trying to dox some underage kids’ after cardboard cutout photo","","August 6","AOC SLAMS MCCONNELL AFTER PHOTO OF YOUNG MEN IN 'TEAM MITCH' T-SHIRTS 'GROPING' CUTOUT SURFACES","null"
"1575050035-64850","https://www.foxnews.com/search-results/search?q=mitch%20mcconnell&ss=fn&section.path=fnc/politics&type=story&start=35","McConnell vows to be 'grim reaper' of socialist Dem proposals","https://www.foxnews.com/politics/mcconnell-vows-to-be-grim-reaper-of-socialist-dem-proposals","McConnell vows to be 'grim reaper' of socialist Dem proposals","McConnell vows to be 'grim reaper' of socialist Dem proposals","","April 22","Senate Majority Leader Mitch McConnell, known for years by the hardboiled moniker ""Cocaine Mitch,"" told community leaders in his hometown Kentucky on Monday that he wants a new nickname to reflect what he plans to do to a slew of far-left progressive policy proposals: ""grim reaper.""","null"
"1575050258-65294","https://www.foxnews.com/search-results/search?q=mitch%20mcconnell&ss=fn&section.path=fnc/politics&type=story&start=8","Ocasio-Cortez turns attention to Mitch McConnell amid ongoing feud with Trump over controversial comments","https://www.foxnews.com/politics/ocasio-cortez-mcconnell-trump-tweets","Ocasio-Cortez turns attention to Mitch McConnell amid ongoing feud with Trump over controversial comments","Ocasio-Cortez turns attention to Mitch McConnell amid ongoing feud with Trump over controversial comments","","July 16","Ocasio-Cortez similarly predicted the controversy could bode well for her party in the upcoming elections. ""Honestly, if these members go on the record condoning the president telling women of color to go back to their own country, I invite them to because we will win the 2020 election and we will take this country back.""","null"
"1575050222-65224","https://www.foxnews.com/search-results/search?q=mitch%20mcconnell&ss=fn&section.path=fnc/politics&type=story&start=12","From ‘Cocaine Mitch’ to ‘Grim Reaper,’ McConnell nicknames become political weapons","https://www.foxnews.com/politics/from-cocaine-mitch-to-grim-reaper-mcconnell-nicknames-become-political-weapons","From ‘Cocaine Mitch’ to ‘Grim Reaper,’ McConnell nicknames become political weapons","From ‘Cocaine Mitch’ to ‘Grim Reaper,’ McConnell nicknames become political weapons","","May 17","But back at the press conference, Schumer wondered if there was another way to neutralize Kryptonite.","null"
"1575050119-65022","https://www.foxnews.com/search-results/search?q=mitch%20mcconnell&ss=fn&section.path=fnc/politics&type=story&start=25","Mitch McConnell makes history as longest serving Senate Republican leader","https://www.foxnews.com/politics/mitch-mcconnell-makes-history-as-longest-serving-senate-republican-leader","Mitch McConnell makes history as longest serving Senate Republican leader","Mitch McConnell makes history as longest serving Senate Republican leader","","June 12, 2018","“We’re setting an incredibly dangerous precedent in the institution that I love,” former Vice President Joe Biden said.","null"
"1575050008-64814","https://www.foxnews.com/search-results/search?q=mitch%20mcconnell&ss=fn&section.path=fnc/politics&type=story&start=38","‘Moscow Mitch’ merchandise sales top $200,000 in 48 hours, Kentucky Dems say","https://www.foxnews.com/politics/moscow-mitch-merchandise-sales-top-200000-in-48-hours-kentucky-dems-say","‘Moscow Mitch’ merchandise sales top $200,000 in 48 hours, Kentucky Dems say","‘Moscow Mitch’ merchandise sales top $200,000 in 48 hours, Kentucky Dems say","","August 2","The pejorative nickname emerged when Washington Post writer Dana Milbank suggested in an article last week that Senate Majority Leader Mitch McConnell, R-Ky., was a “Russian asset” for blocking legislation to bolster election security.","null"
"1575049989-64770","https://www.foxnews.com/search-results/search?q=mitch%20mcconnell&ss=fn&section.path=fnc/politics&type=story&start=40","McConnell willing to consider ‘bipartisan’ gun violence solutions, opposes 'infringing' on rights","https://www.foxnews.com/politics/mcconnell-willing-to-consider-bipartisan-gun-violence-solutions-opposes-infringing-on-constitutional-rights","McConnell willing to consider ‘bipartisan’ gun violence solutions, opposes 'infringing' on rights","McConnell willing to consider ‘bipartisan’ gun violence solutions, opposes 'infringing' on rights","Alex Pappas","August 5","","null"
"1575050172-65121","https://www.foxnews.com/search-results/search?q=mitch%20mcconnell&ss=fn&section.path=fnc/politics&type=story&start=18","Dems divided on Green New Deal after Mitch McConnell ramps up pressure","https://www.foxnews.com/politics/dems-remain-divided-on-green-new-deal-after-mitch-mcconnell-ramps-up-pressure","Dems divided on Green New Deal after Mitch McConnell ramps up pressure","Dems divided on Green New Deal after Mitch McConnell ramps up pressure","","February 14","House Speaker Nancy Pelosi also threw shade on the Green New Deal earlier this month.","null"
"1575049989-64779","https://www.foxnews.com/search-results/search?q=mitch%20mcconnell&ss=fn&section.path=fnc/politics&type=story&start=40","McConnell willing to consider ‘bipartisan’ gun violence solutions, opposes 'infringing' on rights","https://www.foxnews.com/politics/mcconnell-willing-to-consider-bipartisan-gun-violence-solutions-opposes-infringing-on-constitutional-rights","McConnell willing to consider ‘bipartisan’ gun violence solutions, opposes 'infringing' on rights","McConnell willing to consider ‘bipartisan’ gun violence solutions, opposes 'infringing' on rights","","August 5","“These grants will be given to law enforcement so they can hire and consult with mental health professionals to better determine which cases need to be acted upon,” Graham said Monday. “This grant program also requires robust due process and judicial review. It does allow for quick action.”","null"
"1575050231-65235","https://www.foxnews.com/search-results/search?q=mitch%20mcconnell&ss=fn&section.path=fnc/politics&type=story&start=11","Mitch McConnell: 'For the first time in my memory, I agree with Nancy Pelosi'","https://www.foxnews.com/politics/mitch-mcconnell-for-the-first-time-in-my-memory-i-agree-with-nancy-pelosi","Mitch McConnell: 'For the first time in my memory, I agree with Nancy Pelosi'","Mitch McConnell: 'For the first time in my memory, I agree with Nancy Pelosi'","","June 13","Earlier in the day, Pelosi unveiled a ""McConnell's Graveyard"" poster, listing several legislative items, written on tombstones, suggesting that the GOP leader was happy to stall the measures in Congress, McConnell explained on ""The Ingraham Angle.""","null"
"1575050110-64993","https://www.foxnews.com/search-results/search?q=mitch%20mcconnell&ss=fn&section.path=fnc/politics&type=story&start=26","McConnell says he'd have 'no choice' but to take up impeachment articles if House approves them","https://www.foxnews.com/politics/mcconnell-says-he-has-no-choice-but-to-take-up-impeachment-articles-if-house-approves-them","McConnell says he'd have 'no choice' but to take up impeachment articles if House approves them","McConnell says he'd have 'no choice' but to take up impeachment articles if House approves them","","September 30","But last week, before House Speaker Nancy Pelosi, D-Calif., announced the formal impeachment inquiry in the House, McConnell said he was “not going to address all of these…hypotheticals.”","null"
"1575049977-64765","https://www.foxnews.com/search-results/search?q=mitch%20mcconnell&ss=fn&section.path=fnc/politics&type=story&start=42","Mitch McConnell says protesters who confronted him 'waited' until wife Elaine Chao was gone","https://www.foxnews.com/politics/mitch-mcconnell-says-protesters-who-confronted-him-waited-until-wife-elaine-chao-was-gone","Mitch McConnell says protesters who confronted him 'waited' until wife Elaine Chao was gone","Mitch McConnell says protesters who confronted him 'waited' until wife Elaine Chao was gone","","July 10, 2018","He also included the hashtag “#dontleavehomewithouther.”","null"
"1575050110-65006","https://www.foxnews.com/search-results/search?q=mitch%20mcconnell&ss=fn&section.path=fnc/politics&type=story&start=26","McConnell says he'd have 'no choice' but to take up impeachment articles if House approves them","https://www.foxnews.com/politics/mcconnell-says-he-has-no-choice-but-to-take-up-impeachment-articles-if-house-approves-them","McConnell says he'd have 'no choice' but to take up impeachment articles if House approves them","McConnell says he'd have 'no choice' but to take up impeachment articles if House approves them","","September 30","CLICK HERE FOR THE ALL-NEW FOXBUSINESS.COM","null"
"1575050051-64883","https://www.foxnews.com/search-results/search?q=mitch%20mcconnell&ss=fn&section.path=fnc/politics&type=story&start=33","GOP leaders decry Kavanaugh attacks as McConnell says 'this is not normal political behavior'","https://www.foxnews.com/politics/brett-kavanaugh-mitch-mcconnell-lindsey-graham-impeachment-calls","GOP leaders decry Kavanaugh attacks as McConnell says 'this is not normal political behavior'","GOP leaders decry Kavanaugh attacks as McConnell says 'this is not normal political behavior'","","September 16","South Carolina Republican Sen. Lindsey Graham, the Judiciary Committee chairman who mounted one of the most passionate defenses of Kavanaugh during his confirmation hearing, called the attacks “beyond the pale.”","null"
"1575050249-65276","https://www.foxnews.com/search-results/search?q=mitch%20mcconnell&ss=fn&section.path=fnc/politics&type=story&start=9","Marine combat aviator Amy McGrath announces Senate campaign against Mitch McConnell","https://www.foxnews.com/politics/marine-combat-aviator-amy-mcgrath-announces-senate-campaign-against-mitch-mcconnell-after-narrow-house-defeat","Marine combat aviator Amy McGrath announces Senate campaign against Mitch McConnell","Marine combat aviator Amy McGrath announces Senate campaign against Mitch McConnell","","July 9","McGrath believes that people in her state voted for Trump due to promises to “drain the swamp” and lower prices of prescription drugs; promises she does not believe the president has fulfilled.","null"
