web-scraper-order,web-scraper-start-url,article_links,article_links-href,title,subtitle,author,date,content,
"1575049448-64167","https://www.foxnews.com/search-results/search?q=joe%20biden&ss=fn&section.path=fnc/politics&type=story&start=33","Lara Trump: Timing of Joe Biden accusations seems 'very convenient'","https://www.foxnews.com/politics/lara-trump-the-timing-of-the-biden-accusations-seem-convenient","Lara Trump: Timing of Joe Biden accusations seems 'very convenient'","Lara Trump: Timing of Joe Biden accusations seems 'very convenient'","","April 5","Trump 2020 senior campaign advisor Lara Trump expressed some suspicions that accusations of inappropriate touching against former Vice President Joe Biden happened to emerge on the cusp of his expected 2020 presidential announcement.","null"
"1575049429-64157","https://www.foxnews.com/search-results/search?q=joe%20biden&ss=fn&section.path=fnc/politics&type=story&start=35","Trump says ahead of debates he thinks 'Sleepy Joe' Biden will be 2020 Democratic nominee","https://www.foxnews.com/politics/trump-says-he-thinks-sleepy-joe-biden-will-be-2020-democratic-nominee-ahead-of-debates","Trump says ahead of debates he thinks 'Sleepy Joe' Biden will be 2020 Democratic nominee","Trump says ahead of debates he thinks 'Sleepy Joe' Biden will be 2020 Democratic nominee","","July 30","BIDEN SLAMS TRUMP AS 'EXISTENTIAL THREAT'","null"
"1575049282-63906","https://www.foxnews.com/search-results/search?q=joe%20biden&ss=fn&section.path=fnc/politics&type=story&start=50","MSNBC's Scarborough defends Joe Biden, cites FDR in wake of attacks for working with segregationist senators","https://www.foxnews.com/politics/scarborough-cites-fdr-to-stand-up-for-biden-following-segregation-comments","MSNBC's Scarborough defends Joe Biden, cites FDR in wake of attacks for working with segregationist senators","MSNBC's Scarborough defends Joe Biden, cites FDR in wake of attacks for working with segregationist senators","Nick Givas","June 20","","null"
"1575049511-64259","https://www.foxnews.com/search-results/search?q=joe%20biden&ss=fn&section.path=fnc/politics&type=story&start=26","Stirewalt: Joe Biden campaign rollout was 'quite successful'","https://www.foxnews.com/politics/stirewalt-joe-biden-campaign-roll-out-was-quite-successful","Stirewalt: Joe Biden campaign rollout was 'quite successful'","Stirewalt: Joe Biden campaign rollout was 'quite successful'","","April 30","MIKA BRZEZINSKI DISMISSES JOE BIDEN ALLEGATIONS: 'I REFUSE TO GIVE IT ANY MORE TIME'","null"
"1575049575-64346","https://www.foxnews.com/search-results/search?q=joe%20biden&ss=fn&section.path=fnc/politics&type=story&start=19","Joe Biden slammed by editor of democratic socialist magazine: 'A Biden victory is not preordained'","https://www.foxnews.com/politics/editor-at-socialist-magazine-attack-biden-in-order-to-beat-trump-in-2020","Joe Biden slammed by editor of democratic socialist magazine: 'A Biden victory is not preordained'","Joe Biden slammed by editor of democratic socialist magazine: 'A Biden victory is not preordained'","","June 6","Biden, on Wednesday, released a costly climate change plan that seemed at least partially to be an attempt at warding off progressive criticism. After his staff indicated in May that Biden sought a middle way on the issue, Rep. Alexandria Ocasio-Cortez, D-N.Y., took a veiled shot at his moderation.","null"
"1575049503-64250","https://www.foxnews.com/search-results/search?q=joe%20biden&ss=fn&section.path=fnc/politics&type=story&start=27","Why the media are convinced Joe Biden will implode","https://www.foxnews.com/politics/why-the-media-are-convinced-joe-biden-will-implode","Why the media are convinced Joe Biden will implode","Why the media are convinced Joe Biden will implode","","April 26","CLICK HERE TO GET THE FOX NEWS APP","null"
"1575049320-63983","https://www.foxnews.com/search-results/search?q=joe%20biden&ss=fn&section.path=fnc/politics&type=story&start=46","Joe Biden making millions, living in lavish homes since leaving office: report","https://www.foxnews.com/politics/joe-biden-has-made-millions-since-leaving-vice-presidency-moved-into-5m-mansion-report","Joe Biden making millions, living in lavish homes since leaving office: report","Joe Biden making millions, living in lavish homes since leaving office: report","","June 25","CLICK HERE TO GET THE FOX NEWS APP","null"
"1575049538-64305","https://www.foxnews.com/search-results/search?q=joe%20biden&ss=fn&section.path=fnc/politics&type=story&start=23","Trump debuts new nickname for Biden: ‘SleepyCreepy Joe'","https://www.foxnews.com/politics/trump-debuts-new-nickname-for-biden-sleepycreepy-joe","Trump debuts new nickname for Biden: ‘SleepyCreepy Joe'","Trump debuts new nickname for Biden: ‘SleepyCreepy Joe'","","May 10","A new Monmouth University poll in the vital primary state of New Hampshire shows Biden with 36 percent support among registered Democrats, with Bernie Sanders trailing him at 18 percent. All other candidates are in single digits.","null"
"1575049738-64637","https://www.foxnews.com/search-results/search?q=joe%20biden&ss=fn&section.path=fnc/politics&type=story&start=3","Mayor of Pocahontas backs Joe Biden, not Elizabeth Warren","https://www.foxnews.com/politics/mayor-pocahontas-iowa-backs-joe-biden-elizabeth-warren","Mayor of Pocahontas backs Joe Biden, not Elizabeth Warren","Mayor of Pocahontas backs Joe Biden, not Elizabeth Warren","","November 9","In August this year, he said his only regret was that he may have attacked her too early, and said that more attacks could be coming down the pipeline..","null"
"1575049556-64316","https://www.foxnews.com/search-results/search?q=joe%20biden&ss=fn&section.path=fnc/politics&type=story&start=21","Joe Biden claims he once told Vladimir Putin ‘I don’t think you have a soul’","https://www.foxnews.com/politics/biden-claims-putin-no-soul","Joe Biden claims he once told Vladimir Putin ‘I don’t think you have a soul’","Joe Biden claims he once told Vladimir Putin ‘I don’t think you have a soul’","","September 6","During the fundraiser, Biden vowed to get tough with Putin if elected president.","null"
"1575049368-64038","https://www.foxnews.com/search-results/search?q=joe%20biden&ss=fn&section.path=fnc/politics&type=story&start=41","Juan Williams: Joe Biden in 'big trouble' after CNN interview revelation","https://www.foxnews.com/politics/juan-williams-joe-biden-in-big-trouble-after-cnn-interview-revelation","Juan Williams: Joe Biden in 'big trouble' after CNN interview revelation","Juan Williams: Joe Biden in 'big trouble' after CNN interview revelation","Victor Garcia","July 5","","null"
"1575049410-64109","https://www.foxnews.com/search-results/search?q=joe%20biden&ss=fn&section.path=fnc/politics&type=story&start=37","Joe Biden takes indirect shot at Kamala Harris over her support for Medicare for All","https://www.foxnews.com/politics/joe-biden-shot-kamala-harris-medicare-for-all","Joe Biden takes indirect shot at Kamala Harris over her support for Medicare for All","Joe Biden takes indirect shot at Kamala Harris over her support for Medicare for All","","July 13","At those debates, Sen. Elizabeth Warren of Massachusetts showcased her strong support for Medicare for All. Warren, along with Harris and two more White House contenders – Sens. Cory Booker of New Jersey and Kirsten Gillibrand of New York – co-sponsored the 2017 Medicare for All bill introduced by Sanders.","null"
"1575049503-64227","https://www.foxnews.com/search-results/search?q=joe%20biden&ss=fn&section.path=fnc/politics&type=story&start=27","Why the media are convinced Joe Biden will implode","https://www.foxnews.com/politics/why-the-media-are-convinced-joe-biden-will-implode","Why the media are convinced Joe Biden will implode","Why the media are convinced Joe Biden will implode","Howard Kurtz","April 26","","null"
"1575049398-64093","https://www.foxnews.com/search-results/search?q=joe%20biden&ss=fn&section.path=fnc/politics&type=story&start=38","Biden drops to fourth among Iowa Democrats, new poll shows","https://www.foxnews.com/politics/biden-drops-to-4th-in-iowa-among-dems-new-poll-shows","Biden drops to fourth among Iowa Democrats, new poll shows","Biden drops to fourth among Iowa Democrats, new poll shows","","November 6","CLICK HERE FOR THE FOX NEWS APP","null"
"1575049730-64621","https://www.foxnews.com/search-results/search?q=joe%20biden&ss=fn&section.path=fnc/politics&type=story&start=4","Joe Biden slips in latest New Hampshire poll","https://www.foxnews.com/politics/biden-new-nh-poll","Joe Biden slips in latest New Hampshire poll","Joe Biden slips in latest New Hampshire poll","","October 29","In the Republican presidential primary, Trump remains the overwhelming front-runner, with 86 percent support among likely GOP primary voters in New Hampshire.","null"
"1575049529-64291","https://www.foxnews.com/search-results/search?q=joe%20biden&ss=fn&section.path=fnc/politics&type=story&start=24","Bernie Sanders slams Joe Biden campaign for accepting super PAC donations in effort to 'buy the election'","https://www.foxnews.com/politics/bernie-sanders-joe-biden-super-pac-big-donors-buy-election-2020","Bernie Sanders slams Joe Biden campaign for accepting super PAC donations in effort to 'buy the election'","Bernie Sanders slams Joe Biden campaign for accepting super PAC donations in effort to 'buy the election'","","October 25","While Biden’s campaign this week softened its stance on accepting super PAC donations, Sanders boasted his bid for the presidency is 100 percent grassroots funded. Biden’s campaign told Fox News on Thursday that he is still committed to eradicating private donations from federal elections — but until he becomes president, is open to big-donor contributions to defeat Trump.","null"
"1575049485-64210","https://www.foxnews.com/search-results/search?q=joe%20biden&ss=fn&section.path=fnc/politics&type=story&start=29","Joe Biden confuses Burlington, Iowa, with Burlington, Vt., in latest gaffe","https://www.foxnews.com/politics/joe-biden-confuses-burlington-iowa-for-burlington-vt-in-latest-gaffe","Joe Biden confuses Burlington, Iowa, with Burlington, Vt., in latest gaffe","Joe Biden confuses Burlington, Iowa, with Burlington, Vt., in latest gaffe","Brie Stimson","August 17","","null"
"1575049556-64311","https://www.foxnews.com/search-results/search?q=joe%20biden&ss=fn&section.path=fnc/politics&type=story&start=21","Joe Biden claims he once told Vladimir Putin ‘I don’t think you have a soul’","https://www.foxnews.com/politics/biden-claims-putin-no-soul","Joe Biden claims he once told Vladimir Putin ‘I don’t think you have a soul’","Joe Biden claims he once told Vladimir Putin ‘I don’t think you have a soul’","","September 6","During a fundraiser in New York on Thursday, Biden spoke of meeting with Putin while he was vice president during the Obama administration.","null"
"1575049398-64081","https://www.foxnews.com/search-results/search?q=joe%20biden&ss=fn&section.path=fnc/politics&type=story&start=38","Biden drops to fourth among Iowa Democrats, new poll shows","https://www.foxnews.com/politics/biden-drops-to-4th-in-iowa-among-dems-new-poll-shows","Biden drops to fourth among Iowa Democrats, new poll shows","Biden drops to fourth among Iowa Democrats, new poll shows","","November 6","AIRTIGHT PRIMARY RACE IN IOWA AS BUTTIGIEG BREAKS INTO TOP TIER: POLL","null"
"1575049584-64381","https://www.foxnews.com/search-results/search?q=joe%20biden&ss=fn&section.path=fnc/politics&type=story&start=18","Joe Biden builds massive lead among black voters","https://www.foxnews.com/politics/joe-biden-massive-black-voters","Joe Biden builds massive lead among black voters","Joe Biden builds massive lead among black voters","","May 21","Brazile noted: “It's early.”","null"
"1575049599-64403","https://www.foxnews.com/search-results/search?q=joe%20biden&ss=fn&section.path=fnc/politics&type=story&start=16","Joe Biden accused of plagiarizing parts of new climate platform","https://www.foxnews.com/politics/biden-accused-of-plagiarizing-parts-of-new-climate-platform","Joe Biden accused of plagiarizing parts of new climate platform","Joe Biden accused of plagiarizing parts of new climate platform","","June 4","By Tuesday afternoon, attribution was apparently added to both parts to give credit to the Blue Green Alliance and Carbon Capture Coalition.","null"
"1575049712-64579","https://www.foxnews.com/search-results/search?q=joe%20biden&ss=fn&section.path=fnc/politics&type=story&start=6","Joe Biden officially launches 2020 presidential bid","https://www.foxnews.com/politics/biden-officially-launches-2020-presidential-bid","Joe Biden officially launches 2020 presidential bid","Joe Biden officially launches 2020 presidential bid","","April 25","Trump’s upset victory over Clinton in the 2016 presidential election changed the dynamic for Biden. He soon became a vocal critic of the Republican in the White House, and speculation sprang up that Biden would consider a final presidential bid in 2020. Trips to New Hampshire in 2017 and to Iowa, South Carolina and Iowa in 2018 fueled the flames.","null"
"1575049692-64517","https://www.foxnews.com/search-results/search?q=joe%20biden&ss=fn&section.path=fnc/politics&type=story&start=8","Joe Biden defends son Hunter's Ukraine work: 'My son did nothing wrong. I did nothing wrong'","https://www.foxnews.com/politics/biden-answers-question-on-hunter-biden-my-son-did-nothing-wrong-i-did-nothing-wrong","Joe Biden defends son Hunter's Ukraine work: 'My son did nothing wrong. I did nothing wrong'","Joe Biden defends son Hunter's Ukraine work: 'My son did nothing wrong. I did nothing wrong'","","October 15","Former Vice President Joe Biden insisted during the 2020 Democratic presidential primary debate on Tuesday night that neither he nor his son Hunter did anything ""wrong"" when it comes to the younger Biden's past work in Ukraine.","null"
"1575049309-63957","https://www.foxnews.com/search-results/search?q=joe%20biden&ss=fn&section.path=fnc/politics&type=story&start=47","Lara Trump: Joe Biden tanking earlier than expected, 'maybe he regrets now even deciding to run'","https://www.foxnews.com/politics/lara-trump-joe-biden-gaffes","Lara Trump: Joe Biden tanking earlier than expected, 'maybe he regrets now even deciding to run'","Lara Trump: Joe Biden tanking earlier than expected, 'maybe he regrets now even deciding to run'","","June 24","TRUMP: 'SLEEPY JOE BIDEN' HASN'T 'APOLOGIZED' FOR INVOLVEMENT IN 1994 CRIME LAW","null"
"1575049349-64012","https://www.foxnews.com/search-results/search?q=joe%20biden&ss=fn&section.path=fnc/politics&type=story&start=43","Donna Brazile on Kamala Harris confronting Joe Biden: 'It's right to bring these issues up'","https://www.foxnews.com/politics/donna-brazile-joe-biden-debate-racial-justice","Donna Brazile on Kamala Harris confronting Joe Biden: 'It's right to bring these issues up'","Donna Brazile on Kamala Harris confronting Joe Biden: 'It's right to bring these issues up'","","June 28","Former Democratic National Committee Chair Donna Brazile responded Friday to presidential candidates Joe Biden and Kamala Harris sparring at Thursday night's debate over the vice president's voting history on civil rights issues.","null"
"1575049511-64264","https://www.foxnews.com/search-results/search?q=joe%20biden&ss=fn&section.path=fnc/politics&type=story&start=26","Stirewalt: Joe Biden campaign rollout was 'quite successful'","https://www.foxnews.com/politics/stirewalt-joe-biden-campaign-roll-out-was-quite-successful","Stirewalt: Joe Biden campaign rollout was 'quite successful'","Stirewalt: Joe Biden campaign rollout was 'quite successful'","","April 30","Biden said that in a private conversation with Hill, he expressed regret for the way her hearing was conducted. He did not, however, apologize for his own actions because, he said, he didn't treat her ""badly.""","null"
"1575049637-64466","https://www.foxnews.com/search-results/search?q=joe%20biden&ss=fn&section.path=fnc/politics&type=story&start=12","Former Democratic Sen. Joe Lieberman: Joe Biden had nothing 'to apologize for'","https://www.foxnews.com/politics/former-democrat-joe-lieberman-joe-biden-had-nothing-to-apologize-for","Former Democratic Sen. Joe Lieberman: Joe Biden had nothing 'to apologize for'","Former Democratic Sen. Joe Lieberman: Joe Biden had nothing 'to apologize for'","David Montanaro","July 8","","null"
