web-scraper-order,web-scraper-start-url,pages,pages-href,title,articles,articles-href,subtitle,author,date,content
"1571529545-8094","https://search.huffpost.com/search;_ylt=Awr9IMlInatdKGMAA01sBmVH;_ylc=X1MDMTE5NzgwMzExNgRfcgMyBGZyA2h1ZmZwb3N0BGdwcmlkA3pDOXU2QklRUjN5WF9xaUtkTGhyUkEEbl9yc2x0AzAEbl9zdWdnAzEwBG9yaWdpbgNzZWFyY2guaHVmZnBvc3QuY29tBHBvcwMwBHBxc3RyAwRwcXN0cmwDMARxc3RybAMxMwRxdWVyeQNiYXJyYWNrJTIwb2JhbWEEdF9zdG1wAzE1NzE1Mjk0Mzg-?p=barrack+obama&fr2=sb-top&fr=huffpost","4","https://search.huffpost.com/search;_ylt=Awr9IlEbo6tdEXQAe5JsBmVH;_ylu=X3oDMTEza3NiY3RnBGNvbG8DZ3ExBHBvcwMxBHZ0aWQDBHNlYwNwYWdpbmF0aW9u?p=barrack+obama&fr=huffpost&fr2=sb-top&b=31&pz=10&bct=0&xargs=0","Obama Announces New Push In Fight Against Gerrymandering","Obama Announces New Push In Fight Against Gerrymandering","https://search.huffpost.com/click/_ylt=Awr9DtY0o6tdceIA0Y1sBmVH;_ylu=X3oDMTByNWU4cGh1BGNvbG8DZ3ExBHBvcwMxBHZ0aWQDBHNlYwNzYw--/RV=2/RE=1571558324/RO=10/RU=https%3a%2f%2fwww.huffpost.com%2fentry%2fobama-gerrymandering-training_n_5d655e7ae4b01fcc690aa2cc/RK=2/RS=DgwOlASjr1o9Hln8IyDyM6sokBM-","A new program will train people in the basics of redistricting and why it matters to their everyday lives.","","08/27/2019 01:29 pm ET","The redistricting process, which takes just once per decade, is expected to be a brutal brawl for partisan advantage. The United States Supreme Court ruled in June that there were no constitutional limits on how severely states could manipulate district lines to benefit political parties."
"1571529507-7885","https://search.huffpost.com/search;_ylt=Awr9IMlInatdKGMAA01sBmVH;_ylc=X1MDMTE5NzgwMzExNgRfcgMyBGZyA2h1ZmZwb3N0BGdwcmlkA3pDOXU2QklRUjN5WF9xaUtkTGhyUkEEbl9yc2x0AzAEbl9zdWdnAzEwBG9yaWdpbgNzZWFyY2guaHVmZnBvc3QuY29tBHBvcwMwBHBxc3RyAwRwcXN0cmwDMARxc3RybAMxMwRxdWVyeQNiYXJyYWNrJTIwb2JhbWEEdF9zdG1wAzE1NzE1Mjk0Mzg-?p=barrack+obama&fr2=sb-top&fr=huffpost","5","https://search.huffpost.com/search;_ylt=Awr9IlEbo6tdEXQAfJJsBmVH;_ylu=X3oDMTEza3NiY3RnBGNvbG8DZ3ExBHBvcwMxBHZ0aWQDBHNlYwNwYWdpbmF0aW9u?p=barrack+obama&fr=huffpost&fr2=sb-top&b=41&pz=10&bct=0&xargs=0","After Taking Presidential Corruption To New Heights, Trump Calls Everyone Else Corrupt","Trump Takes Presidential Corruption To New Heights, Calls Everyone Else Corrupt","https://search.huffpost.com/click/_ylt=Awr9CKkdo6td5VIAGsdsBmVH;_ylu=X3oDMTByNWU4cGh1BGNvbG8DZ3ExBHBvcwMxBHZ0aWQDBHNlYwNzYw--/RV=2/RE=1571558301/RO=10/RU=https%3a%2f%2fwww.huffpost.com%2fentry%2ftrump-corruption-projection_n_5da8bae5e4b034f1d69f56ac/RK=2/RS=D3C2iXyBJZlgxtzQuguSDyWrVzQ-","Trump has called Democratic leaders, the news media, former President Barack Obama and the entire 2016 election “corrupt.”","","10/17/2019 04:42 pm ET","WASHINGTON — Look up “corrupt” in the dictionary and you could expect to find an illustration of Donald Trump looking right back ― yet that has not kept the president from repeatedly calling others corrupt in recent weeks."
"1571529547-8108","https://search.huffpost.com/search;_ylt=Awr9IMlInatdKGMAA01sBmVH;_ylc=X1MDMTE5NzgwMzExNgRfcgMyBGZyA2h1ZmZwb3N0BGdwcmlkA3pDOXU2QklRUjN5WF9xaUtkTGhyUkEEbl9yc2x0AzAEbl9zdWdnAzEwBG9yaWdpbgNzZWFyY2guaHVmZnBvc3QuY29tBHBvcwMwBHBxc3RyAwRwcXN0cmwDMARxc3RybAMxMwRxdWVyeQNiYXJyYWNrJTIwb2JhbWEEdF9zdG1wAzE1NzE1Mjk0Mzg-?p=barrack+obama&fr2=sb-top&fr=huffpost","4","https://search.huffpost.com/search;_ylt=Awr9IlEbo6tdEXQAe5JsBmVH;_ylu=X3oDMTEza3NiY3RnBGNvbG8DZ3ExBHBvcwMxBHZ0aWQDBHNlYwNwYWdpbmF0aW9u?p=barrack+obama&fr=huffpost&fr2=sb-top&b=31&pz=10&bct=0&xargs=0","Obama Calls For Gun Control, Condemns Racist Language After Mass Shootings","Obama Calls For Gun Control, Condemns Racist Language After Mass Shootings","https://search.huffpost.com/click/_ylt=Awr9DtY0o6tdceIAz41sBmVH;_ylu=X3oDMTByNWU4cGh1BGNvbG8DZ3ExBHBvcwMxBHZ0aWQDBHNlYwNzYw--/RV=2/RE=1571558324/RO=10/RU=https%3a%2f%2fwww.huffpost.com%2fentry%2fobama-mass-shootings-el-paso_n_5d488292e4b0acb57fd11cd1/RK=2/RS=JCKejYiWdgW5wYlc.QlynBIVFDo-","“We should soundly reject language coming out of the mouths of any of our leaders that feeds a climate of fear and hatred,” the former president said.","","08/05/2019 04:35 pm ET","“We should soundly reject language coming out of the mouths of any of our leaders that feeds a climate of fear and hatred or normalizes racist sentiments,” the former president wrote."
"1571529580-8236","https://search.huffpost.com/search;_ylt=Awr9IMlInatdKGMAA01sBmVH;_ylc=X1MDMTE5NzgwMzExNgRfcgMyBGZyA2h1ZmZwb3N0BGdwcmlkA3pDOXU2QklRUjN5WF9xaUtkTGhyUkEEbl9yc2x0AzAEbl9zdWdnAzEwBG9yaWdpbgNzZWFyY2guaHVmZnBvc3QuY29tBHBvcwMwBHBxc3RyAwRwcXN0cmwDMARxc3RybAMxMwRxdWVyeQNiYXJyYWNrJTIwb2JhbWEEdF9zdG1wAzE1NzE1Mjk0Mzg-?p=barrack+obama&fr2=sb-top&fr=huffpost","2","https://search.huffpost.com/search;_ylt=Awr9IlEbo6tdEXQAeZJsBmVH;_ylu=X3oDMTEza3NiY3RnBGNvbG8DZ3ExBHBvcwMxBHZ0aWQDBHNlYwNwYWdpbmF0aW9u?p=barrack+obama&fr=huffpost&fr2=sb-top&b=11&pz=10&bct=0&xargs=0","Van Jones: Hillary Clinton Is Playing A ‘Dangerous Game’ With Tulsi Gabbard Remarks","Van Jones: Hillary Clinton Is Playing A 'Dangerous Game' With Tulsi Gabbard Remarks","https://search.huffpost.com/click/_ylt=Awr9BNxmo6tdNZYAu3BsBmVH;_ylu=X3oDMTByNWU4cGh1BGNvbG8DZ3ExBHBvcwMxBHZ0aWQDBHNlYwNzYw--/RV=2/RE=1571558375/RO=10/RU=https%3a%2f%2fwww.huffpost.com%2fentry%2fvan-jones-hillary-clinton-tulsi-gabbard-russia_n_5dab2311e4b0422422c5998b/RK=2/RS=j2hWnXT4Sl8S052RgZxum6SgJ_8-","The CNN host said he doesn’t want Clinton’s comments on Gabbard and Russia to “legitimate these kind of attacks against anybody.”","","10/19/2019 03:44 pm ET","During a conversation about the 2020 election with Plouffe, former senior adviser to Barack Obama, Clinton appeared to single out Gabbard, before unleashing accusations about Jill Stein’s 2016 presidential campaign and Russia. (Stein slammed Clinton’s comments on Twitter.)"
"1571529580-8242","https://search.huffpost.com/search;_ylt=Awr9IMlInatdKGMAA01sBmVH;_ylc=X1MDMTE5NzgwMzExNgRfcgMyBGZyA2h1ZmZwb3N0BGdwcmlkA3pDOXU2QklRUjN5WF9xaUtkTGhyUkEEbl9yc2x0AzAEbl9zdWdnAzEwBG9yaWdpbgNzZWFyY2guaHVmZnBvc3QuY29tBHBvcwMwBHBxc3RyAwRwcXN0cmwDMARxc3RybAMxMwRxdWVyeQNiYXJyYWNrJTIwb2JhbWEEdF9zdG1wAzE1NzE1Mjk0Mzg-?p=barrack+obama&fr2=sb-top&fr=huffpost","2","https://search.huffpost.com/search;_ylt=Awr9IlEbo6tdEXQAeZJsBmVH;_ylu=X3oDMTEza3NiY3RnBGNvbG8DZ3ExBHBvcwMxBHZ0aWQDBHNlYwNwYWdpbmF0aW9u?p=barrack+obama&fr=huffpost&fr2=sb-top&b=11&pz=10&bct=0&xargs=0","Van Jones: Hillary Clinton Is Playing A ‘Dangerous Game’ With Tulsi Gabbard Remarks","Van Jones: Hillary Clinton Is Playing A 'Dangerous Game' With Tulsi Gabbard Remarks","https://search.huffpost.com/click/_ylt=Awr9BNxmo6tdNZYAu3BsBmVH;_ylu=X3oDMTByNWU4cGh1BGNvbG8DZ3ExBHBvcwMxBHZ0aWQDBHNlYwNzYw--/RV=2/RE=1571558375/RO=10/RU=https%3a%2f%2fwww.huffpost.com%2fentry%2fvan-jones-hillary-clinton-tulsi-gabbard-russia_n_5dab2311e4b0422422c5998b/RK=2/RS=j2hWnXT4Sl8S052RgZxum6SgJ_8-","The CNN host said he doesn’t want Clinton’s comments on Gabbard and Russia to “legitimate these kind of attacks against anybody.”","","10/19/2019 03:44 pm ET","Gabbard, who has repeatedly said she would not run as a third-party candidate if she loses the Democratic nomination, fired back at Clinton’s claims in a series of tweets on Friday."
"1571529507-7888","https://search.huffpost.com/search;_ylt=Awr9IMlInatdKGMAA01sBmVH;_ylc=X1MDMTE5NzgwMzExNgRfcgMyBGZyA2h1ZmZwb3N0BGdwcmlkA3pDOXU2QklRUjN5WF9xaUtkTGhyUkEEbl9yc2x0AzAEbl9zdWdnAzEwBG9yaWdpbgNzZWFyY2guaHVmZnBvc3QuY29tBHBvcwMwBHBxc3RyAwRwcXN0cmwDMARxc3RybAMxMwRxdWVyeQNiYXJyYWNrJTIwb2JhbWEEdF9zdG1wAzE1NzE1Mjk0Mzg-?p=barrack+obama&fr2=sb-top&fr=huffpost","5","https://search.huffpost.com/search;_ylt=Awr9IlEbo6tdEXQAfJJsBmVH;_ylu=X3oDMTEza3NiY3RnBGNvbG8DZ3ExBHBvcwMxBHZ0aWQDBHNlYwNwYWdpbmF0aW9u?p=barrack+obama&fr=huffpost&fr2=sb-top&b=41&pz=10&bct=0&xargs=0","After Taking Presidential Corruption To New Heights, Trump Calls Everyone Else Corrupt","Trump Takes Presidential Corruption To New Heights, Calls Everyone Else Corrupt","https://search.huffpost.com/click/_ylt=Awr9CKkdo6td5VIAGsdsBmVH;_ylu=X3oDMTByNWU4cGh1BGNvbG8DZ3ExBHBvcwMxBHZ0aWQDBHNlYwNzYw--/RV=2/RE=1571558301/RO=10/RU=https%3a%2f%2fwww.huffpost.com%2fentry%2ftrump-corruption-projection_n_5da8bae5e4b034f1d69f56ac/RK=2/RS=D3C2iXyBJZlgxtzQuguSDyWrVzQ-","Trump has called Democratic leaders, the news media, former President Barack Obama and the entire 2016 election “corrupt.”","","10/17/2019 04:42 pm ET","Indeed, such actions, had they been taken by a mayor, a county executive or a governor, would in all likelihood result in state or federal public corruption charges. While laws and rules vary by state and locality, ethics laws generally prohibit public officials from profiting from their offices."
"1571529547-8104","https://search.huffpost.com/search;_ylt=Awr9IMlInatdKGMAA01sBmVH;_ylc=X1MDMTE5NzgwMzExNgRfcgMyBGZyA2h1ZmZwb3N0BGdwcmlkA3pDOXU2QklRUjN5WF9xaUtkTGhyUkEEbl9yc2x0AzAEbl9zdWdnAzEwBG9yaWdpbgNzZWFyY2guaHVmZnBvc3QuY29tBHBvcwMwBHBxc3RyAwRwcXN0cmwDMARxc3RybAMxMwRxdWVyeQNiYXJyYWNrJTIwb2JhbWEEdF9zdG1wAzE1NzE1Mjk0Mzg-?p=barrack+obama&fr2=sb-top&fr=huffpost","4","https://search.huffpost.com/search;_ylt=Awr9IlEbo6tdEXQAe5JsBmVH;_ylu=X3oDMTEza3NiY3RnBGNvbG8DZ3ExBHBvcwMxBHZ0aWQDBHNlYwNwYWdpbmF0aW9u?p=barrack+obama&fr=huffpost&fr2=sb-top&b=31&pz=10&bct=0&xargs=0","Obama Calls For Gun Control, Condemns Racist Language After Mass Shootings","Obama Calls For Gun Control, Condemns Racist Language After Mass Shootings","https://search.huffpost.com/click/_ylt=Awr9DtY0o6tdceIAz41sBmVH;_ylu=X3oDMTByNWU4cGh1BGNvbG8DZ3ExBHBvcwMxBHZ0aWQDBHNlYwNzYw--/RV=2/RE=1571558324/RO=10/RU=https%3a%2f%2fwww.huffpost.com%2fentry%2fobama-mass-shootings-el-paso_n_5d488292e4b0acb57fd11cd1/RK=2/RS=JCKejYiWdgW5wYlc.QlynBIVFDo-","“We should soundly reject language coming out of the mouths of any of our leaders that feeds a climate of fear and hatred,” the former president said.","","08/05/2019 04:35 pm ET","“No other developed nation tolerates the levels of gun violence that we do,” he said Monday. “Every time this happens, we’re told that tougher gun laws won’t stop all murders. … But the evidence shows that they can stop some killings.”"
"1571529511-7923","https://search.huffpost.com/search;_ylt=Awr9IMlInatdKGMAA01sBmVH;_ylc=X1MDMTE5NzgwMzExNgRfcgMyBGZyA2h1ZmZwb3N0BGdwcmlkA3pDOXU2QklRUjN5WF9xaUtkTGhyUkEEbl9yc2x0AzAEbl9zdWdnAzEwBG9yaWdpbgNzZWFyY2guaHVmZnBvc3QuY29tBHBvcwMwBHBxc3RyAwRwcXN0cmwDMARxc3RybAMxMwRxdWVyeQNiYXJyYWNrJTIwb2JhbWEEdF9zdG1wAzE1NzE1Mjk0Mzg-?p=barrack+obama&fr2=sb-top&fr=huffpost","5","https://search.huffpost.com/search;_ylt=Awr9IlEbo6tdEXQAfJJsBmVH;_ylu=X3oDMTEza3NiY3RnBGNvbG8DZ3ExBHBvcwMxBHZ0aWQDBHNlYwNwYWdpbmF0aW9u?p=barrack+obama&fr=huffpost&fr2=sb-top&b=41&pz=10&bct=0&xargs=0","April Ryan Abruptly Drops Out Of Fundraiser Interview With Pete Buttigieg","April Ryan Abruptly Drops Out Of Fundraiser Interview With Pete Buttigieg","https://search.huffpost.com/click/_ylt=Awr9CKkdo6td5VIAFsdsBmVH;_ylu=X3oDMTByNWU4cGh1BGNvbG8DZ3ExBHBvcwMxBHZ0aWQDBHNlYwNzYw--/RV=2/RE=1571558301/RO=10/RU=https%3a%2f%2fwww.huffpost.com%2fentry%2fapril-ryan-pete-buttigieg-campaign-event_n_5daa013be4b0f34e3a7540a6/RK=2/RS=UZtqVJLlTugcWhCPtjUpFWuYcN4-","The CNN political analyst and Washington bureau chief for American Urban Radio Networks said she didn’t realize it was a fundraiser.","","10/18/2019 05:15 pm ET","On Friday, the American Urban Radio Networks Washington bureau chief and CNN political analyst announced her decision in a tweet, saying “the campaign was not clear that the venue would be a fundraiser.”"
"1571529507-7892","https://search.huffpost.com/search;_ylt=Awr9IMlInatdKGMAA01sBmVH;_ylc=X1MDMTE5NzgwMzExNgRfcgMyBGZyA2h1ZmZwb3N0BGdwcmlkA3pDOXU2QklRUjN5WF9xaUtkTGhyUkEEbl9yc2x0AzAEbl9zdWdnAzEwBG9yaWdpbgNzZWFyY2guaHVmZnBvc3QuY29tBHBvcwMwBHBxc3RyAwRwcXN0cmwDMARxc3RybAMxMwRxdWVyeQNiYXJyYWNrJTIwb2JhbWEEdF9zdG1wAzE1NzE1Mjk0Mzg-?p=barrack+obama&fr2=sb-top&fr=huffpost","5","https://search.huffpost.com/search;_ylt=Awr9IlEbo6tdEXQAfJJsBmVH;_ylu=X3oDMTEza3NiY3RnBGNvbG8DZ3ExBHBvcwMxBHZ0aWQDBHNlYwNwYWdpbmF0aW9u?p=barrack+obama&fr=huffpost&fr2=sb-top&b=41&pz=10&bct=0&xargs=0","After Taking Presidential Corruption To New Heights, Trump Calls Everyone Else Corrupt","Trump Takes Presidential Corruption To New Heights, Calls Everyone Else Corrupt","https://search.huffpost.com/click/_ylt=Awr9CKkdo6td5VIAGsdsBmVH;_ylu=X3oDMTByNWU4cGh1BGNvbG8DZ3ExBHBvcwMxBHZ0aWQDBHNlYwNzYw--/RV=2/RE=1571558301/RO=10/RU=https%3a%2f%2fwww.huffpost.com%2fentry%2ftrump-corruption-projection_n_5da8bae5e4b034f1d69f56ac/RK=2/RS=D3C2iXyBJZlgxtzQuguSDyWrVzQ-","Trump has called Democratic leaders, the news media, former President Barack Obama and the entire 2016 election “corrupt.”","","10/17/2019 04:42 pm ET","At an Oct. 2 news conference, for example, he called former Vice President Joe Biden and his son Hunter “stone, cold corrupt.” At an Oct. 11 rally in Lake Charles, Louisiana, he broadened that to all Democrats: “The radical Democrats’ policies are crazy. Their politicians are corrupt.” In an Oct. 14 statement he posted on Twitter, Trump called The New York Times corrupt. Just two days later, during a photo opportunity with the visiting president of Italy, he called his predecessor Barack Obama corrupt, as well as the entire 2016 election."
"1571529587-8276","https://search.huffpost.com/search;_ylt=Awr9IMlInatdKGMAA01sBmVH;_ylc=X1MDMTE5NzgwMzExNgRfcgMyBGZyA2h1ZmZwb3N0BGdwcmlkA3pDOXU2QklRUjN5WF9xaUtkTGhyUkEEbl9yc2x0AzAEbl9zdWdnAzEwBG9yaWdpbgNzZWFyY2guaHVmZnBvc3QuY29tBHBvcwMwBHBxc3RyAwRwcXN0cmwDMARxc3RybAMxMwRxdWVyeQNiYXJyYWNrJTIwb2JhbWEEdF9zdG1wAzE1NzE1Mjk0Mzg-?p=barrack+obama&fr2=sb-top&fr=huffpost","2","https://search.huffpost.com/search;_ylt=Awr9IlEbo6tdEXQAeZJsBmVH;_ylu=X3oDMTEza3NiY3RnBGNvbG8DZ3ExBHBvcwMxBHZ0aWQDBHNlYwNwYWdpbmF0aW9u?p=barrack+obama&fr=huffpost&fr2=sb-top&b=11&pz=10&bct=0&xargs=0","‘Uncle Joe’ Biden Courts The Youth Vote","'Uncle Joe' Biden Courts The Youth Vote","https://search.huffpost.com/click/_ylt=Awr9BNxmo6tdNZYAt3BsBmVH;_ylu=X3oDMTByNWU4cGh1BGNvbG8DZ3ExBHBvcwMxBHZ0aWQDBHNlYwNzYw--/RV=2/RE=1571558375/RO=10/RU=https%3a%2f%2fwww.huffpost.com%2fentry%2fjoe-biden-2020-young-voters_n_5d80f02ce4b00d69059f3c76/RK=2/RS=7LdoC49AHWgHZlv7TXLLUgDxoo4-","“Everybody wants another Obama and he’s the closest thing we can get,” said one student at Texas Southern University, a historically Black college in Houston.","","09/17/2019 04:17 pm ET","It’s clear why Biden’s campaign is doing this ― it’s one of his best tools in winning over not just older Black voters, but younger ones too."
"1571529558-8155","https://search.huffpost.com/search;_ylt=Awr9IMlInatdKGMAA01sBmVH;_ylc=X1MDMTE5NzgwMzExNgRfcgMyBGZyA2h1ZmZwb3N0BGdwcmlkA3pDOXU2QklRUjN5WF9xaUtkTGhyUkEEbl9yc2x0AzAEbl9zdWdnAzEwBG9yaWdpbgNzZWFyY2guaHVmZnBvc3QuY29tBHBvcwMwBHBxc3RyAwRwcXN0cmwDMARxc3RybAMxMwRxdWVyeQNiYXJyYWNrJTIwb2JhbWEEdF9zdG1wAzE1NzE1Mjk0Mzg-?p=barrack+obama&fr2=sb-top&fr=huffpost","3","https://search.huffpost.com/search;_ylt=Awr9IlEbo6tdEXQAepJsBmVH;_ylu=X3oDMTEza3NiY3RnBGNvbG8DZ3ExBHBvcwMxBHZ0aWQDBHNlYwNwYWdpbmF0aW9u?p=barrack+obama&fr=huffpost&fr2=sb-top&b=21&pz=10&bct=0&xargs=0","Joe Biden Defends Obama’s Immigration Record But Admits He’s Learned From Experience","Joe Biden Defends Obama's Immigration Record But Admits He's Learned From Experience","https://search.huffpost.com/click/_ylt=Awr9GjBOo6tdDDYA2mlsBmVH;_ylu=X3oDMTByNWU4cGh1BGNvbG8DZ3ExBHBvcwMxBHZ0aWQDBHNlYwNzYw--/RV=2/RE=1571558350/RO=10/RU=https%3a%2f%2fwww.huffpost.com%2fentry%2fvice-president-joe-biden-defends-barack-obama-immigration-policy-deportations-afscme-forum-2020-democratic-primary_n_5d45d508e4b0ca604e32e7c4/RK=2/RS=r7wNnU6DNBl29M98mPLPX7f0eVw-","The administration figured out that congressional Republicans were not using a “more rational approach” on immigration, the former vice president recalled.","","08/03/2019 03:16 pm ET","Ralston pressed Biden to reveal any details about how he might have advocated against the deportations behind closed doors during Obama’s first term. But Biden reiterated what he said during the presidential debate on Wednesday night ― that he does not reveal his discussions with Obama behind closed doors."
"1571529569-8196","https://search.huffpost.com/search;_ylt=Awr9IMlInatdKGMAA01sBmVH;_ylc=X1MDMTE5NzgwMzExNgRfcgMyBGZyA2h1ZmZwb3N0BGdwcmlkA3pDOXU2QklRUjN5WF9xaUtkTGhyUkEEbl9yc2x0AzAEbl9zdWdnAzEwBG9yaWdpbgNzZWFyY2guaHVmZnBvc3QuY29tBHBvcwMwBHBxc3RyAwRwcXN0cmwDMARxc3RybAMxMwRxdWVyeQNiYXJyYWNrJTIwb2JhbWEEdF9zdG1wAzE1NzE1Mjk0Mzg-?p=barrack+obama&fr2=sb-top&fr=huffpost","3","https://search.huffpost.com/search;_ylt=Awr9IlEbo6tdEXQAepJsBmVH;_ylu=X3oDMTEza3NiY3RnBGNvbG8DZ3ExBHBvcwMxBHZ0aWQDBHNlYwNwYWdpbmF0aW9u?p=barrack+obama&fr=huffpost&fr2=sb-top&b=21&pz=10&bct=0&xargs=0","Former President Barack Obama Remembers Toni Morrison","Former President Barack Obama Remembers Toni Morrison","https://search.huffpost.com/click/_ylt=Awr9GjBOo6tdDDYA0mlsBmVH;_ylu=X3oDMTByNWU4cGh1BGNvbG8DZ3ExBHBvcwMxBHZ0aWQDBHNlYwNzYw--/RV=2/RE=1571558350/RO=10/RU=https%3a%2f%2fwww.huffpost.com%2fentry%2fbarack-obama-toni-morrison_n_5d4992c3e4b01ae816c8fac8/RK=2/RS=CZ2aoP2qJ8l4lxONrbIQRqhKtC8-","Obama awarded the trailblazing author of “Beloved,” “Song of Solomon” and “The Bluest Eye” with the Presidential Medal of Freedom in 2012.","","08/06/2019 11:52 am ET","Time is no match for Toni Morrison. In her writing, she sometimes toyed with it, warping and creasing it, bending it to her masterful will. In her life’s story, too, she treated time nontraditionally. A child of the Great Migration who’d lifted up new, more diverse voices in American literature as an editor, Toni didn’t publish her first novel until she was 39 years old. From there followed an ascendant career—a Pulitzer, a Nobel, and so much more—and with it, a fusion of the African American story within the American story. Toni Morrison was a national treasure. Her writing was not just beautiful but meaningful—a challenge to our conscience and a call to greater empathy. She was as good a storyteller, as captivating, in person as she was on the page. And so even as Michelle and I mourn her loss and send our warmest sympathies to her family and friends, we know that her stories—that our stories—will always be with us, and with those who come after, and on and on, for all time."
"1571529518-7961","https://search.huffpost.com/search;_ylt=Awr9IMlInatdKGMAA01sBmVH;_ylc=X1MDMTE5NzgwMzExNgRfcgMyBGZyA2h1ZmZwb3N0BGdwcmlkA3pDOXU2QklRUjN5WF9xaUtkTGhyUkEEbl9yc2x0AzAEbl9zdWdnAzEwBG9yaWdpbgNzZWFyY2guaHVmZnBvc3QuY29tBHBvcwMwBHBxc3RyAwRwcXN0cmwDMARxc3RybAMxMwRxdWVyeQNiYXJyYWNrJTIwb2JhbWEEdF9zdG1wAzE1NzE1Mjk0Mzg-?p=barrack+obama&fr2=sb-top&fr=huffpost","5","https://search.huffpost.com/search;_ylt=Awr9IlEbo6tdEXQAfJJsBmVH;_ylu=X3oDMTEza3NiY3RnBGNvbG8DZ3ExBHBvcwMxBHZ0aWQDBHNlYwNwYWdpbmF0aW9u?p=barrack+obama&fr=huffpost&fr2=sb-top&b=41&pz=10&bct=0&xargs=0","Let’s Hear It For The Gadflies","Let's Hear It For The Gadflies","https://search.huffpost.com/click/_ylt=Awr9CKkdo6td5VIAEMdsBmVH;_ylu=X3oDMTByNWU4cGh1BGNvbG8DZ3ExBHBvcwMxBHZ0aWQDBHNlYwNzYw--/RV=2/RE=1571558301/RO=10/RU=https%3a%2f%2fwww.huffpost.com%2fentry%2fgadfly-candidates-democratic-debate_n_5d4260e5e4b0ca604e2cad6a/RK=2/RS=kRpIkk513fAFXzrA0dvTuF7lEJQ-","Bill de Blasio, Tulsi Gabbard and Michael Bennet aren’t going to be president. But they each shined for a moment in Wednesday’s Democratic primary debate.","","08/01/2019 12:18 am ET","The Democratic Party is in a period of transition. Many of the policies that the party supported under Presidents Bill Clinton and Barack Obama are being jettisoned, and new ideas are gaining traction."
"1571529569-8208","https://search.huffpost.com/search;_ylt=Awr9IMlInatdKGMAA01sBmVH;_ylc=X1MDMTE5NzgwMzExNgRfcgMyBGZyA2h1ZmZwb3N0BGdwcmlkA3pDOXU2QklRUjN5WF9xaUtkTGhyUkEEbl9yc2x0AzAEbl9zdWdnAzEwBG9yaWdpbgNzZWFyY2guaHVmZnBvc3QuY29tBHBvcwMwBHBxc3RyAwRwcXN0cmwDMARxc3RybAMxMwRxdWVyeQNiYXJyYWNrJTIwb2JhbWEEdF9zdG1wAzE1NzE1Mjk0Mzg-?p=barrack+obama&fr2=sb-top&fr=huffpost","3","https://search.huffpost.com/search;_ylt=Awr9IlEbo6tdEXQAepJsBmVH;_ylu=X3oDMTEza3NiY3RnBGNvbG8DZ3ExBHBvcwMxBHZ0aWQDBHNlYwNwYWdpbmF0aW9u?p=barrack+obama&fr=huffpost&fr2=sb-top&b=21&pz=10&bct=0&xargs=0","Former President Barack Obama Remembers Toni Morrison","Former President Barack Obama Remembers Toni Morrison","https://search.huffpost.com/click/_ylt=Awr9GjBOo6tdDDYA0mlsBmVH;_ylu=X3oDMTByNWU4cGh1BGNvbG8DZ3ExBHBvcwMxBHZ0aWQDBHNlYwNzYw--/RV=2/RE=1571558350/RO=10/RU=https%3a%2f%2fwww.huffpost.com%2fentry%2fbarack-obama-toni-morrison_n_5d4992c3e4b01ae816c8fac8/RK=2/RS=CZ2aoP2qJ8l4lxONrbIQRqhKtC8-","Obama awarded the trailblazing author of “Beloved,” “Song of Solomon” and “The Bluest Eye” with the Presidential Medal of Freedom in 2012.","","08/06/2019 11:52 am ET","In 2012, she told The Guardian that attending Obama’s first inauguration in 2009 was “the first time she felt truly American.”"
"1571529542-8076","https://search.huffpost.com/search;_ylt=Awr9IMlInatdKGMAA01sBmVH;_ylc=X1MDMTE5NzgwMzExNgRfcgMyBGZyA2h1ZmZwb3N0BGdwcmlkA3pDOXU2QklRUjN5WF9xaUtkTGhyUkEEbl9yc2x0AzAEbl9zdWdnAzEwBG9yaWdpbgNzZWFyY2guaHVmZnBvc3QuY29tBHBvcwMwBHBxc3RyAwRwcXN0cmwDMARxc3RybAMxMwRxdWVyeQNiYXJyYWNrJTIwb2JhbWEEdF9zdG1wAzE1NzE1Mjk0Mzg-?p=barrack+obama&fr2=sb-top&fr=huffpost","4","https://search.huffpost.com/search;_ylt=Awr9IlEbo6tdEXQAe5JsBmVH;_ylu=X3oDMTEza3NiY3RnBGNvbG8DZ3ExBHBvcwMxBHZ0aWQDBHNlYwNwYWdpbmF0aW9u?p=barrack+obama&fr=huffpost&fr2=sb-top&b=31&pz=10&bct=0&xargs=0","One Of Trump’s First Actions Reversed An Obama Rule On Guns And Mental Impairment","One Of Trump's First Actions Reversed An Obama Rule On Guns And Mental Impairment","https://search.huffpost.com/click/_ylt=Awr9DtY0o6tdceIA041sBmVH;_ylu=X3oDMTByNWU4cGh1BGNvbG8DZ3ExBHBvcwMxBHZ0aWQDBHNlYwNzYw--/RV=2/RE=1571558324/RO=10/RU=https%3a%2f%2fwww.huffpost.com%2fentry%2ftrump-obama-gun-rule_n_5d4b05dfe4b0066eb70b7a7d/RK=2/RS=sD5TM.cTrY7QP9JOljXLfbvPOtg-","Now the president wants to know what he can do through executive action.","","08/07/2019 02:19 pm ET","President Donald Trump is weighing his options for executive action on gun control following a pair of mass shootings that killed more than 30 people, according to the White House."
"1571529547-8106","https://search.huffpost.com/search;_ylt=Awr9IMlInatdKGMAA01sBmVH;_ylc=X1MDMTE5NzgwMzExNgRfcgMyBGZyA2h1ZmZwb3N0BGdwcmlkA3pDOXU2QklRUjN5WF9xaUtkTGhyUkEEbl9yc2x0AzAEbl9zdWdnAzEwBG9yaWdpbgNzZWFyY2guaHVmZnBvc3QuY29tBHBvcwMwBHBxc3RyAwRwcXN0cmwDMARxc3RybAMxMwRxdWVyeQNiYXJyYWNrJTIwb2JhbWEEdF9zdG1wAzE1NzE1Mjk0Mzg-?p=barrack+obama&fr2=sb-top&fr=huffpost","4","https://search.huffpost.com/search;_ylt=Awr9IlEbo6tdEXQAe5JsBmVH;_ylu=X3oDMTEza3NiY3RnBGNvbG8DZ3ExBHBvcwMxBHZ0aWQDBHNlYwNwYWdpbmF0aW9u?p=barrack+obama&fr=huffpost&fr2=sb-top&b=31&pz=10&bct=0&xargs=0","Obama Calls For Gun Control, Condemns Racist Language After Mass Shootings","Obama Calls For Gun Control, Condemns Racist Language After Mass Shootings","https://search.huffpost.com/click/_ylt=Awr9DtY0o6tdceIAz41sBmVH;_ylu=X3oDMTByNWU4cGh1BGNvbG8DZ3ExBHBvcwMxBHZ0aWQDBHNlYwNzYw--/RV=2/RE=1571558324/RO=10/RU=https%3a%2f%2fwww.huffpost.com%2fentry%2fobama-mass-shootings-el-paso_n_5d488292e4b0acb57fd11cd1/RK=2/RS=JCKejYiWdgW5wYlc.QlynBIVFDo-","“We should soundly reject language coming out of the mouths of any of our leaders that feeds a climate of fear and hatred,” the former president said.","","08/05/2019 04:35 pm ET","He called on the country to “send a clarion call and behave with the values of tolerance and diversity that should be the hallmark of our democracy.”"
"1571529514-7930","https://search.huffpost.com/search;_ylt=Awr9IMlInatdKGMAA01sBmVH;_ylc=X1MDMTE5NzgwMzExNgRfcgMyBGZyA2h1ZmZwb3N0BGdwcmlkA3pDOXU2QklRUjN5WF9xaUtkTGhyUkEEbl9yc2x0AzAEbl9zdWdnAzEwBG9yaWdpbgNzZWFyY2guaHVmZnBvc3QuY29tBHBvcwMwBHBxc3RyAwRwcXN0cmwDMARxc3RybAMxMwRxdWVyeQNiYXJyYWNrJTIwb2JhbWEEdF9zdG1wAzE1NzE1Mjk0Mzg-?p=barrack+obama&fr2=sb-top&fr=huffpost","5","https://search.huffpost.com/search;_ylt=Awr9IlEbo6tdEXQAfJJsBmVH;_ylu=X3oDMTEza3NiY3RnBGNvbG8DZ3ExBHBvcwMxBHZ0aWQDBHNlYwNwYWdpbmF0aW9u?p=barrack+obama&fr=huffpost&fr2=sb-top&b=41&pz=10&bct=0&xargs=0","Ex-Ethics Chief: If Trump Resort Hosting G-7 ‘Is Not Corrupt, Nothing Is’","Ex-Ethics Chief: If Trump Resort Hosting G-7 ‘Is Not Corrupt, Nothing Is'","https://search.huffpost.com/click/_ylt=Awr9CKkdo6td5VIAFMdsBmVH;_ylu=X3oDMTByNWU4cGh1BGNvbG8DZ3ExBHBvcwMxBHZ0aWQDBHNlYwNzYw--/RV=2/RE=1571558301/RO=10/RU=https%3a%2f%2fwww.huffpost.com%2fentry%2fwalter-shaub-donald-trump-g-7-resort-summit_n_5daacde7e4b0422422c53885/RK=2/RS=aWqK.T0fVvcXoh_IDmkeFxKXOrY-","“And that’s exactly what he wants,” said Walter Shaub, the former head of the U.S. Office of Government Ethics.","","10/19/2019 05:46 am ET","Walter Shaub, the former head of the U.S. Office of Government Ethics, has doubled down on his scathing criticism of the selection of President Donald Trump’s Miami golf resort to host next year’s G-7 summit."
