web-scraper-order,web-scraper-start-url,pages,pages-href,title,articles,articles-href,subtitle,author,date,content
"1571529566-8181","https://search.huffpost.com/search;_ylt=Awr9IMlInatdKGMAA01sBmVH;_ylc=X1MDMTE5NzgwMzExNgRfcgMyBGZyA2h1ZmZwb3N0BGdwcmlkA3pDOXU2QklRUjN5WF9xaUtkTGhyUkEEbl9yc2x0AzAEbl9zdWdnAzEwBG9yaWdpbgNzZWFyY2guaHVmZnBvc3QuY29tBHBvcwMwBHBxc3RyAwRwcXN0cmwDMARxc3RybAMxMwRxdWVyeQNiYXJyYWNrJTIwb2JhbWEEdF9zdG1wAzE1NzE1Mjk0Mzg-?p=barrack+obama&fr2=sb-top&fr=huffpost","3","https://search.huffpost.com/search;_ylt=Awr9IlEbo6tdEXQAepJsBmVH;_ylu=X3oDMTEza3NiY3RnBGNvbG8DZ3ExBHBvcwMxBHZ0aWQDBHNlYwNwYWdpbmF0aW9u?p=barrack+obama&fr=huffpost&fr2=sb-top&b=21&pz=10&bct=0&xargs=0","Trump Again Blames Obama For Russia’s Illegal Annexation Of Crimea","Trump Again Blames Obama For Russia's Illegal Annexation Of Crimea","https://search.huffpost.com/click/_ylt=Awr9GjBOo6tdDDYA1GlsBmVH;_ylu=X3oDMTByNWU4cGh1BGNvbG8DZ3ExBHBvcwMxBHZ0aWQDBHNlYwNzYw--/RV=2/RE=1571558350/RO=10/RU=https%3a%2f%2fwww.huffpost.com%2fentry%2ftrump-obama-russia-crimea_n_5d640110e4b058f037f4d8a6/RK=2/RS=z4i_A2rUIXhxTPXjN9DjiGIWiik-","President Trump insisted that Vladimir Putin was ousted from the G-8 “because of Obama,” ignoring that Russia violated international law.","Nina Golgowski","08/26/2019 02:26 pm ET",""
"1571529530-8008","https://search.huffpost.com/search;_ylt=Awr9IMlInatdKGMAA01sBmVH;_ylc=X1MDMTE5NzgwMzExNgRfcgMyBGZyA2h1ZmZwb3N0BGdwcmlkA3pDOXU2QklRUjN5WF9xaUtkTGhyUkEEbl9yc2x0AzAEbl9zdWdnAzEwBG9yaWdpbgNzZWFyY2guaHVmZnBvc3QuY29tBHBvcwMwBHBxc3RyAwRwcXN0cmwDMARxc3RybAMxMwRxdWVyeQNiYXJyYWNrJTIwb2JhbWEEdF9zdG1wAzE1NzE1Mjk0Mzg-?p=barrack+obama&fr2=sb-top&fr=huffpost","4","https://search.huffpost.com/search;_ylt=Awr9IlEbo6tdEXQAe5JsBmVH;_ylu=X3oDMTEza3NiY3RnBGNvbG8DZ3ExBHBvcwMxBHZ0aWQDBHNlYwNwYWdpbmF0aW9u?p=barrack+obama&fr=huffpost&fr2=sb-top&b=31&pz=10&bct=0&xargs=0","Brit Ambassador Charged That Trump Killed Iran Deal Because It Was Obama’s: Report","Brit Ambassador Charged That Trump Killed Iran Deal Because It Was Obama's: Report","https://search.huffpost.com/click/_ylt=Awr9DtY0o6tdceIA241sBmVH;_ylu=X3oDMTByNWU4cGh1BGNvbG8DZ3ExBHBvcwMxBHZ0aWQDBHNlYwNzYw--/RV=2/RE=1571558324/RO=10/RU=https%3a%2f%2fwww.huffpost.com%2fentry%2fkim-darroch-trump-diplomatic-vandalism-barack-obama_n_5d2aabafe4b02a5a5d5c0e05/RK=2/RS=miwKu.eJas8R1Mt0pPXMIaLpnag-","Sir Kim Darroch called Trump’s actions “diplomatic vandalism,” according to new cables obtained by the Daily Mail.","","07/14/2019 02:34 am ET","Darroch wrote the memos in May of last year after a failed trip to the U.S. by then-British foreign secretary Boris Johnson, who attempted to talk Trump into sticking with the nuclear agreement."
"1571529582-8266","https://search.huffpost.com/search;_ylt=Awr9IMlInatdKGMAA01sBmVH;_ylc=X1MDMTE5NzgwMzExNgRfcgMyBGZyA2h1ZmZwb3N0BGdwcmlkA3pDOXU2QklRUjN5WF9xaUtkTGhyUkEEbl9yc2x0AzAEbl9zdWdnAzEwBG9yaWdpbgNzZWFyY2guaHVmZnBvc3QuY29tBHBvcwMwBHBxc3RyAwRwcXN0cmwDMARxc3RybAMxMwRxdWVyeQNiYXJyYWNrJTIwb2JhbWEEdF9zdG1wAzE1NzE1Mjk0Mzg-?p=barrack+obama&fr2=sb-top&fr=huffpost","2","https://search.huffpost.com/search;_ylt=Awr9IlEbo6tdEXQAeZJsBmVH;_ylu=X3oDMTEza3NiY3RnBGNvbG8DZ3ExBHBvcwMxBHZ0aWQDBHNlYwNwYWdpbmF0aW9u?p=barrack+obama&fr=huffpost&fr2=sb-top&b=11&pz=10&bct=0&xargs=0","Trump Administration To Revoke Obama-Era Water Protection Rule","Trump Administration To Revoke Obama-Era Water Protection Rule","https://search.huffpost.com/click/_ylt=Awr9BNxmo6tdNZYAuXBsBmVH;_ylu=X3oDMTByNWU4cGh1BGNvbG8DZ3ExBHBvcwMxBHZ0aWQDBHNlYwNzYw--/RV=2/RE=1571558375/RO=10/RU=https%3a%2f%2fwww.huffpost.com%2fentry%2ftrump-administration-to-revoke-obama-era-water-protection-rule_n_5d7a644ae4b06028fd38855c/RK=2/RS=058KacWNkRvBDyvmI54PhgL6HwA-","Environmentalists say the move would leave millions of Americans with less safe drinking water and damage wetlands that prevent flooding.","","09/12/2019 11:36 am ET","“This repeal is a victory for land developers, oil and gas drillers and miners who will exploit that ambiguity to dredge and fill small streams and wetlands that were protected from destruction by the 2015 rule because of their critical impact on national water quality,” Southerland said."
"1571529549-8119","https://search.huffpost.com/search;_ylt=Awr9IMlInatdKGMAA01sBmVH;_ylc=X1MDMTE5NzgwMzExNgRfcgMyBGZyA2h1ZmZwb3N0BGdwcmlkA3pDOXU2QklRUjN5WF9xaUtkTGhyUkEEbl9yc2x0AzAEbl9zdWdnAzEwBG9yaWdpbgNzZWFyY2guaHVmZnBvc3QuY29tBHBvcwMwBHBxc3RyAwRwcXN0cmwDMARxc3RybAMxMwRxdWVyeQNiYXJyYWNrJTIwb2JhbWEEdF9zdG1wAzE1NzE1Mjk0Mzg-?p=barrack+obama&fr2=sb-top&fr=huffpost","4","https://search.huffpost.com/search;_ylt=Awr9IlEbo6tdEXQAe5JsBmVH;_ylu=X3oDMTEza3NiY3RnBGNvbG8DZ3ExBHBvcwMxBHZ0aWQDBHNlYwNwYWdpbmF0aW9u?p=barrack+obama&fr=huffpost&fr2=sb-top&b=31&pz=10&bct=0&xargs=0","Michelle And Barack Obama Share Touching Birthday Tributes To Her Mom","Michelle And Barack Obama Share Touching Birthday Tributes To Her Mom","https://search.huffpost.com/click/_ylt=Awr9DtY0o6tdceIAzY1sBmVH;_ylu=X3oDMTByNWU4cGh1BGNvbG8DZ3ExBHBvcwMxBHZ0aWQDBHNlYwNzYw--/RV=2/RE=1571558324/RO=10/RU=https%3a%2f%2fwww.huffpost.com%2fentry%2fmichelle-obama-barack-birthday-tribute-mom_n_5d40133ae4b0db8affae0c0b/RK=2/RS=Yfqa__M0uvhMH61H7qiWMLWOPlk-","The former first lady and president posted sweet messages for Marian Robinson on Instagram.","","07/30/2019 07:21 am ET","“But what you haven’t seen is the way she’s been there for us every day ― not just for Michelle and our daughters, but for me, too,” he wrote. “I’ve always appreciated her steadiness, her perspective, and the way a wisecrack from her reverberates around the room.”"
"1571529561-8173","https://search.huffpost.com/search;_ylt=Awr9IMlInatdKGMAA01sBmVH;_ylc=X1MDMTE5NzgwMzExNgRfcgMyBGZyA2h1ZmZwb3N0BGdwcmlkA3pDOXU2QklRUjN5WF9xaUtkTGhyUkEEbl9yc2x0AzAEbl9zdWdnAzEwBG9yaWdpbgNzZWFyY2guaHVmZnBvc3QuY29tBHBvcwMwBHBxc3RyAwRwcXN0cmwDMARxc3RybAMxMwRxdWVyeQNiYXJyYWNrJTIwb2JhbWEEdF9zdG1wAzE1NzE1Mjk0Mzg-?p=barrack+obama&fr2=sb-top&fr=huffpost","3","https://search.huffpost.com/search;_ylt=Awr9IlEbo6tdEXQAepJsBmVH;_ylu=X3oDMTEza3NiY3RnBGNvbG8DZ3ExBHBvcwMxBHZ0aWQDBHNlYwNwYWdpbmF0aW9u?p=barrack+obama&fr=huffpost&fr2=sb-top&b=21&pz=10&bct=0&xargs=0","Biden Poses What-If Of Obama Assassination To Explain How 1968 Jolted America","Biden Poses Hypothetical Of Obama Assassination To Explain How 1968 Jolted America","https://search.huffpost.com/click/_ylt=Awr9GjBOo6tdDDYA2GlsBmVH;_ylu=X3oDMTByNWU4cGh1BGNvbG8DZ3ExBHBvcwMxBHZ0aWQDBHNlYwNzYw--/RV=2/RE=1571558350/RO=10/RU=https%3a%2f%2fwww.huffpost.com%2fentry%2fjoe-biden-obama-assassinated-comment_n_5d607748e4b0b59d2574a604/RK=2/RS=oC_qVIlLt3aD4gbE.BgMDLo6Agw-","The former vice president told students at a presidential campaign event how the deaths of Bobby Kennedy and Martin Luther King Jr. led to his political awakening.","","08/23/2019 09:50 pm ET","“Unless I’m mistaken, Donald Trump did for your generation what the loss of two of my heroes did for mine,” he said to the students in the audience. “What they did was make you realize, my God, we’re in trouble.”"
"1571529533-8020","https://search.huffpost.com/search;_ylt=Awr9IMlInatdKGMAA01sBmVH;_ylc=X1MDMTE5NzgwMzExNgRfcgMyBGZyA2h1ZmZwb3N0BGdwcmlkA3pDOXU2QklRUjN5WF9xaUtkTGhyUkEEbl9yc2x0AzAEbl9zdWdnAzEwBG9yaWdpbgNzZWFyY2guaHVmZnBvc3QuY29tBHBvcwMwBHBxc3RyAwRwcXN0cmwDMARxc3RybAMxMwRxdWVyeQNiYXJyYWNrJTIwb2JhbWEEdF9zdG1wAzE1NzE1Mjk0Mzg-?p=barrack+obama&fr2=sb-top&fr=huffpost","4","https://search.huffpost.com/search;_ylt=Awr9IlEbo6tdEXQAe5JsBmVH;_ylu=X3oDMTEza3NiY3RnBGNvbG8DZ3ExBHBvcwMxBHZ0aWQDBHNlYwNwYWdpbmF0aW9u?p=barrack+obama&fr=huffpost&fr2=sb-top&b=31&pz=10&bct=0&xargs=0","Cory Booker Says He ‘Wouldn’t Be Running’ If Obama Ran For Third Term","Cory Booker Says He 'Wouldn't Be Running' If Obama Ran For Third Term","https://search.huffpost.com/click/_ylt=Awr9DtY0o6tdceIA2Y1sBmVH;_ylu=X3oDMTByNWU4cGh1BGNvbG8DZ3ExBHBvcwMxBHZ0aWQDBHNlYwNzYw--/RV=2/RE=1571558324/RO=10/RU=https%3a%2f%2fwww.huffpost.com%2fentry%2fcory-booker-president-obama_n_5d430597e4b0aca3411a44cf/RK=2/RS=QvQnnvfUFvu4FvmJ9Y641GmGUQc-","“I miss Obama... He is our statesman,” said the senator on CNN’s “New Day” on Thursday.","","08/01/2019 12:41 pm ET","“If you want to compare records ― and frankly, I’m shocked that you do ― I am happy to do that,” said Booker at one point."
"1571529592-8325","https://search.huffpost.com/search;_ylt=Awr9IMlInatdKGMAA01sBmVH;_ylc=X1MDMTE5NzgwMzExNgRfcgMyBGZyA2h1ZmZwb3N0BGdwcmlkA3pDOXU2QklRUjN5WF9xaUtkTGhyUkEEbl9yc2x0AzAEbl9zdWdnAzEwBG9yaWdpbgNzZWFyY2guaHVmZnBvc3QuY29tBHBvcwMwBHBxc3RyAwRwcXN0cmwDMARxc3RybAMxMwRxdWVyeQNiYXJyYWNrJTIwb2JhbWEEdF9zdG1wAzE1NzE1Mjk0Mzg-?p=barrack+obama&fr2=sb-top&fr=huffpost","2","https://search.huffpost.com/search;_ylt=Awr9IlEbo6tdEXQAeZJsBmVH;_ylu=X3oDMTEza3NiY3RnBGNvbG8DZ3ExBHBvcwMxBHZ0aWQDBHNlYwNwYWdpbmF0aW9u?p=barrack+obama&fr=huffpost&fr2=sb-top&b=11&pz=10&bct=0&xargs=0","Trump’s Cabinet Has Had More Ex-Lobbyists Than Obama Or Bush","Trump's Cabinet Has Had More Ex-Lobbyists Than Obama Or Bush","https://search.huffpost.com/click/_ylt=Awr9BNxmo6tdNZYAs3BsBmVH;_ylu=X3oDMTByNWU4cGh1BGNvbG8DZ3ExBHBvcwMxBHZ0aWQDBHNlYwNzYw--/RV=2/RE=1571558375/RO=10/RU=https%3a%2f%2fwww.huffpost.com%2fentry%2ftrumps-cabinet-has-had-more-ex-lobbyists-than-obama-or-bush_n_5d811fb0e4b077dcbd6567de/RK=2/RS=VM_1CF2C4AhZxB4H0MUJ1U.3ihQ-","Former lobbyists run the Defense and Interior departments, Environmental Protection Agency and office of the U.S. Trade Representative.","","09/17/2019 02:12 pm ET","An Interior spokesman said in a statement, “Secretary Bernhardt is and always has been committed to upholding his ethical responsibilities, and he has fully complied with those obligations.”"
"1571529507-7896","https://search.huffpost.com/search;_ylt=Awr9IMlInatdKGMAA01sBmVH;_ylc=X1MDMTE5NzgwMzExNgRfcgMyBGZyA2h1ZmZwb3N0BGdwcmlkA3pDOXU2QklRUjN5WF9xaUtkTGhyUkEEbl9yc2x0AzAEbl9zdWdnAzEwBG9yaWdpbgNzZWFyY2guaHVmZnBvc3QuY29tBHBvcwMwBHBxc3RyAwRwcXN0cmwDMARxc3RybAMxMwRxdWVyeQNiYXJyYWNrJTIwb2JhbWEEdF9zdG1wAzE1NzE1Mjk0Mzg-?p=barrack+obama&fr2=sb-top&fr=huffpost","5","https://search.huffpost.com/search;_ylt=Awr9IlEbo6tdEXQAfJJsBmVH;_ylu=X3oDMTEza3NiY3RnBGNvbG8DZ3ExBHBvcwMxBHZ0aWQDBHNlYwNwYWdpbmF0aW9u?p=barrack+obama&fr=huffpost&fr2=sb-top&b=41&pz=10&bct=0&xargs=0","After Taking Presidential Corruption To New Heights, Trump Calls Everyone Else Corrupt","Trump Takes Presidential Corruption To New Heights, Calls Everyone Else Corrupt","https://search.huffpost.com/click/_ylt=Awr9CKkdo6td5VIAGsdsBmVH;_ylu=X3oDMTByNWU4cGh1BGNvbG8DZ3ExBHBvcwMxBHZ0aWQDBHNlYwNzYw--/RV=2/RE=1571558301/RO=10/RU=https%3a%2f%2fwww.huffpost.com%2fentry%2ftrump-corruption-projection_n_5da8bae5e4b034f1d69f56ac/RK=2/RS=D3C2iXyBJZlgxtzQuguSDyWrVzQ-","Trump has called Democratic leaders, the news media, former President Barack Obama and the entire 2016 election “corrupt.”","","10/17/2019 04:42 pm ET","Josh Schwerin, a former spokesman for 2016 Democratic presidential nominee Hillary Clinton, recalled Trump’s response when Clinton accused Trump of behaving like Russian dictator Vladimir Putin’s puppet. “No puppet. No puppet. You’re the puppet,” Trump replied at the third and final presidential debate."
"1571529547-8103","https://search.huffpost.com/search;_ylt=Awr9IMlInatdKGMAA01sBmVH;_ylc=X1MDMTE5NzgwMzExNgRfcgMyBGZyA2h1ZmZwb3N0BGdwcmlkA3pDOXU2QklRUjN5WF9xaUtkTGhyUkEEbl9yc2x0AzAEbl9zdWdnAzEwBG9yaWdpbgNzZWFyY2guaHVmZnBvc3QuY29tBHBvcwMwBHBxc3RyAwRwcXN0cmwDMARxc3RybAMxMwRxdWVyeQNiYXJyYWNrJTIwb2JhbWEEdF9zdG1wAzE1NzE1Mjk0Mzg-?p=barrack+obama&fr2=sb-top&fr=huffpost","4","https://search.huffpost.com/search;_ylt=Awr9IlEbo6tdEXQAe5JsBmVH;_ylu=X3oDMTEza3NiY3RnBGNvbG8DZ3ExBHBvcwMxBHZ0aWQDBHNlYwNwYWdpbmF0aW9u?p=barrack+obama&fr=huffpost&fr2=sb-top&b=31&pz=10&bct=0&xargs=0","Obama Calls For Gun Control, Condemns Racist Language After Mass Shootings","Obama Calls For Gun Control, Condemns Racist Language After Mass Shootings","https://search.huffpost.com/click/_ylt=Awr9DtY0o6tdceIAz41sBmVH;_ylu=X3oDMTByNWU4cGh1BGNvbG8DZ3ExBHBvcwMxBHZ0aWQDBHNlYwNzYw--/RV=2/RE=1571558324/RO=10/RU=https%3a%2f%2fwww.huffpost.com%2fentry%2fobama-mass-shootings-el-paso_n_5d488292e4b0acb57fd11cd1/RK=2/RS=JCKejYiWdgW5wYlc.QlynBIVFDo-","“We should soundly reject language coming out of the mouths of any of our leaders that feeds a climate of fear and hatred,” the former president said.","","08/05/2019 04:35 pm ET","He put out a statement Monday, after mass shootings in El Paso, Texas, and Dayton, Ohio, claimed at least 31 lives and injured dozens more over the weekend. During his presidency, Obama spoke after more than a dozen mass shootings, and memorably wept as he gave a speech in the aftermath of the massacre at Sandy Hook Elementary School."
"1571529599-8396","https://search.huffpost.com/search;_ylt=Awr9IMlInatdKGMAA01sBmVH;_ylc=X1MDMTE5NzgwMzExNgRfcgMyBGZyA2h1ZmZwb3N0BGdwcmlkA3pDOXU2QklRUjN5WF9xaUtkTGhyUkEEbl9yc2x0AzAEbl9zdWdnAzEwBG9yaWdpbgNzZWFyY2guaHVmZnBvc3QuY29tBHBvcwMwBHBxc3RyAwRwcXN0cmwDMARxc3RybAMxMwRxdWVyeQNiYXJyYWNrJTIwb2JhbWEEdF9zdG1wAzE1NzE1Mjk0Mzg-?p=barrack+obama&fr2=sb-top&fr=huffpost","2","https://search.huffpost.com/search;_ylt=Awr9IlEbo6tdEXQAeZJsBmVH;_ylu=X3oDMTEza3NiY3RnBGNvbG8DZ3ExBHBvcwMxBHZ0aWQDBHNlYwNwYWdpbmF0aW9u?p=barrack+obama&fr=huffpost&fr2=sb-top&b=11&pz=10&bct=0&xargs=0","Obama Takes Rare Swipe At Trump By Naming 2 Things A President Shouldn’t Do","Obama Takes Rare Swipe At Trump By Naming 2 Things A President Shouldn't Do","https://search.huffpost.com/click/_ylt=Awr9BNxmo6tdNZYArXBsBmVH;_ylu=X3oDMTByNWU4cGh1BGNvbG8DZ3ExBHBvcwMxBHZ0aWQDBHNlYwNzYw--/RV=2/RE=1571558375/RO=10/RU=https%3a%2f%2fwww.huffpost.com%2fentry%2fbarack-obama-donald-trump-social-media_n_5d82ddc8e4b0957256b0f015/RK=2/RS=B8iq5ng9hoMSENVkUhLATwlP2bU-","And Trump does both. A lot.","","09/19/2019 02:45 am ET","The “modern-day” occupant of the White House has surrounded himself with aides and associates who are now in legal trouble. Former campaign manager Paul Manafort and former personal attorney Michael Cohen are currently serving prison time. Former campaign adviser George Papadopoulos served a 12-day sentence. Former national security adviser Michael Flynn is awaiting sentencing. And longtime aide Roger Stone is charged with lying to Congress in a trial set to begin in November."
"1571529558-8161","https://search.huffpost.com/search;_ylt=Awr9IMlInatdKGMAA01sBmVH;_ylc=X1MDMTE5NzgwMzExNgRfcgMyBGZyA2h1ZmZwb3N0BGdwcmlkA3pDOXU2QklRUjN5WF9xaUtkTGhyUkEEbl9yc2x0AzAEbl9zdWdnAzEwBG9yaWdpbgNzZWFyY2guaHVmZnBvc3QuY29tBHBvcwMwBHBxc3RyAwRwcXN0cmwDMARxc3RybAMxMwRxdWVyeQNiYXJyYWNrJTIwb2JhbWEEdF9zdG1wAzE1NzE1Mjk0Mzg-?p=barrack+obama&fr2=sb-top&fr=huffpost","3","https://search.huffpost.com/search;_ylt=Awr9IlEbo6tdEXQAepJsBmVH;_ylu=X3oDMTEza3NiY3RnBGNvbG8DZ3ExBHBvcwMxBHZ0aWQDBHNlYwNwYWdpbmF0aW9u?p=barrack+obama&fr=huffpost&fr2=sb-top&b=21&pz=10&bct=0&xargs=0","Joe Biden Defends Obama’s Immigration Record But Admits He’s Learned From Experience","Joe Biden Defends Obama's Immigration Record But Admits He's Learned From Experience","https://search.huffpost.com/click/_ylt=Awr9GjBOo6tdDDYA2mlsBmVH;_ylu=X3oDMTByNWU4cGh1BGNvbG8DZ3ExBHBvcwMxBHZ0aWQDBHNlYwNzYw--/RV=2/RE=1571558350/RO=10/RU=https%3a%2f%2fwww.huffpost.com%2fentry%2fvice-president-joe-biden-defends-barack-obama-immigration-policy-deportations-afscme-forum-2020-democratic-primary_n_5d45d508e4b0ca604e32e7c4/RK=2/RS=r7wNnU6DNBl29M98mPLPX7f0eVw-","The administration figured out that congressional Republicans were not using a “more rational approach” on immigration, the former vice president recalled.","","08/03/2019 03:16 pm ET","“We pressed and pressed,” Biden said. “The fact of the matter is, there were other things happening as well.”"
"1571529545-8095","https://search.huffpost.com/search;_ylt=Awr9IMlInatdKGMAA01sBmVH;_ylc=X1MDMTE5NzgwMzExNgRfcgMyBGZyA2h1ZmZwb3N0BGdwcmlkA3pDOXU2QklRUjN5WF9xaUtkTGhyUkEEbl9yc2x0AzAEbl9zdWdnAzEwBG9yaWdpbgNzZWFyY2guaHVmZnBvc3QuY29tBHBvcwMwBHBxc3RyAwRwcXN0cmwDMARxc3RybAMxMwRxdWVyeQNiYXJyYWNrJTIwb2JhbWEEdF9zdG1wAzE1NzE1Mjk0Mzg-?p=barrack+obama&fr2=sb-top&fr=huffpost","4","https://search.huffpost.com/search;_ylt=Awr9IlEbo6tdEXQAe5JsBmVH;_ylu=X3oDMTEza3NiY3RnBGNvbG8DZ3ExBHBvcwMxBHZ0aWQDBHNlYwNwYWdpbmF0aW9u?p=barrack+obama&fr=huffpost&fr2=sb-top&b=31&pz=10&bct=0&xargs=0","Obama Announces New Push In Fight Against Gerrymandering","Obama Announces New Push In Fight Against Gerrymandering","https://search.huffpost.com/click/_ylt=Awr9DtY0o6tdceIA0Y1sBmVH;_ylu=X3oDMTByNWU4cGh1BGNvbG8DZ3ExBHBvcwMxBHZ0aWQDBHNlYwNzYw--/RV=2/RE=1571558324/RO=10/RU=https%3a%2f%2fwww.huffpost.com%2fentry%2fobama-gerrymandering-training_n_5d655e7ae4b01fcc690aa2cc/RK=2/RS=DgwOlASjr1o9Hln8IyDyM6sokBM-","A new program will train people in the basics of redistricting and why it matters to their everyday lives.","","08/27/2019 01:29 pm ET","For decades, redistricting in many places has been done behind closed doors, with lawmakers quietly negotiating deals to get the districts they want. Emails from lawmakers made public in litigation in Wisconsin, Michigan and Ohio, among other places, have shed light on just how unsavory those negotiations are. In Michigan, for example, a Republican staffer wrote happily about cramming “Dem garbage” into four districts."
"1571529592-8330","https://search.huffpost.com/search;_ylt=Awr9IMlInatdKGMAA01sBmVH;_ylc=X1MDMTE5NzgwMzExNgRfcgMyBGZyA2h1ZmZwb3N0BGdwcmlkA3pDOXU2QklRUjN5WF9xaUtkTGhyUkEEbl9yc2x0AzAEbl9zdWdnAzEwBG9yaWdpbgNzZWFyY2guaHVmZnBvc3QuY29tBHBvcwMwBHBxc3RyAwRwcXN0cmwDMARxc3RybAMxMwRxdWVyeQNiYXJyYWNrJTIwb2JhbWEEdF9zdG1wAzE1NzE1Mjk0Mzg-?p=barrack+obama&fr2=sb-top&fr=huffpost","2","https://search.huffpost.com/search;_ylt=Awr9IlEbo6tdEXQAeZJsBmVH;_ylu=X3oDMTEza3NiY3RnBGNvbG8DZ3ExBHBvcwMxBHZ0aWQDBHNlYwNwYWdpbmF0aW9u?p=barrack+obama&fr=huffpost&fr2=sb-top&b=11&pz=10&bct=0&xargs=0","Trump’s Cabinet Has Had More Ex-Lobbyists Than Obama Or Bush","Trump's Cabinet Has Had More Ex-Lobbyists Than Obama Or Bush","https://search.huffpost.com/click/_ylt=Awr9BNxmo6tdNZYAs3BsBmVH;_ylu=X3oDMTByNWU4cGh1BGNvbG8DZ3ExBHBvcwMxBHZ0aWQDBHNlYwNzYw--/RV=2/RE=1571558375/RO=10/RU=https%3a%2f%2fwww.huffpost.com%2fentry%2ftrumps-cabinet-has-had-more-ex-lobbyists-than-obama-or-bush_n_5d811fb0e4b077dcbd6567de/RK=2/RS=VM_1CF2C4AhZxB4H0MUJ1U.3ihQ-","Former lobbyists run the Defense and Interior departments, Environmental Protection Agency and office of the U.S. Trade Representative.","","09/17/2019 02:12 pm ET","But Canter’s organization, known as CREW, urged the EPA inspector general earlier this year to investigate whether Wheeler broke his ethics pledge. Among the allegations, CREW said Wheeler had participated in the easing of standards for storing coal ash in 2018 even though he had lobbied on those regulations the year before for Murray Energy."
"1571529601-8402","https://search.huffpost.com/search;_ylt=Awr9IMlInatdKGMAA01sBmVH;_ylc=X1MDMTE5NzgwMzExNgRfcgMyBGZyA2h1ZmZwb3N0BGdwcmlkA3pDOXU2QklRUjN5WF9xaUtkTGhyUkEEbl9yc2x0AzAEbl9zdWdnAzEwBG9yaWdpbgNzZWFyY2guaHVmZnBvc3QuY29tBHBvcwMwBHBxc3RyAwRwcXN0cmwDMARxc3RybAMxMwRxdWVyeQNiYXJyYWNrJTIwb2JhbWEEdF9zdG1wAzE1NzE1Mjk0Mzg-?p=barrack+obama&fr2=sb-top&fr=huffpost","2","https://search.huffpost.com/search;_ylt=Awr9IlEbo6tdEXQAeZJsBmVH;_ylu=X3oDMTEza3NiY3RnBGNvbG8DZ3ExBHBvcwMxBHZ0aWQDBHNlYwNwYWdpbmF0aW9u?p=barrack+obama&fr=huffpost&fr2=sb-top&b=11&pz=10&bct=0&xargs=0","Barack Obama Mourns The Passing Of Cokie Roberts","Barack Obama Mourns The Passing Of Cokie Roberts","https://search.huffpost.com/click/_ylt=Awr9BNxmo6tdNZYAq3BsBmVH;_ylu=X3oDMTByNWU4cGh1BGNvbG8DZ3ExBHBvcwMxBHZ0aWQDBHNlYwNzYw--/RV=2/RE=1571558375/RO=10/RU=https%3a%2f%2fwww.huffpost.com%2fentry%2fpresident-barack-obama-cokie-roberts_n_5d8101d7e4b03b5fc88a7734/RK=2/RS=w9H1PzNrc7xW.x4K1tT9X6Use2g-","The former president hailed the veteran journalist’s “trailblazing” work in the field, a stark contrast from Trump’s response that Roberts “never treated me nicely.”","","09/17/2019 01:19 pm ET","In 2017, Roberts said she felt privileged to have had a career in the “front seat to history.”"
"1571529582-8250","https://search.huffpost.com/search;_ylt=Awr9IMlInatdKGMAA01sBmVH;_ylc=X1MDMTE5NzgwMzExNgRfcgMyBGZyA2h1ZmZwb3N0BGdwcmlkA3pDOXU2QklRUjN5WF9xaUtkTGhyUkEEbl9yc2x0AzAEbl9zdWdnAzEwBG9yaWdpbgNzZWFyY2guaHVmZnBvc3QuY29tBHBvcwMwBHBxc3RyAwRwcXN0cmwDMARxc3RybAMxMwRxdWVyeQNiYXJyYWNrJTIwb2JhbWEEdF9zdG1wAzE1NzE1Mjk0Mzg-?p=barrack+obama&fr2=sb-top&fr=huffpost","2","https://search.huffpost.com/search;_ylt=Awr9IlEbo6tdEXQAeZJsBmVH;_ylu=X3oDMTEza3NiY3RnBGNvbG8DZ3ExBHBvcwMxBHZ0aWQDBHNlYwNwYWdpbmF0aW9u?p=barrack+obama&fr=huffpost&fr2=sb-top&b=11&pz=10&bct=0&xargs=0","Trump Administration To Revoke Obama-Era Water Protection Rule","Trump Administration To Revoke Obama-Era Water Protection Rule","https://search.huffpost.com/click/_ylt=Awr9BNxmo6tdNZYAuXBsBmVH;_ylu=X3oDMTByNWU4cGh1BGNvbG8DZ3ExBHBvcwMxBHZ0aWQDBHNlYwNzYw--/RV=2/RE=1571558375/RO=10/RU=https%3a%2f%2fwww.huffpost.com%2fentry%2ftrump-administration-to-revoke-obama-era-water-protection-rule_n_5d7a644ae4b06028fd38855c/RK=2/RS=058KacWNkRvBDyvmI54PhgL6HwA-","Environmentalists say the move would leave millions of Americans with less safe drinking water and damage wetlands that prevent flooding.","","09/12/2019 11:36 am ET","Even before the official announcement, scheduled for later Thursday, environmental groups blasted the administration’s action, the latest in a series of moves to roll back environmental protections put into place under former President Barack Obama."
"1571529549-8115","https://search.huffpost.com/search;_ylt=Awr9IMlInatdKGMAA01sBmVH;_ylc=X1MDMTE5NzgwMzExNgRfcgMyBGZyA2h1ZmZwb3N0BGdwcmlkA3pDOXU2QklRUjN5WF9xaUtkTGhyUkEEbl9yc2x0AzAEbl9zdWdnAzEwBG9yaWdpbgNzZWFyY2guaHVmZnBvc3QuY29tBHBvcwMwBHBxc3RyAwRwcXN0cmwDMARxc3RybAMxMwRxdWVyeQNiYXJyYWNrJTIwb2JhbWEEdF9zdG1wAzE1NzE1Mjk0Mzg-?p=barrack+obama&fr2=sb-top&fr=huffpost","4","https://search.huffpost.com/search;_ylt=Awr9IlEbo6tdEXQAe5JsBmVH;_ylu=X3oDMTEza3NiY3RnBGNvbG8DZ3ExBHBvcwMxBHZ0aWQDBHNlYwNwYWdpbmF0aW9u?p=barrack+obama&fr=huffpost&fr2=sb-top&b=31&pz=10&bct=0&xargs=0","Michelle And Barack Obama Share Touching Birthday Tributes To Her Mom","Michelle And Barack Obama Share Touching Birthday Tributes To Her Mom","https://search.huffpost.com/click/_ylt=Awr9DtY0o6tdceIAzY1sBmVH;_ylu=X3oDMTByNWU4cGh1BGNvbG8DZ3ExBHBvcwMxBHZ0aWQDBHNlYwNzYw--/RV=2/RE=1571558324/RO=10/RU=https%3a%2f%2fwww.huffpost.com%2fentry%2fmichelle-obama-barack-birthday-tribute-mom_n_5d40133ae4b0db8affae0c0b/RK=2/RS=Yfqa__M0uvhMH61H7qiWMLWOPlk-","The former first lady and president posted sweet messages for Marian Robinson on Instagram.","","07/30/2019 07:21 am ET","Michelle Obama shared this undated throwback snap of her mom:"
"1571529576-8226","https://search.huffpost.com/search;_ylt=Awr9IMlInatdKGMAA01sBmVH;_ylc=X1MDMTE5NzgwMzExNgRfcgMyBGZyA2h1ZmZwb3N0BGdwcmlkA3pDOXU2QklRUjN5WF9xaUtkTGhyUkEEbl9yc2x0AzAEbl9zdWdnAzEwBG9yaWdpbgNzZWFyY2guaHVmZnBvc3QuY29tBHBvcwMwBHBxc3RyAwRwcXN0cmwDMARxc3RybAMxMwRxdWVyeQNiYXJyYWNrJTIwb2JhbWEEdF9zdG1wAzE1NzE1Mjk0Mzg-?p=barrack+obama&fr2=sb-top&fr=huffpost","3","https://search.huffpost.com/search;_ylt=Awr9IlEbo6tdEXQAepJsBmVH;_ylu=X3oDMTEza3NiY3RnBGNvbG8DZ3ExBHBvcwMxBHZ0aWQDBHNlYwNwYWdpbmF0aW9u?p=barrack+obama&fr=huffpost&fr2=sb-top&b=21&pz=10&bct=0&xargs=0","CNN Nails Hypocrisy Of Donald Trump’s Attacks On Barack Obama’s Golfing","CNN Nails Hypocrisy Of Trump’s Attacks On Obama's Golfing","https://search.huffpost.com/click/_ylt=Awr9GjBOo6tdDDYAzGlsBmVH;_ylu=X3oDMTByNWU4cGh1BGNvbG8DZ3ExBHBvcwMxBHZ0aWQDBHNlYwNzYw--/RV=2/RE=1571558350/RO=10/RU=https%3a%2f%2fwww.huffpost.com%2fentry%2fcnn-supercut-donald-trump-obama-golf_n_5d6f89dee4b09bbc9ef74c18/RK=2/RS=1VWim4RVUzCFucnFrjGhxvO5P5k-","“I’m not gonna have time to go play golf,” Trump says in the mocking supercut of his past comments.","Lee Moran","09/04/2019 06:18 am ET",""
"1571529539-8044","https://search.huffpost.com/search;_ylt=Awr9IMlInatdKGMAA01sBmVH;_ylc=X1MDMTE5NzgwMzExNgRfcgMyBGZyA2h1ZmZwb3N0BGdwcmlkA3pDOXU2QklRUjN5WF9xaUtkTGhyUkEEbl9yc2x0AzAEbl9zdWdnAzEwBG9yaWdpbgNzZWFyY2guaHVmZnBvc3QuY29tBHBvcwMwBHBxc3RyAwRwcXN0cmwDMARxc3RybAMxMwRxdWVyeQNiYXJyYWNrJTIwb2JhbWEEdF9zdG1wAzE1NzE1Mjk0Mzg-?p=barrack+obama&fr2=sb-top&fr=huffpost","4","https://search.huffpost.com/search;_ylt=Awr9IlEbo6tdEXQAe5JsBmVH;_ylu=X3oDMTEza3NiY3RnBGNvbG8DZ3ExBHBvcwMxBHZ0aWQDBHNlYwNwYWdpbmF0aW9u?p=barrack+obama&fr=huffpost&fr2=sb-top&b=31&pz=10&bct=0&xargs=0","How Immigration Prosecutions Helped ICE Pad Obama’s Criminal Deportee Statistics","How Immigration Prosecutions Helped ICE Pad Obama's Criminal Deportee Statistics","https://search.huffpost.com/click/_ylt=Awr9DtY0o6tdceIA1Y1sBmVH;_ylu=X3oDMTByNWU4cGh1BGNvbG8DZ3ExBHBvcwMxBHZ0aWQDBHNlYwNzYw--/RV=2/RE=1571558324/RO=10/RU=https%3a%2f%2fwww.huffpost.com%2fentry%2fice-obama-criminal-deportation-statistics_n_5d52b1aee4b05fa9df04c9e5/RK=2/RS=beZiJRGpAj71.7xi6X7lnrGurPI-","Under Obama, Immigration and Customs Enforcement highlighted stats that those arrested at the border were criminals. Most had broken only immigration laws.","","08/15/2019 01:11 pm ET","While convicts made up nearly half of those deported from the border region from 2013 to 2016, the data makes it clear that there weren’t hordes of violent criminals. Traffic violations accounted for the second-highest number of criminal convictions for border deportees, making up 11% to 14% for those years."
