web-scraper-order,web-scraper-start-url,pages,pages-href,title,articles,articles-href,subtitle,author,date,content
"1571529597-8370","https://search.huffpost.com/search;_ylt=Awr9IMlInatdKGMAA01sBmVH;_ylc=X1MDMTE5NzgwMzExNgRfcgMyBGZyA2h1ZmZwb3N0BGdwcmlkA3pDOXU2QklRUjN5WF9xaUtkTGhyUkEEbl9yc2x0AzAEbl9zdWdnAzEwBG9yaWdpbgNzZWFyY2guaHVmZnBvc3QuY29tBHBvcwMwBHBxc3RyAwRwcXN0cmwDMARxc3RybAMxMwRxdWVyeQNiYXJyYWNrJTIwb2JhbWEEdF9zdG1wAzE1NzE1Mjk0Mzg-?p=barrack+obama&fr2=sb-top&fr=huffpost","2","https://search.huffpost.com/search;_ylt=Awr9IlEbo6tdEXQAeZJsBmVH;_ylu=X3oDMTEza3NiY3RnBGNvbG8DZ3ExBHBvcwMxBHZ0aWQDBHNlYwNwYWdpbmF0aW9u?p=barrack+obama&fr=huffpost&fr2=sb-top&b=11&pz=10&bct=0&xargs=0","Julián Castro Hits Hard At Biden On Health Care And Immigration During Debate","Julián Castro Hits Hard At Biden On Health Care And Immigration During Debate","https://search.huffpost.com/click/_ylt=Awr9BNxmo6tdNZYAr3BsBmVH;_ylu=X3oDMTByNWU4cGh1BGNvbG8DZ3ExBHBvcwMxBHZ0aWQDBHNlYwNzYw--/RV=2/RE=1571558375/RO=10/RU=https%3a%2f%2fwww.huffpost.com%2fentry%2fjulian-castro-joe-biden-democratic-debates-houston_n_5d7aeface4b077dcbd5b40b7/RK=2/RS=syPnkVEPLa5ULY4J6N.RozdzzyY-","The former housing secretary did not hold back against former Vice President Joe Biden at the Democratic presidential debate in Houston.","","09/12/2019 10:36 pm ET","The exchange began when Univision host Jorge Ramos, who co-moderated the debate, asked Biden whether he considered the administration’s harder-line approach to immigration a “mistake.” Ramos also asked why Latinos should trust Biden, given his service in an Obama administration in which immigration reform advocates increasingly find fault."
"1571529597-8371","https://search.huffpost.com/search;_ylt=Awr9IMlInatdKGMAA01sBmVH;_ylc=X1MDMTE5NzgwMzExNgRfcgMyBGZyA2h1ZmZwb3N0BGdwcmlkA3pDOXU2QklRUjN5WF9xaUtkTGhyUkEEbl9yc2x0AzAEbl9zdWdnAzEwBG9yaWdpbgNzZWFyY2guaHVmZnBvc3QuY29tBHBvcwMwBHBxc3RyAwRwcXN0cmwDMARxc3RybAMxMwRxdWVyeQNiYXJyYWNrJTIwb2JhbWEEdF9zdG1wAzE1NzE1Mjk0Mzg-?p=barrack+obama&fr2=sb-top&fr=huffpost","2","https://search.huffpost.com/search;_ylt=Awr9IlEbo6tdEXQAeZJsBmVH;_ylu=X3oDMTEza3NiY3RnBGNvbG8DZ3ExBHBvcwMxBHZ0aWQDBHNlYwNwYWdpbmF0aW9u?p=barrack+obama&fr=huffpost&fr2=sb-top&b=11&pz=10&bct=0&xargs=0","Julián Castro Hits Hard At Biden On Health Care And Immigration During Debate","Julián Castro Hits Hard At Biden On Health Care And Immigration During Debate","https://search.huffpost.com/click/_ylt=Awr9BNxmo6tdNZYAr3BsBmVH;_ylu=X3oDMTByNWU4cGh1BGNvbG8DZ3ExBHBvcwMxBHZ0aWQDBHNlYwNzYw--/RV=2/RE=1571558375/RO=10/RU=https%3a%2f%2fwww.huffpost.com%2fentry%2fjulian-castro-joe-biden-democratic-debates-houston_n_5d7aeface4b077dcbd5b40b7/RK=2/RS=syPnkVEPLa5ULY4J6N.RozdzzyY-","The former housing secretary did not hold back against former Vice President Joe Biden at the Democratic presidential debate in Houston.","","09/12/2019 10:36 pm ET","Biden first fell back on a stock answer. “Comparing [President Obama] to the president we have is outrageous,” he said."
"1571529592-8333","https://search.huffpost.com/search;_ylt=Awr9IMlInatdKGMAA01sBmVH;_ylc=X1MDMTE5NzgwMzExNgRfcgMyBGZyA2h1ZmZwb3N0BGdwcmlkA3pDOXU2QklRUjN5WF9xaUtkTGhyUkEEbl9yc2x0AzAEbl9zdWdnAzEwBG9yaWdpbgNzZWFyY2guaHVmZnBvc3QuY29tBHBvcwMwBHBxc3RyAwRwcXN0cmwDMARxc3RybAMxMwRxdWVyeQNiYXJyYWNrJTIwb2JhbWEEdF9zdG1wAzE1NzE1Mjk0Mzg-?p=barrack+obama&fr2=sb-top&fr=huffpost","2","https://search.huffpost.com/search;_ylt=Awr9IlEbo6tdEXQAeZJsBmVH;_ylu=X3oDMTEza3NiY3RnBGNvbG8DZ3ExBHBvcwMxBHZ0aWQDBHNlYwNwYWdpbmF0aW9u?p=barrack+obama&fr=huffpost&fr2=sb-top&b=11&pz=10&bct=0&xargs=0","Trump’s Cabinet Has Had More Ex-Lobbyists Than Obama Or Bush","Trump's Cabinet Has Had More Ex-Lobbyists Than Obama Or Bush","https://search.huffpost.com/click/_ylt=Awr9BNxmo6tdNZYAs3BsBmVH;_ylu=X3oDMTByNWU4cGh1BGNvbG8DZ3ExBHBvcwMxBHZ0aWQDBHNlYwNzYw--/RV=2/RE=1571558375/RO=10/RU=https%3a%2f%2fwww.huffpost.com%2fentry%2ftrumps-cabinet-has-had-more-ex-lobbyists-than-obama-or-bush_n_5d811fb0e4b077dcbd6567de/RK=2/RS=VM_1CF2C4AhZxB4H0MUJ1U.3ihQ-","Former lobbyists run the Defense and Interior departments, Environmental Protection Agency and office of the U.S. Trade Representative.","","09/17/2019 02:12 pm ET","The Pentagon’s top official, Mark Esper, spent seven years lobbying for defense industry juggernaut Raytheon, a company that stands to gain handsomely from Trump’s push to boost military spending by billions of dollars. The company closed out 2018 by hitting a record $27.1 billion in net sales, up nearly seven percent from the $25.3 billion the year before."
"1571529539-8063","https://search.huffpost.com/search;_ylt=Awr9IMlInatdKGMAA01sBmVH;_ylc=X1MDMTE5NzgwMzExNgRfcgMyBGZyA2h1ZmZwb3N0BGdwcmlkA3pDOXU2QklRUjN5WF9xaUtkTGhyUkEEbl9yc2x0AzAEbl9zdWdnAzEwBG9yaWdpbgNzZWFyY2guaHVmZnBvc3QuY29tBHBvcwMwBHBxc3RyAwRwcXN0cmwDMARxc3RybAMxMwRxdWVyeQNiYXJyYWNrJTIwb2JhbWEEdF9zdG1wAzE1NzE1Mjk0Mzg-?p=barrack+obama&fr2=sb-top&fr=huffpost","4","https://search.huffpost.com/search;_ylt=Awr9IlEbo6tdEXQAe5JsBmVH;_ylu=X3oDMTEza3NiY3RnBGNvbG8DZ3ExBHBvcwMxBHZ0aWQDBHNlYwNwYWdpbmF0aW9u?p=barrack+obama&fr=huffpost&fr2=sb-top&b=31&pz=10&bct=0&xargs=0","How Immigration Prosecutions Helped ICE Pad Obama’s Criminal Deportee Statistics","How Immigration Prosecutions Helped ICE Pad Obama's Criminal Deportee Statistics","https://search.huffpost.com/click/_ylt=Awr9DtY0o6tdceIA1Y1sBmVH;_ylu=X3oDMTByNWU4cGh1BGNvbG8DZ3ExBHBvcwMxBHZ0aWQDBHNlYwNzYw--/RV=2/RE=1571558324/RO=10/RU=https%3a%2f%2fwww.huffpost.com%2fentry%2fice-obama-criminal-deportation-statistics_n_5d52b1aee4b05fa9df04c9e5/RK=2/RS=beZiJRGpAj71.7xi6X7lnrGurPI-","Under Obama, Immigration and Customs Enforcement highlighted stats that those arrested at the border were criminals. Most had broken only immigration laws.","","08/15/2019 01:11 pm ET","Former ICE officials defended the agency’s statistical work, contending that they did not intend to mislead the public. They pointed to the series of memos beginning in 2011 that aimed at prioritizing serious criminals, which account for the steady decrease in deportations from inside the country overall. And they insisted that Obama’s policy of focusing on criminal convicts made more efficient use of limited deportation resources than Trump’s policy of casting priorities aside."
"1571529582-8262","https://search.huffpost.com/search;_ylt=Awr9IMlInatdKGMAA01sBmVH;_ylc=X1MDMTE5NzgwMzExNgRfcgMyBGZyA2h1ZmZwb3N0BGdwcmlkA3pDOXU2QklRUjN5WF9xaUtkTGhyUkEEbl9yc2x0AzAEbl9zdWdnAzEwBG9yaWdpbgNzZWFyY2guaHVmZnBvc3QuY29tBHBvcwMwBHBxc3RyAwRwcXN0cmwDMARxc3RybAMxMwRxdWVyeQNiYXJyYWNrJTIwb2JhbWEEdF9zdG1wAzE1NzE1Mjk0Mzg-?p=barrack+obama&fr2=sb-top&fr=huffpost","2","https://search.huffpost.com/search;_ylt=Awr9IlEbo6tdEXQAeZJsBmVH;_ylu=X3oDMTEza3NiY3RnBGNvbG8DZ3ExBHBvcwMxBHZ0aWQDBHNlYwNwYWdpbmF0aW9u?p=barrack+obama&fr=huffpost&fr2=sb-top&b=11&pz=10&bct=0&xargs=0","Trump Administration To Revoke Obama-Era Water Protection Rule","Trump Administration To Revoke Obama-Era Water Protection Rule","https://search.huffpost.com/click/_ylt=Awr9BNxmo6tdNZYAuXBsBmVH;_ylu=X3oDMTByNWU4cGh1BGNvbG8DZ3ExBHBvcwMxBHZ0aWQDBHNlYwNzYw--/RV=2/RE=1571558375/RO=10/RU=https%3a%2f%2fwww.huffpost.com%2fentry%2ftrump-administration-to-revoke-obama-era-water-protection-rule_n_5d7a644ae4b06028fd38855c/RK=2/RS=058KacWNkRvBDyvmI54PhgL6HwA-","Environmentalists say the move would leave millions of Americans with less safe drinking water and damage wetlands that prevent flooding.","","09/12/2019 11:36 am ET","The question of which waters are covered under the Clean Water Act has inspired decades of lawsuits and congressional debate."
"1571529599-8391","https://search.huffpost.com/search;_ylt=Awr9IMlInatdKGMAA01sBmVH;_ylc=X1MDMTE5NzgwMzExNgRfcgMyBGZyA2h1ZmZwb3N0BGdwcmlkA3pDOXU2QklRUjN5WF9xaUtkTGhyUkEEbl9yc2x0AzAEbl9zdWdnAzEwBG9yaWdpbgNzZWFyY2guaHVmZnBvc3QuY29tBHBvcwMwBHBxc3RyAwRwcXN0cmwDMARxc3RybAMxMwRxdWVyeQNiYXJyYWNrJTIwb2JhbWEEdF9zdG1wAzE1NzE1Mjk0Mzg-?p=barrack+obama&fr2=sb-top&fr=huffpost","2","https://search.huffpost.com/search;_ylt=Awr9IlEbo6tdEXQAeZJsBmVH;_ylu=X3oDMTEza3NiY3RnBGNvbG8DZ3ExBHBvcwMxBHZ0aWQDBHNlYwNwYWdpbmF0aW9u?p=barrack+obama&fr=huffpost&fr2=sb-top&b=11&pz=10&bct=0&xargs=0","Obama Takes Rare Swipe At Trump By Naming 2 Things A President Shouldn’t Do","Obama Takes Rare Swipe At Trump By Naming 2 Things A President Shouldn't Do","https://search.huffpost.com/click/_ylt=Awr9BNxmo6tdNZYArXBsBmVH;_ylu=X3oDMTByNWU4cGh1BGNvbG8DZ3ExBHBvcwMxBHZ0aWQDBHNlYwNzYw--/RV=2/RE=1571558375/RO=10/RU=https%3a%2f%2fwww.huffpost.com%2fentry%2fbarack-obama-donald-trump-social-media_n_5d82ddc8e4b0957256b0f015/RK=2/RS=B8iq5ng9hoMSENVkUhLATwlP2bU-","And Trump does both. A lot.","","09/19/2019 02:45 am ET","“Those are two things I would advise, if you’re our president, not to do,” he added, per The Washington Post. “It creates a lot of noise and clouds your judgment.”"
"1571529511-7926","https://search.huffpost.com/search;_ylt=Awr9IMlInatdKGMAA01sBmVH;_ylc=X1MDMTE5NzgwMzExNgRfcgMyBGZyA2h1ZmZwb3N0BGdwcmlkA3pDOXU2QklRUjN5WF9xaUtkTGhyUkEEbl9yc2x0AzAEbl9zdWdnAzEwBG9yaWdpbgNzZWFyY2guaHVmZnBvc3QuY29tBHBvcwMwBHBxc3RyAwRwcXN0cmwDMARxc3RybAMxMwRxdWVyeQNiYXJyYWNrJTIwb2JhbWEEdF9zdG1wAzE1NzE1Mjk0Mzg-?p=barrack+obama&fr2=sb-top&fr=huffpost","5","https://search.huffpost.com/search;_ylt=Awr9IlEbo6tdEXQAfJJsBmVH;_ylu=X3oDMTEza3NiY3RnBGNvbG8DZ3ExBHBvcwMxBHZ0aWQDBHNlYwNwYWdpbmF0aW9u?p=barrack+obama&fr=huffpost&fr2=sb-top&b=41&pz=10&bct=0&xargs=0","April Ryan Abruptly Drops Out Of Fundraiser Interview With Pete Buttigieg","April Ryan Abruptly Drops Out Of Fundraiser Interview With Pete Buttigieg","https://search.huffpost.com/click/_ylt=Awr9CKkdo6td5VIAFsdsBmVH;_ylu=X3oDMTByNWU4cGh1BGNvbG8DZ3ExBHBvcwMxBHZ0aWQDBHNlYwNzYw--/RV=2/RE=1571558301/RO=10/RU=https%3a%2f%2fwww.huffpost.com%2fentry%2fapril-ryan-pete-buttigieg-campaign-event_n_5daa013be4b0f34e3a7540a6/RK=2/RS=UZtqVJLlTugcWhCPtjUpFWuYcN4-","The CNN political analyst and Washington bureau chief for American Urban Radio Networks said she didn’t realize it was a fundraiser.","","10/18/2019 05:15 pm ET","Neither Ryan nor Buttigieg’s campaign immediately responded to HuffPost’s requests for comment."
"1571529507-7887","https://search.huffpost.com/search;_ylt=Awr9IMlInatdKGMAA01sBmVH;_ylc=X1MDMTE5NzgwMzExNgRfcgMyBGZyA2h1ZmZwb3N0BGdwcmlkA3pDOXU2QklRUjN5WF9xaUtkTGhyUkEEbl9yc2x0AzAEbl9zdWdnAzEwBG9yaWdpbgNzZWFyY2guaHVmZnBvc3QuY29tBHBvcwMwBHBxc3RyAwRwcXN0cmwDMARxc3RybAMxMwRxdWVyeQNiYXJyYWNrJTIwb2JhbWEEdF9zdG1wAzE1NzE1Mjk0Mzg-?p=barrack+obama&fr2=sb-top&fr=huffpost","5","https://search.huffpost.com/search;_ylt=Awr9IlEbo6tdEXQAfJJsBmVH;_ylu=X3oDMTEza3NiY3RnBGNvbG8DZ3ExBHBvcwMxBHZ0aWQDBHNlYwNwYWdpbmF0aW9u?p=barrack+obama&fr=huffpost&fr2=sb-top&b=41&pz=10&bct=0&xargs=0","After Taking Presidential Corruption To New Heights, Trump Calls Everyone Else Corrupt","Trump Takes Presidential Corruption To New Heights, Calls Everyone Else Corrupt","https://search.huffpost.com/click/_ylt=Awr9CKkdo6td5VIAGsdsBmVH;_ylu=X3oDMTByNWU4cGh1BGNvbG8DZ3ExBHBvcwMxBHZ0aWQDBHNlYwNzYw--/RV=2/RE=1571558301/RO=10/RU=https%3a%2f%2fwww.huffpost.com%2fentry%2ftrump-corruption-projection_n_5da8bae5e4b034f1d69f56ac/RK=2/RS=D3C2iXyBJZlgxtzQuguSDyWrVzQ-","Trump has called Democratic leaders, the news media, former President Barack Obama and the entire 2016 election “corrupt.”","","10/17/2019 04:42 pm ET","“He has no shame,” said Joe Walsh, a former Illinois congressman who is running against Trump for the 2020 Republican nomination. “He’s incapable of shame. That’s not normal.”"
"1571529589-8300","https://search.huffpost.com/search;_ylt=Awr9IMlInatdKGMAA01sBmVH;_ylc=X1MDMTE5NzgwMzExNgRfcgMyBGZyA2h1ZmZwb3N0BGdwcmlkA3pDOXU2QklRUjN5WF9xaUtkTGhyUkEEbl9yc2x0AzAEbl9zdWdnAzEwBG9yaWdpbgNzZWFyY2guaHVmZnBvc3QuY29tBHBvcwMwBHBxc3RyAwRwcXN0cmwDMARxc3RybAMxMwRxdWVyeQNiYXJyYWNrJTIwb2JhbWEEdF9zdG1wAzE1NzE1Mjk0Mzg-?p=barrack+obama&fr2=sb-top&fr=huffpost","2","https://search.huffpost.com/search;_ylt=Awr9IlEbo6tdEXQAeZJsBmVH;_ylu=X3oDMTEza3NiY3RnBGNvbG8DZ3ExBHBvcwMxBHZ0aWQDBHNlYwNwYWdpbmF0aW9u?p=barrack+obama&fr=huffpost&fr2=sb-top&b=11&pz=10&bct=0&xargs=0","‘Saudi Arabia Should Fight Their Own Wars,’ Trump Tweeted ... When Obama Was President","'Saudi Arabia Should Fight Their Own Wars,' Trump Tweeted ... When Obama Was President","https://search.huffpost.com/click/_ylt=Awr9BNxmo6tdNZYAtXBsBmVH;_ylu=X3oDMTByNWU4cGh1BGNvbG8DZ3ExBHBvcwMxBHZ0aWQDBHNlYwNzYw--/RV=2/RE=1571558375/RO=10/RU=https%3a%2f%2fwww.huffpost.com%2fentry%2fsaudis-fight-their-own-wars-trump-locked-and-loaded_n_5d8000f1e4b00d69059d53a2/RK=2/RS=Gn7Ti3hNU25BTXKD1yfLgB0MRWk-","He’s changed his tune now as he waits to “hear from the Kingdom” regarding a response to the attack on Saudi oil facilities.","","09/16/2019 07:43 pm ET","The attacks early Saturday on a massive oil field and refinery disrupted about 50% of Saudi oil output — 5% of the entire global supply."
"1571529580-8239","https://search.huffpost.com/search;_ylt=Awr9IMlInatdKGMAA01sBmVH;_ylc=X1MDMTE5NzgwMzExNgRfcgMyBGZyA2h1ZmZwb3N0BGdwcmlkA3pDOXU2QklRUjN5WF9xaUtkTGhyUkEEbl9yc2x0AzAEbl9zdWdnAzEwBG9yaWdpbgNzZWFyY2guaHVmZnBvc3QuY29tBHBvcwMwBHBxc3RyAwRwcXN0cmwDMARxc3RybAMxMwRxdWVyeQNiYXJyYWNrJTIwb2JhbWEEdF9zdG1wAzE1NzE1Mjk0Mzg-?p=barrack+obama&fr2=sb-top&fr=huffpost","2","https://search.huffpost.com/search;_ylt=Awr9IlEbo6tdEXQAeZJsBmVH;_ylu=X3oDMTEza3NiY3RnBGNvbG8DZ3ExBHBvcwMxBHZ0aWQDBHNlYwNwYWdpbmF0aW9u?p=barrack+obama&fr=huffpost&fr2=sb-top&b=11&pz=10&bct=0&xargs=0","Van Jones: Hillary Clinton Is Playing A ‘Dangerous Game’ With Tulsi Gabbard Remarks","Van Jones: Hillary Clinton Is Playing A 'Dangerous Game' With Tulsi Gabbard Remarks","https://search.huffpost.com/click/_ylt=Awr9BNxmo6tdNZYAu3BsBmVH;_ylu=X3oDMTByNWU4cGh1BGNvbG8DZ3ExBHBvcwMxBHZ0aWQDBHNlYwNzYw--/RV=2/RE=1571558375/RO=10/RU=https%3a%2f%2fwww.huffpost.com%2fentry%2fvan-jones-hillary-clinton-tulsi-gabbard-russia_n_5dab2311e4b0422422c5998b/RK=2/RS=j2hWnXT4Sl8S052RgZxum6SgJ_8-","The CNN host said he doesn’t want Clinton’s comments on Gabbard and Russia to “legitimate these kind of attacks against anybody.”","","10/19/2019 03:44 pm ET","Though many interpreted Clinton’s “grooming” comment as referring to the Russians, Clinton spokesperson Nick Merrill said on Twitter on Friday that the 2016 Democratic presidential nominee was referencing the Republican Party."
"1571529539-8061","https://search.huffpost.com/search;_ylt=Awr9IMlInatdKGMAA01sBmVH;_ylc=X1MDMTE5NzgwMzExNgRfcgMyBGZyA2h1ZmZwb3N0BGdwcmlkA3pDOXU2QklRUjN5WF9xaUtkTGhyUkEEbl9yc2x0AzAEbl9zdWdnAzEwBG9yaWdpbgNzZWFyY2guaHVmZnBvc3QuY29tBHBvcwMwBHBxc3RyAwRwcXN0cmwDMARxc3RybAMxMwRxdWVyeQNiYXJyYWNrJTIwb2JhbWEEdF9zdG1wAzE1NzE1Mjk0Mzg-?p=barrack+obama&fr2=sb-top&fr=huffpost","4","https://search.huffpost.com/search;_ylt=Awr9IlEbo6tdEXQAe5JsBmVH;_ylu=X3oDMTEza3NiY3RnBGNvbG8DZ3ExBHBvcwMxBHZ0aWQDBHNlYwNwYWdpbmF0aW9u?p=barrack+obama&fr=huffpost&fr2=sb-top&b=31&pz=10&bct=0&xargs=0","How Immigration Prosecutions Helped ICE Pad Obama’s Criminal Deportee Statistics","How Immigration Prosecutions Helped ICE Pad Obama's Criminal Deportee Statistics","https://search.huffpost.com/click/_ylt=Awr9DtY0o6tdceIA1Y1sBmVH;_ylu=X3oDMTByNWU4cGh1BGNvbG8DZ3ExBHBvcwMxBHZ0aWQDBHNlYwNzYw--/RV=2/RE=1571558324/RO=10/RU=https%3a%2f%2fwww.huffpost.com%2fentry%2fice-obama-criminal-deportation-statistics_n_5d52b1aee4b05fa9df04c9e5/RK=2/RS=beZiJRGpAj71.7xi6X7lnrGurPI-","Under Obama, Immigration and Customs Enforcement highlighted stats that those arrested at the border were criminals. Most had broken only immigration laws.","","08/15/2019 01:11 pm ET","Thousands of other deportees removed from inside the country during that period had no criminal convictions at all ― ranging from 17.5% in 2013 to 7.6% in Obama’s last year."
"1571529507-7893","https://search.huffpost.com/search;_ylt=Awr9IMlInatdKGMAA01sBmVH;_ylc=X1MDMTE5NzgwMzExNgRfcgMyBGZyA2h1ZmZwb3N0BGdwcmlkA3pDOXU2QklRUjN5WF9xaUtkTGhyUkEEbl9yc2x0AzAEbl9zdWdnAzEwBG9yaWdpbgNzZWFyY2guaHVmZnBvc3QuY29tBHBvcwMwBHBxc3RyAwRwcXN0cmwDMARxc3RybAMxMwRxdWVyeQNiYXJyYWNrJTIwb2JhbWEEdF9zdG1wAzE1NzE1Mjk0Mzg-?p=barrack+obama&fr2=sb-top&fr=huffpost","5","https://search.huffpost.com/search;_ylt=Awr9IlEbo6tdEXQAfJJsBmVH;_ylu=X3oDMTEza3NiY3RnBGNvbG8DZ3ExBHBvcwMxBHZ0aWQDBHNlYwNwYWdpbmF0aW9u?p=barrack+obama&fr=huffpost&fr2=sb-top&b=41&pz=10&bct=0&xargs=0","After Taking Presidential Corruption To New Heights, Trump Calls Everyone Else Corrupt","Trump Takes Presidential Corruption To New Heights, Calls Everyone Else Corrupt","https://search.huffpost.com/click/_ylt=Awr9CKkdo6td5VIAGsdsBmVH;_ylu=X3oDMTByNWU4cGh1BGNvbG8DZ3ExBHBvcwMxBHZ0aWQDBHNlYwNzYw--/RV=2/RE=1571558301/RO=10/RU=https%3a%2f%2fwww.huffpost.com%2fentry%2ftrump-corruption-projection_n_5da8bae5e4b034f1d69f56ac/RK=2/RS=D3C2iXyBJZlgxtzQuguSDyWrVzQ-","Trump has called Democratic leaders, the news media, former President Barack Obama and the entire 2016 election “corrupt.”","","10/17/2019 04:42 pm ET","Others Trump has labeled “corrupt” in recent weeks: former FBI director James Comey, former FBI agent Peter Strzok, former FBI lawyer Lisa Page, the entire Mueller investigation into the help Russia gave Trump in winning the 2016 election, all of the news media, California Democratic congressman Adam Schiff and CNN."
"1571529542-8075","https://search.huffpost.com/search;_ylt=Awr9IMlInatdKGMAA01sBmVH;_ylc=X1MDMTE5NzgwMzExNgRfcgMyBGZyA2h1ZmZwb3N0BGdwcmlkA3pDOXU2QklRUjN5WF9xaUtkTGhyUkEEbl9yc2x0AzAEbl9zdWdnAzEwBG9yaWdpbgNzZWFyY2guaHVmZnBvc3QuY29tBHBvcwMwBHBxc3RyAwRwcXN0cmwDMARxc3RybAMxMwRxdWVyeQNiYXJyYWNrJTIwb2JhbWEEdF9zdG1wAzE1NzE1Mjk0Mzg-?p=barrack+obama&fr2=sb-top&fr=huffpost","4","https://search.huffpost.com/search;_ylt=Awr9IlEbo6tdEXQAe5JsBmVH;_ylu=X3oDMTEza3NiY3RnBGNvbG8DZ3ExBHBvcwMxBHZ0aWQDBHNlYwNwYWdpbmF0aW9u?p=barrack+obama&fr=huffpost&fr2=sb-top&b=31&pz=10&bct=0&xargs=0","One Of Trump’s First Actions Reversed An Obama Rule On Guns And Mental Impairment","One Of Trump's First Actions Reversed An Obama Rule On Guns And Mental Impairment","https://search.huffpost.com/click/_ylt=Awr9DtY0o6tdceIA041sBmVH;_ylu=X3oDMTByNWU4cGh1BGNvbG8DZ3ExBHBvcwMxBHZ0aWQDBHNlYwNzYw--/RV=2/RE=1571558324/RO=10/RU=https%3a%2f%2fwww.huffpost.com%2fentry%2ftrump-obama-gun-rule_n_5d4b05dfe4b0066eb70b7a7d/RK=2/RS=sD5TM.cTrY7QP9JOljXLfbvPOtg-","Now the president wants to know what he can do through executive action.","Arthur Delaney","08/07/2019 02:19 pm ET",""
"1571529572-8212","https://search.huffpost.com/search;_ylt=Awr9IMlInatdKGMAA01sBmVH;_ylc=X1MDMTE5NzgwMzExNgRfcgMyBGZyA2h1ZmZwb3N0BGdwcmlkA3pDOXU2QklRUjN5WF9xaUtkTGhyUkEEbl9yc2x0AzAEbl9zdWdnAzEwBG9yaWdpbgNzZWFyY2guaHVmZnBvc3QuY29tBHBvcwMwBHBxc3RyAwRwcXN0cmwDMARxc3RybAMxMwRxdWVyeQNiYXJyYWNrJTIwb2JhbWEEdF9zdG1wAzE1NzE1Mjk0Mzg-?p=barrack+obama&fr2=sb-top&fr=huffpost","3","https://search.huffpost.com/search;_ylt=Awr9IlEbo6tdEXQAepJsBmVH;_ylu=X3oDMTEza3NiY3RnBGNvbG8DZ3ExBHBvcwMxBHZ0aWQDBHNlYwNwYWdpbmF0aW9u?p=barrack+obama&fr=huffpost&fr2=sb-top&b=21&pz=10&bct=0&xargs=0","Julián Castro On Immigration Spar With Joe Biden: ‘This Is Not About Obama’","Julian Castro On Immigration Spar With Joe Biden: 'This Is Not About Obama'","https://search.huffpost.com/click/_ylt=Awr9GjBOo6tdDDYA0GlsBmVH;_ylu=X3oDMTByNWU4cGh1BGNvbG8DZ3ExBHBvcwMxBHZ0aWQDBHNlYwNzYw--/RV=2/RE=1571558350/RO=10/RU=https%3a%2f%2fwww.huffpost.com%2fentry%2fjulian-castro-immigration-joe-biden-ascme_n_5d45add6e4b0aca3411e87dd/RK=2/RS=hp0D592bIeTWMOHEue4izsfO2x0-","The former Obama housing chief clarified his stance on the ex-president’s immigration policy after clashing with Joe Biden over Obama-era deportations.","","08/03/2019 01:32 pm ET","“This is not about criticizing President Obama,” Castro said during the AFSCME’s forum on public service co-moderated by HuffPost in Las Vegas on Saturday. “This is about, ‘OK, what does the next administration have to do in the face of a President Trump that is absolutely terrible.’”"
"1571529566-8182","https://search.huffpost.com/search;_ylt=Awr9IMlInatdKGMAA01sBmVH;_ylc=X1MDMTE5NzgwMzExNgRfcgMyBGZyA2h1ZmZwb3N0BGdwcmlkA3pDOXU2QklRUjN5WF9xaUtkTGhyUkEEbl9yc2x0AzAEbl9zdWdnAzEwBG9yaWdpbgNzZWFyY2guaHVmZnBvc3QuY29tBHBvcwMwBHBxc3RyAwRwcXN0cmwDMARxc3RybAMxMwRxdWVyeQNiYXJyYWNrJTIwb2JhbWEEdF9zdG1wAzE1NzE1Mjk0Mzg-?p=barrack+obama&fr2=sb-top&fr=huffpost","3","https://search.huffpost.com/search;_ylt=Awr9IlEbo6tdEXQAepJsBmVH;_ylu=X3oDMTEza3NiY3RnBGNvbG8DZ3ExBHBvcwMxBHZ0aWQDBHNlYwNwYWdpbmF0aW9u?p=barrack+obama&fr=huffpost&fr2=sb-top&b=21&pz=10&bct=0&xargs=0","Trump Again Blames Obama For Russia’s Illegal Annexation Of Crimea","Trump Again Blames Obama For Russia's Illegal Annexation Of Crimea","https://search.huffpost.com/click/_ylt=Awr9GjBOo6tdDDYA1GlsBmVH;_ylu=X3oDMTByNWU4cGh1BGNvbG8DZ3ExBHBvcwMxBHZ0aWQDBHNlYwNzYw--/RV=2/RE=1571558350/RO=10/RU=https%3a%2f%2fwww.huffpost.com%2fentry%2ftrump-obama-russia-crimea_n_5d640110e4b058f037f4d8a6/RK=2/RS=z4i_A2rUIXhxTPXjN9DjiGIWiik-","President Trump insisted that Vladimir Putin was ousted from the G-8 “because of Obama,” ignoring that Russia violated international law.","","08/26/2019 02:26 pm ET","President Donald Trump is repeating his claim that Russia was booted from the G-8 group of major industrial nations because former President Barack Obama was “outsmarted” by Russia when it illegally annexed Crimea in 2014."
"1571529582-8263","https://search.huffpost.com/search;_ylt=Awr9IMlInatdKGMAA01sBmVH;_ylc=X1MDMTE5NzgwMzExNgRfcgMyBGZyA2h1ZmZwb3N0BGdwcmlkA3pDOXU2QklRUjN5WF9xaUtkTGhyUkEEbl9yc2x0AzAEbl9zdWdnAzEwBG9yaWdpbgNzZWFyY2guaHVmZnBvc3QuY29tBHBvcwMwBHBxc3RyAwRwcXN0cmwDMARxc3RybAMxMwRxdWVyeQNiYXJyYWNrJTIwb2JhbWEEdF9zdG1wAzE1NzE1Mjk0Mzg-?p=barrack+obama&fr2=sb-top&fr=huffpost","2","https://search.huffpost.com/search;_ylt=Awr9IlEbo6tdEXQAeZJsBmVH;_ylu=X3oDMTEza3NiY3RnBGNvbG8DZ3ExBHBvcwMxBHZ0aWQDBHNlYwNwYWdpbmF0aW9u?p=barrack+obama&fr=huffpost&fr2=sb-top&b=11&pz=10&bct=0&xargs=0","Trump Administration To Revoke Obama-Era Water Protection Rule","Trump Administration To Revoke Obama-Era Water Protection Rule","https://search.huffpost.com/click/_ylt=Awr9BNxmo6tdNZYAuXBsBmVH;_ylu=X3oDMTByNWU4cGh1BGNvbG8DZ3ExBHBvcwMxBHZ0aWQDBHNlYwNzYw--/RV=2/RE=1571558375/RO=10/RU=https%3a%2f%2fwww.huffpost.com%2fentry%2ftrump-administration-to-revoke-obama-era-water-protection-rule_n_5d7a644ae4b06028fd38855c/RK=2/RS=058KacWNkRvBDyvmI54PhgL6HwA-","Environmentalists say the move would leave millions of Americans with less safe drinking water and damage wetlands that prevent flooding.","","09/12/2019 11:36 am ET","A sharply divided Supreme Court in 2006 produced three differing opinions, leading the Obama administration to craft its rule. It provided federal oversight to upstream tributaries and headwaters, including wetlands, ponds, lakes and streams that can affect the quality of navigable waters."
"1571529521-7965","https://search.huffpost.com/search;_ylt=Awr9IMlInatdKGMAA01sBmVH;_ylc=X1MDMTE5NzgwMzExNgRfcgMyBGZyA2h1ZmZwb3N0BGdwcmlkA3pDOXU2QklRUjN5WF9xaUtkTGhyUkEEbl9yc2x0AzAEbl9zdWdnAzEwBG9yaWdpbgNzZWFyY2guaHVmZnBvc3QuY29tBHBvcwMwBHBxc3RyAwRwcXN0cmwDMARxc3RybAMxMwRxdWVyeQNiYXJyYWNrJTIwb2JhbWEEdF9zdG1wAzE1NzE1Mjk0Mzg-?p=barrack+obama&fr2=sb-top&fr=huffpost","5","https://search.huffpost.com/search;_ylt=Awr9IlEbo6tdEXQAfJJsBmVH;_ylu=X3oDMTEza3NiY3RnBGNvbG8DZ3ExBHBvcwMxBHZ0aWQDBHNlYwNwYWdpbmF0aW9u?p=barrack+obama&fr=huffpost&fr2=sb-top&b=41&pz=10&bct=0&xargs=0","Obama Remembers Former Supreme Court Justice John Paul Stevens","Obama Remembers Former Supreme Court Justice John Paul Stevens","https://search.huffpost.com/click/_ylt=Awr9CKkdo6td5VIADsdsBmVH;_ylu=X3oDMTByNWU4cGh1BGNvbG8DZ3ExBHBvcwMxBHZ0aWQDBHNlYwNzYw--/RV=2/RE=1571558301/RO=10/RU=https%3a%2f%2fwww.huffpost.com%2fentry%2fobama-remembers-justice-john-paul-stevens_n_5d2e7189e4b085eda5a37e8b/RK=2/RS=hx_3NttSz14dU2K8KD9LkOmzefs-","Stevens, the third-longest-serving justice, retired during President Barack Obama’s first term.","","07/17/2019 10:07 am ET","Stevens retired from the high court in 2010 after serving on the bench for almost 35 years. He was the third-longest-serving justice of the Supreme Court."
"1571529601-8398","https://search.huffpost.com/search;_ylt=Awr9IMlInatdKGMAA01sBmVH;_ylc=X1MDMTE5NzgwMzExNgRfcgMyBGZyA2h1ZmZwb3N0BGdwcmlkA3pDOXU2QklRUjN5WF9xaUtkTGhyUkEEbl9yc2x0AzAEbl9zdWdnAzEwBG9yaWdpbgNzZWFyY2guaHVmZnBvc3QuY29tBHBvcwMwBHBxc3RyAwRwcXN0cmwDMARxc3RybAMxMwRxdWVyeQNiYXJyYWNrJTIwb2JhbWEEdF9zdG1wAzE1NzE1Mjk0Mzg-?p=barrack+obama&fr2=sb-top&fr=huffpost","2","https://search.huffpost.com/search;_ylt=Awr9IlEbo6tdEXQAeZJsBmVH;_ylu=X3oDMTEza3NiY3RnBGNvbG8DZ3ExBHBvcwMxBHZ0aWQDBHNlYwNwYWdpbmF0aW9u?p=barrack+obama&fr=huffpost&fr2=sb-top&b=11&pz=10&bct=0&xargs=0","Barack Obama Mourns The Passing Of Cokie Roberts","Barack Obama Mourns The Passing Of Cokie Roberts","https://search.huffpost.com/click/_ylt=Awr9BNxmo6tdNZYAq3BsBmVH;_ylu=X3oDMTByNWU4cGh1BGNvbG8DZ3ExBHBvcwMxBHZ0aWQDBHNlYwNzYw--/RV=2/RE=1571558375/RO=10/RU=https%3a%2f%2fwww.huffpost.com%2fentry%2fpresident-barack-obama-cokie-roberts_n_5d8101d7e4b03b5fc88a7734/RK=2/RS=w9H1PzNrc7xW.x4K1tT9X6Use2g-","The former president hailed the veteran journalist’s “trailblazing” work in the field, a stark contrast from Trump’s response that Roberts “never treated me nicely.”","","09/17/2019 01:19 pm ET","After the veteran ABC News journalist died Monday at age 75, former President Barack Obama hailed Roberts as a “trailblazing figure” and an inspirational icon."
